Attribute,Description,Valid Values,DependsOn,Required,Properties,Parent,DependsOn Component,Source,Validation Rules,Nonpreferred Terms,Ontology Identifier,Ontology Url,NCIt Code,Notes
10-cell RNA Sequencing,A procedure that can determine the RNA sequences for all or part of the poly-A tail-containing messenger RNA transcripts in an individual.,,,FALSE,,Assay,,pubMed,,10-cell rna sequencing,PMID:30894605,https://pubmed.ncbi.nlm.nih.gov/30894605/,,
16S Ribosomal Gene Sequencing Assay,,,,FALSE,,Assay,,OBI,,"16s ribosomal gene sequencing assay, 16S rRNA sequencing, 16S Ribosomal RNA Sequencing, 16S rRNA gene amplification, 16S ribosomal RNA sequencing",OBI:0002763,http://purl.obolibrary.org/obo/OBI_0002763,,
3' RNA-seq,"A molecular genetic technique that combines chromatin immunoprecipitation (ChIP) with massively parallel DNA sequencing to map the binding sites of DNA-associated proteins in a sample of cells. First, crosslinked protein-DNA complexes are isolated using ChIP. Next, the crosslinks are broken, the proteins are removed and the purified DNA is modified with adaptor oligonucleotides to facilitate massively parallel DNA sequencing. Following sequencing, the DNA sequences that are obtained can be mapped to their genomic locations.",,,FALSE,,Assay,,,,,,,,
3C,,,,FALSE,,Assay,,EFO,,"3c, Chromosome Conformation NG Capture-C Assay, Chromosome Conformation Capture Assay",EFO:0007689,https://www.ebi.ac.uk/ols/ontologies/efo/terms?iri=http%3A%2F%2Fwww.ebi.ac.uk%2Fefo%2FEFO_0007689,,
3C-qPCR,,,,FALSE,,Assay,,,,"Quantitative analysis of chromosome conformation capture assays, 3c-qpcr",,,,Not in any ontologies or NCIt
3D ATAC-PALM,,,,FALSE,,Assay,,,,,,,,AN 2024-09-20
3D Bioprinting,,,,FALSE,,Assay,,PubMed,,,PMID:26724184,https://pubmed.ncbi.nlm.nih.gov/26724184/,,Added by Brynn 09/23/2022
3D Cell Culture,,,,FALSE,,Assay,,,,"3d cell culture, 3D culture, 3D cell culture",,,,
4C,,,,FALSE,,Assay,,EFO,,"4C, 4c",EFO:0007690,http://www.ebi.ac.uk/efo/EFO_0007690,,
5C,,,,FALSE,,Assay,,EFO,,"5c, 5C",EFO:0007692,http://www.ebi.ac.uk/efo/EFO_0007692,,
ATAC-Seq,"A molecular genetic technique that isolates and sequences chromosomal regions that are rich in open chromatin. First, nuclei are harvested from a cellular sample. Then a hyperactive Tn5 transposase is added to the nuclei where it excises non-nucleosomal DNA strands and ligates co-administered high-throughput sequencing adapters (tagmentation).  The tagged DNA fragments are isolated, amplified by PCR and sequenced. The number of reads for specific region of DNA correlate with increased chromatin accessibility and this method can identify regions of transcription factor and nucleosome binding.",,,FALSE,,Assay,,,,"Assay for Transposase-Accessible Chromatin Using Sequencing, Assay for Transposase Accessible Chromatin with High-Throughput Sequencing, ATACSeq, ATAC-seq (assay for Transposase-Accessible Chromatin (ATAC) strategy is used to study genome-wide chromatin accessibility), Assay for Transposase-Accessible Chromatin Sequencing",,https://ncithesaurus.nci.nih.gov/ncitbrowser/pages/concept_details.jsf?dictionary=NCI_Thesaurus&version=21.03e&code=C156056&ns=ncit&type=properties&key=null&b=1&n=0&vse=null,C156056,
ATP Bioluminescence Assay,,,,FALSE,,Assay,,OBI,,"Atp bioluminescence assay, ATP Bioluminescence assay",OBI:0002175,http://purl.obolibrary.org/obo/OBI_0002175,,
Affinity Purification Mass Spectrometry,"An analytical technique wherein ions are separated according to their ratio of charge to mass. From the mass spectrum produced, the atomic weight of the particle can be deduced.",,,FALSE,,Assay,,PubMed,,"Affinity purification mass spectrometry, AP-MS",pmid:22611051,https://pubmed.ncbi.nlm.nih.gov/22611051/,,
Allograft,A graft transferred from a donor of one species to a recipient of the same species but different genetic makeup.,,,FALSE,,Assay,,,,,,,NCIt,
Amplicon Sequencing,"A DNA sequencing technique that can differentiate cytosine from 5-methylcytosine in a DNA sample. First, a denatured DNA sample is treated with bisulfite which converts non-methylated cytosine to uracil. Next, the sample is amplified using a PCR method that does not discriminate between non-methylated and methylated sequences. The amplified DNA is subjected to nucleotide sequencing. The resulting sequence is compared to an identical control sample of DNA that was not treated with bisulfite. Unmethylated cytosines will be displayed as cytosines in the control sample and as thymines in the bisulfite-treated sample.",,,FALSE,,Assay,,EFO,,Amplicon sequencing,EFO:0003747,http://www.ebi.ac.uk/efo/EFO_0003747,,
Angiogenesis Assay,,,,FALSE,,Assay,,,,Angiogenesis assay,,,,
Apoptosis Assay,,,,FALSE,,Assay,,ERO,,Apoptosis assay,ERO:0001182,http://purl.obolibrary.org/obo/ERO_0001182,,
Atomic Absorption Spectrophotometry,A technique utilizing a scanning probe to image and analyze the surface of a material with atomic-level resolution.,,,FALSE,,Assay,,BAO,,Atomic absorption spectrophotometry,BAO:0002529,http://www.bioassayontology.org/bao#BAO_0002529,,
Atomic Absorption Spectroscopy,"A spectrometric method that determines the type and concentration of metal elements in a sample, based upon the principle that each elemental metal absorbs a particular wavelength of ultraviolet light when exposed to heat.",,,FALSE,,Assay,,,,ATOMIC ABSORPTION SPECTROMETRY,,https://ncithesaurus.nci.nih.gov/ncitbrowser/pages/concept_details.jsf,C85574,
Atomic Force Microscopy,A technique utilizing a scanning probe to image and analyze the surface of a material with atomic-level resolution.,,,FALSE,,Assay,,,,"atomicForceMicroscopy, Atomic Force Microscopy, Scanning Force Microscopy",,https://ncithesaurus.nci.nih.gov/ncitbrowser/pages/concept_details.jsf,C17754,
Autoradiography,"A technique used to locate radioactively labeled molecules, or fragments of molecules, by recording on a photographic or sensor plate the radiation emitted by radioactive material within a molecule.",,,FALSE,,Assay,,,,,,https://ncithesaurus.nci.nih.gov/ncitbrowser/ConceptReport.jsp?dictionary=NCI_Thesaurus&ns=ncit&code=C16314,C16314,
Barcode-Seq,"A molecular genetic technique that combines chromatin immunoprecipitation (ChIP) with massively parallel DNA sequencing to map the binding sites of DNA-associated proteins in a sample of cells. First, crosslinked protein-DNA complexes are isolated using ChIP. Next, the crosslinks are broken, the proteins are removed and the purified DNA is modified with adaptor oligonucleotides to facilitate massively parallel DNA sequencing. Following sequencing, the DNA sequences that are obtained can be mapped to their genomic locations.",,,FALSE,,Assay,,EFO,,"Barcode-Seq, Barcode-seq",EFO:0008655,http://www.ebi.ac.uk/efo/EFO_0008655,,
Bicinchoninic Acid Assay,"A copper-based colorimetric assay for total protein quantification. This assay relies on the formation of a Cu2+-protein complex in a basic environment, followed by reduction of the Cu2+ to Cu+, causing a change of color from green to purple, with a strong absorbance at 562nm.",,,FALSE,,Assay,,BAO,,"BCA, Smith Assay",BAO:0002467,http://www.bioassayontology.org/bao#BAO_0002467,NCIt,
Binding Assay,,,,FALSE,,Assay,,PubMed,,Binding assay,PMID: 21115850,https://www.ncbi.nlm.nih.gov/pmc/articles/PMC2993736/,,
Bio-Layer Interferometry,,,,FALSE,,Assay,,OBI,,"BLI, Bio-layer interferometry",OBI:0002107,http://purl.obolibrary.org/obo/OBI_0002107,,Added by Rancho on 2/23/2022
Bioluminescence Imaging,An imaging technique that uses fluorescent dye to achieve the desired image.,,,FALSE,,Assay,,Wikipedia,,"Bioluminescence imaging, Bioluminescence Imaging",Q4915066,https://en.wikipedia.org/wiki/Bioluminescence_imaging,,
Bisulfite Sequencing,"A DNA sequencing technique that can differentiate cytosine from 5-methylcytosine in a DNA sample. First, a denatured DNA sample is treated with bisulfite which converts non-methylated cytosine to uracil. Next, the sample is amplified using a PCR method that does not discriminate between non-methylated and methylated sequences. The amplified DNA is subjected to nucleotide sequencing. The resulting sequence is compared to an identical control sample of DNA that was not treated with bisulfite. Unmethylated cytosines will be displayed as cytosines in the control sample and as thymines in the bisulfite-treated sample.",,,FALSE,,Assay,,,,"MethylC-Seq, Bisulfite Sequencing, Bisulfite-Seq (sequencing following treatment of DNA with bisulfite to convert cytosine residues to uracil), BS-Seq, DNA Methylation Sequencing, Bisulfite-Seq, Methyl-C-Seq, Bisulphite Conversion Followed by Sequencing, bisulfiteSeq, Methylation Sequencing",,https://ncit.nci.nih.gov/ncitbrowser/ConceptReport.jsp?dictionary=NCI_Thesaurus&ns=ncit&code=C106054,C106054,
Brightfield Microscopy,Brightfield microscopy is a type of light microscopy in which objects are seen against a bright background.,,,FALSE,,Assay,,,,"Brightfield Analysis, brightfieldMicroscopy",,https://ncit.nci.nih.gov/ncitbrowser/ConceptReport.jsp?dictionary=NCI_Thesaurus&ns=ncit&code=C19827,C19827,
Brillouin Microscopy,The use of various technologies to resolve the structure or features of objects too small or fine to naturally be seen by eye.,,,FALSE,,Assay,,PubMed,,"Confocal Brillouin microscopy, Brillouin microscopy",PMID: 29771749,"https://pubmed.ncbi.nlm.nih.gov/29771749/#:~:text=Recent%20findings%3A%20Brillouin%20microscopy%20uses,analyzing%20the%20return%20signal%20spectrum.&text=The%20technique%20enables%20physicians%20to%20characterize%20the%20biomechanical%20properties%20of%20ocular%20tissues.",,
CASFISH,,,,FALSE,,Assay,,PMID,,"Casfish, Cas9-mediated Fluorescence In Situ Hybridization",PMID:26324940,https://pubmed.ncbi.nlm.nih.gov/26324940/,,Added by Rancho on 2/23/2022
CITE-seq,"A molecular genetic technique that combines chromatin immunoprecipitation (ChIP) with massively parallel DNA sequencing to map the binding sites of DNA-associated proteins in a sample of cells. First, crosslinked protein-DNA complexes are isolated using ChIP. Next, the crosslinks are broken, the proteins are removed and the purified DNA is modified with adaptor oligonucleotides to facilitate massively parallel DNA sequencing. Following sequencing, the DNA sequences that are obtained can be mapped to their genomic locations.",,,FALSE,,Assay,,,,,,,,
CLIP-qPCR,,,,FALSE,,Assay,,Article,,Clip-qpcr,PMID26721479,https://www.ncbi.nlm.nih.gov/pmc/articles/PMC5140280/,,
CRISPR,,,,FALSE,,Assay,,,,"CRISPER-Cas9 technique, Crispr, CRISPR-CAS9",,,,
CUT&RUN,,,,FALSE,,Assay,,,,"Cut&run, CUT&RUN",,https://en.wikipedia.org/wiki/CUT%26RUN_sequencing,,
CUT&Tag-Sequencing,,,,FALSE,,Assay,,Wikipedia,,"cleavage under targets and tagmentation, Cut&tag-sequencing",,https://en.wikipedia.org/wiki/CUT%26Tag_sequencing,,Rancho added 03/01/2022
Cell Adhesion Assay,"Any method to measure the number of dividing cells in a culture, or to measure the change in the proportion of cells that are dividing.",,,FALSE,,Assay,,ERO,,Cell adhesion assay,ERO:0001512,http://purl.obolibrary.org/obo/ERO_0001512,,
Cell Proliferation Assay,"Any method to measure the number of dividing cells in a culture, or to measure the change in the proportion of cells that are dividing.",,,FALSE,,Assay,,,,"EdU Cell Proliferation Assay, CELLULAR PROLIFERATION ASSAY, Cell Proliferation Assay",,https://ncithesaurus.nci.nih.gov/ncitbrowser/ConceptReport.jsp?dictionary=NCI_Thesaurus&version=21.03e&ns=ncit&code=C116553&key=128143824&b=1&n=null,C116553,
Cell Viability Assay,A colorimetric assay that can assess the viability of cells by quantitation of the reduction of a yellow tetrazolium salt substrate to a product that has a purple color. This assay can measure the cytotoxicity of a chemical or drug by determining the affect of treatment on cell viability.,,,FALSE,,Assay,,ERO,,"Cell viability assay, In Vitro Cell Survival Assay, In vitro Cell Survival Assay",ERO:000132,http://purl.obolibrary.org/obo/ERO_0001352,,
Cell-spreading Assay,"Any method to measure the number of dividing cells in a culture, or to measure the change in the proportion of cells that are dividing.",,,FALSE,,Assay,,pubMed,,Cell-spreading assay,PMID:15576905,https://pubmed.ncbi.nlm.nih.gov/15576905/,,
CellTiter-Glo Luminescent Cell Viability Assay,A colorimetric assay that can assess the viability of cells by quantitation of the reduction of a yellow tetrazolium salt substrate to a product that has a purple color. This assay can measure the cytotoxicity of a chemical or drug by determining the affect of treatment on cell viability.,,,FALSE,,Assay,,BAO,,"CellTiter-Glo Assay, Celltiter-glo luminescent cell viability assay",BAO:0000682,http://www.bioassayontology.org/bao#BAO_0000682,,Added by Brynn 05-09-2022
Cerenkov Luminescence Imaging,"An imaging modality to study charged particles in tissue by detecting the Cerenkov luminescence produced, allowing the imaging of beta-emitting nuclear medicine probes by optical methods.",,,FALSE,,Assay,,,,"CLI, Cherenkov Imaging, Cerenkov Imaging",,https://ncithesaurus.nci.nih.gov/ncitbrowser/ConceptReport.jsp?dictionary=NCI_Thesaurus&ns=ncit&code=C151895,C151895,
ChIA-PET,A molecular genetic technique that combines chromatin immunoprecipitation (ChIP) with paired end tagged (PET) DNA sequencing to identify the nucleotide sequences for the binding sites occupied by DNA-associated proteins in a sample.,,,FALSE,,Assay,,,,"Chia-pet, ChIA-PET (Direct sequencing of proximity-ligated chromatin immunoprecipitates)., ChIA-PET, Chromatin Interaction Analysis with Paired-End Tag",,https://ncithesaurus.nci.nih.gov/ncitbrowser/pages/concept_details.jsf?dictionary=NCI_Thesaurus&version=21.03e&code=C172845&ns=ncit&type=properties&key=null&b=1&n=0&vse=null,C172845,
ChIP-PCR,"A molecular genetic technique that combines chromatin immunoprecipitation (ChIP) with massively parallel DNA sequencing to map the binding sites of DNA-associated proteins in a sample of cells. First, crosslinked protein-DNA complexes are isolated using ChIP. Next, the crosslinks are broken, the proteins are removed and the purified DNA is modified with adaptor oligonucleotides to facilitate massively parallel DNA sequencing. Following sequencing, the DNA sequences that are obtained can be mapped to their genomic locations.",,,FALSE,,Assay,,,,Chip-pcr,,https://www.cellsignal.com/applications/chip-and-chip-seq/regulation-expression-in-cell-and-tissue,,
ChIP-Seq,"A molecular genetic technique that combines chromatin immunoprecipitation (ChIP) with massively parallel DNA sequencing to map the binding sites of DNA-associated proteins in a sample of cells. First, crosslinked protein-DNA complexes are isolated using ChIP. Next, the crosslinks are broken, the proteins are removed and the purified DNA is modified with adaptor oligonucleotides to facilitate massively parallel DNA sequencing. Following sequencing, the DNA sequences that are obtained can be mapped to their genomic locations.",,,FALSE,,Assay,,,,"Chromatin Immunoprecipitation Sequencing, ChIP-Seq, ChIP-Seq (chromatin ImmunoPrecipitation), ChIP-Sequencing",,https://ncit.nci.nih.gov/ncitbrowser/ConceptReport.jsp?dictionary=NCI_Thesaurus&version=21.03e&ns=ncit&code=C106048&key=1636610306&b=1&n=null,C106048,
ChIP-qPCR assay,"A molecular genetic technique that combines chromatin immunoprecipitation (ChIP) with massively parallel DNA sequencing to map the binding sites of DNA-associated proteins in a sample of cells. First, crosslinked protein-DNA complexes are isolated using ChIP. Next, the crosslinks are broken, the proteins are removed and the purified DNA is modified with adaptor oligonucleotides to facilitate massively parallel DNA sequencing. Following sequencing, the DNA sequences that are obtained can be mapped to their genomic locations.",,,FALSE,,Assay,,OBI,,Chip-qpcr assay,OBI:0002169,http://purl.obolibrary.org/obo/OBI_0002169,,
Chemiluminescent Assay,,,,FALSE,,Assay,,PubMed,,Chemiluminescent assay,PMID:28647912,https://www.ncbi.nlm.nih.gov/labs/pmc/articles/PMC5483212/,,Rancho added 1/7/2022
Chemotaxis Assay,,,,FALSE,,Assay,,BAO,,Chemotaxis assay,BAO:0010269,http://www.bioassayontology.org/bao#BAO_0010269,,
Circular Dichroism Spectroscopy,"The technique of measuring the emission and absorption of different wavelengths (spectra) of visible and non-visible light. This can be done via a spectroscope, which consists of a slit, prism, collimator lens, object lens, and a grating.",,,FALSE,,Assay,,CHMO,,Circular dichroism spectroscopy,CHMO:0000323,http://purl.obolibrary.org/obo/CHMO_0000323,,Rancho added 1/7/2022
Co-Immunoprecipitation,"Co-immunoprecipitation (Co-IP) is a popular technique for protein interaction discovery. In a co-IP the target antigen precipitated by the antibody ""co-precipitates"" a binding partner/protein complex from a lysate. It is assumed that these proteins are related to the function of the target antigen at the cellular level.",,,FALSE,,Assay,,,,Co-IP,,https://ncithesaurus.nci.nih.gov/ncitbrowser/pages/message.jsf,C19830,
Co-culture Assay,,,,FALSE,,Assay,,pubMed,,Co-culture assay,PMID:4032528,https://www.ncbi.nlm.nih.gov/pmc/articles/PMC4032528/,,
Collision-Induced Dissociation,A method by which fragmentation can be achieved.  CID is accomplished by selecting an ion of interest with the mass analyzer and then subjecting that ion to collisions with neutral atoms or molecules.  The resulting fragment ions are then mass analyzed. (from The Expanding Role of Mass Spectrometry in Biotechnology by Gary Siuzdak),,,FALSE,,Assay,,,,"CID, Collisionally-Activated Dissociation, CAD",,https://ncithesaurus.nci.nih.gov/ncitbrowser/ConceptReport.jsp?dictionary=NCI_Thesaurus&ns=ncit&code=C48061,C48061,Added by 03/01/2022
Colorimetric Cell Viability Assay,A colorimetric assay that can assess the viability of cells by quantitation of the reduction of a yellow tetrazolium salt substrate to a product that has a purple color. This assay can measure the cytotoxicity of a chemical or drug by determining the affect of treatment on cell viability.,,,FALSE,,Assay,,,,"cellViabilityAssay, Colorimetric Cell Viability Assay, MTS Assay, MTT Assay",,https://ncit.nci.nih.gov/ncitbrowser/ConceptReport.jsp?dictionary=NCI_Thesaurus&ns=ncit&code=C95027,C95027,
Computational Modeling,"The use of statistical analysis, computer analysis, or model organisms to predict outcomes of research. (doegenomes.org)",,,FALSE,,Assay,,,,Simulation,C16461,https://ncithesaurus.nci.nih.gov/ncitbrowser/ConceptReport.jsp?dictionary=NCI_Thesaurus&ns=ncit&code=C16461,,
Computational Tool,,,,FALSE,,Assay,,,,"computational modeling, Computational tool, iterClust, which can separate more pronounced differences (e.g. A and B) in starting iterations, metaVIPER, GPU-ARACNE, computational, an iterative clustering framework, followed by relatively subtle differences (e.g. B1 and B2), providing a comprehensive clustering trajectory., Meta-analysis",,,,
Computed Tomography,An imaging technique for examining structures within the body by scanning them with X rays and using a computer to construct a series of cross-sectional scans along a single axis.,,,FALSE,,Assay,,,,"CAT scan, computed tomography, CT, Computerized Axial Tomography, Computed Axial Tomography, Computed Tomography, CAT Scan, CT Scan, computed tomography; CT, CT SCAN, CAT, tomography, Computerized Tomography, computerized axial tomography, CT scan, computerized tomography",,https://ncit.nci.nih.gov/ncitbrowser/ConceptReport.jsp?dictionary=NCI_Thesaurus&version=21.03e&ns=ncit&code=C17204&key=370655652&b=1&n=null,C17204,
Confocal Microscopy,A system of (usually) epifluorescence light microscopy in which a fine laser beam of light is scanned over the object through the objective lens. This technique is particularly good at rejecting light from outside the plane of focus and so produces higher effective resolution than other microscopy techniques.,,,FALSE,,Assay,,,,"3D Confocal Microscopy, Confocal Fluorescence, Confocal Laser Scanning Microscopy, confocal imaging, Confocal Microscopy, CONFOCAL MICROSCOPY",,https://ncit.nci.nih.gov/ncitbrowser/pages/concept_details.jsf,C17753,
Confocal Reflectance Quantitative Phase Microscopy,A system of (usually) epifluorescence light microscopy in which a fine laser beam of light is scanned over the object through the objective lens. This technique is particularly good at rejecting light from outside the plane of focus and so produces higher effective resolution than other microscopy techniques.,,,FALSE,,Assay,,,,Confocal reflectance quantitative phase microscopy,,,,
Cross-Linking Immunoprecipitation High-throughput Sequencing,"A molecular biology method combining crosslinking-immunoprecipitation and high-throughput sequencing techniques to detect and map RNA-protein interactions. In CLIP, whole tissues, organisms or individual cell types are treated with UV irradiation, which introduces covalent bonds between RNA-protein complexes. This is followed by immunoprecipitation and removal of the protein component of the crosslinked complex. The purified RNAs are then fragmented, reduced in size and subjected to high-throughput sequencing for the identification of RNA binding sites.",,,FALSE,,Assay,,,,"Cross-linking Immunoprecipitation High-throughput Sequencing, Cross-linking immunoprecipitation high-throughput sequencing",C116152,https://ncithesaurus.nci.nih.gov/ncitbrowser/pages/concept_details.jsf?dictionary=NCI_Thesaurus&version=21.03e&code=C116152&ns=ncit&type=properties&key=null&b=1&n=0&vse=null,,
Cross-Linking Mass Spectrometry,"An analytical technique wherein ions are separated according to their ratio of charge to mass. From the mass spectrum produced, the atomic weight of the particle can be deduced.",,,FALSE,,Assay,,,,"Cross-linking mass spectrometry, Cross-linking Mass Spectrometry , XL-MS",,,,
Cyclic Immunofluorescence,A method that enables simultaneous detection of multiple biomarkers on a single tissue section using immunofluorescence techniques.,,,FALSE,,Assay,,PubMed,,"Cyclic immunofluorescence, cycIF",PMID: 27925668,https://pubmed.ncbi.nlm.nih.gov/27925668/,,
Cytochemical Stain,,,,FALSE,,Assay,,UMLS,,Cytochemical stain,C4511272,https://uts.nlm.nih.gov/uts/umls/concept/C4511272,,
Cytokine Expression Profile,The identification and quantitation of all of the cytokines expressed in a biological sample.,,,FALSE,,Assay,,,,"C5, Cytokine Profile",,https://ncithesaurus.nci.nih.gov/ncitbrowser/ConceptReport.jsp?dictionary=NCI_Thesaurus&version=21.03e&ns=ncit&code=C129886&key=n2078435665&b=1&n=null,C129886,
Cytometric Bead Array Assay,,,,FALSE,,Assay,,OBI,,Cytometric bead array assay,OBI:0000920,http://purl.obolibrary.org/obo/OBI_0000920,,
Cytotoxicity Assay,,,,FALSE,,Assay,,BAO,,"Cytotoxicity assay, In Vitro Cytotoxicity",BAO:0002993,http://www.bioassayontology.org/bao#BAO_0002993,,
DBiT-Seq,"A molecular genetic technique that combines chromatin immunoprecipitation (ChIP) with massively parallel DNA sequencing to map the binding sites of DNA-associated proteins in a sample of cells. First, crosslinked protein-DNA complexes are isolated using ChIP. Next, the crosslinks are broken, the proteins are removed and the purified DNA is modified with adaptor oligonucleotides to facilitate massively parallel DNA sequencing. Following sequencing, the DNA sequences that are obtained can be mapped to their genomic locations.",,,FALSE,,Assay,,PubMed,,"Microfluidic Deterministic Barcoding in Tissue for Spatial Omics Sequencing, Dbit-seq",PMID:33188776,https://pubmed.ncbi.nlm.nih.gov/33188776/,,Rancho added 03/01/2022
DNA Gene-Expression Microarray,"A process that allows thousands of pieces of DNA that are fixed to a glass slide to be analyzed at one time. It is used to identify the genes (pieces of DNA) in specific cells or tissue that are actively used to make RNA, which then may be used to make proteins.",,,FALSE,,Assay,,,,"Gene Expression Profiling Microarray, Expression Array",C93207,https://ncithesaurus.nci.nih.gov/ncitbrowser/ConceptReport.jsp?dictionary=NCI_Thesaurus&ns=ncit&code=C93207,,
DNA Methylation Array,The use of a high-throughput microarray where all of the known CpG islands either in a single specimen or all of the known promoter sequences of a specimen or a population group are coupled to beads or microwells to determine which are methylated.,,,FALSE,,Assay,,,,"Methylation Profiling by Array, methylationArray, Methylation Array",,https://ncithesaurus.nci.nih.gov/ncitbrowser/pages/message.jsf,C165222,
DNA Sequencing,The determination of the sequence of purines and pyrimidines in deoxyribonucleic acid (DNA).,,,FALSE,,Assay,,,,"Deoxyribonucleic Acid Sequencing, DNA-seq, DNA Sequence Analysis, DNA Sequencing",,https://ncithesaurus.nci.nih.gov/ncitbrowser/pages/concept_details.jsf?dictionary=NCI_Thesaurus&version=21.04d&code=C153598&ns=ncit&type=properties&key=n1129370290&b=1&n=0&vse=null,C153598,
DNase-Seq,A molecular genetic technique where genome-wide sequencing is performed on DNA regions that are super sensitive to cleavage by DNase I to identify putative DNA regulatory sequences.,,,FALSE,,Assay,,,,"DNase I Hypersensitive Sites Sequencing, Dnase-seq, DNase-Hypersensitivity (sequencing of hypersensitive sites or segments of open chromatin that are more readily cleaved by DNaseI)",,https://ncithesaurus.nci.nih.gov/ncitbrowser/ConceptReport.jsp?dictionary=NCI_Thesaurus&ns=ncit&code=C106052,C106052,
DRIP-seq,"A molecular genetic technique that combines chromatin immunoprecipitation (ChIP) with massively parallel DNA sequencing to map the binding sites of DNA-associated proteins in a sample of cells. First, crosslinked protein-DNA complexes are isolated using ChIP. Next, the crosslinks are broken, the proteins are removed and the purified DNA is modified with adaptor oligonucleotides to facilitate massively parallel DNA sequencing. Following sequencing, the DNA sequences that are obtained can be mapped to their genomic locations.",,,FALSE,,Assay,,,,,,,,
