Attribute,Description,Valid Values,DependsOn,Required,Properties,Parent,DependsOn Component,Source,Validation Rules,Nonpreferred Terms,Ontology Identifier,Ontology Url,NCIt Code,Notes
Immunoprecipitation,"Antigen aggregation with antibody, in the right ratios, to cause precipitation. (NCI)",,,FALSE,,Assay,,,,"IP, IMMUNOPRECIPITATION",,https://ncithesaurus.nci.nih.gov/ncitbrowser/pages/concept_details.jsf?dictionary=NCI_Thesaurus&version=21.02d&code=C16724&ns=ncit&type=properties&key=853920638&b=1&n=0&vse=null,C16724,
In Situ Hybridization,"Use of a DNA or RNA probe to detect the presence of complementary sequences in chromosomes, cells, or tissues. (NCI)",,,FALSE,,Assay,,,,"Genetics, in situ Hybridization, In Situ Hybridization, IN SITU HYBRIDIZATION, ISH, in situ Hybridization, In situ hybridization",,https://ncithesaurus.nci.nih.gov/ncitbrowser/ConceptReport.jsp?dictionary=NCI_Thesaurus&ns=ncit&code=C17562,C17562,
In Vitro Cell Killing Assay,,,,FALSE,,Assay,,OBI,,In vitro cell killing assay,OBI:0000903,http://purl.obolibrary.org/obo/OBI_0000903,,
In Vitro Model,,,,FALSE,,Assay,,,,"In vitro model, In Vitro Model",,https://ncithesaurus.nci.nih.gov/ncitbrowser/pages/concept_details.jsf?dictionary=NCI_Thesaurus&version=21.02d&code=C19146&ns=ncit&type=properties&key=null&b=1&n=0&vse=null,C19146,
In Vitro Selection,,,,FALSE,,Assay,,EDAM,,"In vitro selection, In Vitro Selection",operation:3795,http://edamontology.org/operation_3795,,
In Vitro Translation,,,,FALSE,,Assay,,ERO,,"Mammalian In Vitro Translation Assay, In vitro translation",ERO:0000906,http://purl.obolibrary.org/obo/ERO_0000906,,Added by Victor 08/29/2022
In Vivo Bioluminescence,,,,FALSE,,Assay,,ERO,,"in vivo bioluminescence, In vivo bioluminescence",ERO:0000651,http://purl.obolibrary.org/obo/ERO_0000651,,
In-Cell Western Assay,"Any method to measure the number of dividing cells in a culture, or to measure the change in the proportion of cells that are dividing.",,,FALSE,,Assay,,BAO,,In-cell western assay,BAO:0002423,http://www.bioassayontology.org/bao#BAO_0002423,,
Inductively-Coupled Plasma Mass Spectrometry,A mass spectrometry technique that uses inductively-coupled plasma generated from argon gas to atomize and ionize a sample. The resulting ions are separated and analyzed using a mass spectrometer.,,,FALSE,,Assay,,,,"ICPMS, Inductively Coupled Plasma Mass Spectrometry, ICP-MS",,https://ncithesaurus.nci.nih.gov/ncitbrowser/ConceptReport.jsp?dictionary=NCI_Thesaurus&ns=ncit&code=C62328,C62328,
Interference Reflection Microscopy,The use of various technologies to resolve the structure or features of objects too small or fine to naturally be seen by eye.,,,FALSE,,Assay,,,,"Interference reflection microscopy, Interference Reflection Microscopy",,https://en.wikipedia.org/wiki/Interference_reflection_microscopy,,
Intravital Microscopy,The use of various technologies to resolve the structure or features of objects too small or fine to naturally be seen by eye.,,,FALSE,,Assay,,ERO,,Intravital microscopy,ERO:0001638,http://purl.obolibrary.org/obo/ERO_0001638,,
Invasion Assay,,,,FALSE,,Assay,,,,Invasion assay,,,,
Karyotyping,"The preparation, analysis, and interpretation of a karyotype, the representation of the chromosome set of a cell.",,,FALSE,,Assay,,,,"KARYOTYPING, Karyotype, Karotype Analysis, Genetics, Karyotyping",,https://ncithesaurus.nci.nih.gov/ncitbrowser/ConceptReport.jsp?dictionary=NCI_Thesaurus&ns=ncit&code=C16768,C16768,
Knife-Edge Scanning Microscopy,"Technique of electron microscopy in which the specimen is coated with heavy metal and then scanned by an electron beam. The resolution is not as great as with transmission electron microscopy, but preparation is easier (often by fixation followed by critical point drying), the depth of focus is relatively enormous, the surface of a specimen can be seen (though not the interior unless the specimen is cracked open) and the image is aesthetically pleasing.",,,FALSE,,Assay,,PMID,,Knife-edge scanning microscopy,PMID:18638197,https://pubmed.ncbi.nlm.nih.gov/18638197/,,added by Rancho on 2/23/2022
L1000 mRNA Profiling Assay,,,,FALSE,,Assay,,BAO,,"L1000 mrna profiling assay, L1000",BAO:0010046,http://www.bioassayontology.org/bao#BAO_0010046,,Added by Brynn 5/3/2022
Lattice Light Sheet Microscopy,"The use of a special microscope to see objects that give off fluorescent light. For example, cells or tissue can be treated with a substance that contains a fluorescent dye. The dye lights up when viewed under a microscope with a special light.",,,FALSE,,Assay,,,,"Lattice Light Sheet Microscopy, Lattice light sheet microscopy",,https://en.wikipedia.org/wiki/Lattice_light-sheet_microscopy,,
Liquid Chromatography Mass Spectrometry,"LC/MS is a hyphenated technique, combining the separation power of liquid chromatography (LC), an analytical chromatographic technique for separating ions or molecules dissolved in a solvent, with the detection power of mass spectrometry(MS), a technique to separate gas phase ions according their m/z (mass to charge ratio) value. Used for drug screening, pharmacology studies, environmental analyses and forensics.",,,FALSE,,Assay,,,,"LC-MS, Liquid Chromatography/Mass Spectrometry, Liquid Chromatography-Mass Spectrometry, LC/MS",,https://ncit.nci.nih.gov/ncitbrowser/ConceptReport.jsp?dictionary=NCI_Thesaurus&code=C18475&ns=ncit,C18475,
Liquid Chromatography/Tandem Mass Spectrometry,"An analytical technique wherein liquid chromatography is coupled to tandem mass spectrometry in order to separate, identify, and quantify substances in a sample.",,,FALSE,,Assay,,CHMO,,"LC/MS/MS, LC/MS-MS, Liquid chromatography/tandem mass spectrometry, LC-MSMS",,http://purl.obolibrary.org/obo/CHMO_0000701,CHMO:0000701,
Low-Vacuum Scanning Electron Microscopy,"Technique of electron microscopy in which the specimen is coated with heavy metal and then scanned by an electron beam. The resolution is not as great as with transmission electron microscopy, but preparation is easier (often by fixation followed by critical point drying), the depth of focus is relatively enormous, the surface of a specimen can be seen (though not the interior unless the specimen is cracked open) and the image is aesthetically pleasing.",,,FALSE,,Assay,,PMID,,"LV-SEM, Low-vacuum scanning electron microscopy",PMID:29546719,https://pubmed.ncbi.nlm.nih.gov/29546719/,,Added by Rancho on 2/23/2022
Luciferase Reporter Assay,,,,FALSE,,Assay,,BAO,,Luciferase reporter assay,BAO:0002661,http://www.bioassayontology.org/bao#BAO_0002661,,
Luminescent Cell Viability Assay,A colorimetric assay that can assess the viability of cells by quantitation of the reduction of a yellow tetrazolium salt substrate to a product that has a purple color. This assay can measure the cytotoxicity of a chemical or drug by determining the affect of treatment on cell viability.,,,FALSE,,Assay,,,,"Luminescent Cell Viability assay, Luminescent cell viability assay",,,,
MALDI-TOF Mass Spectrometry,"An analytical technique wherein ions are separated according to their ratio of charge to mass. From the mass spectrum produced, the atomic weight of the particle can be deduced.",,,FALSE,,Assay,,,,"Matrix-Assisted Laser Desorption/Ionization Time-of-Flight Mass Spectrometry, Matrix-Assisted Laser Desorption/Ionization-Time of Flight Mass Spectrometry, Matrix-Assisted Laser Desorption Ionization Time-of-Flight MS, MALDI Mass Spectrometry, MALDI-TOF",,https://ncithesaurus.nci.nih.gov/ncitbrowser/ConceptReport.jsp?dictionary=NCI_Thesaurus&ns=ncit&code=C19935,C19935,
MEMA Cell Growth Assay,"Any method to measure the number of dividing cells in a culture, or to measure the change in the proportion of cells that are dividing.",,,FALSE,,Assay,,BAO,,"MEMA, Mema cell growth assay",BAO:0010060,http://www.bioassayontology.org/bao#BAO_0010060,,Added by Brynn 5/3/2022
MNase-Seq,"A molecular genetic technique that combines chromatin immunoprecipitation (ChIP) with massively parallel DNA sequencing to map the binding sites of DNA-associated proteins in a sample of cells. First, crosslinked protein-DNA complexes are isolated using ChIP. Next, the crosslinks are broken, the proteins are removed and the purified DNA is modified with adaptor oligonucleotides to facilitate massively parallel DNA sequencing. Following sequencing, the DNA sequences that are obtained can be mapped to their genomic locations.",,,FALSE,,Assay,,EFO,,"Mnase-seq, MNase-seq",EFO:0003751,http://www.ebi.ac.uk/efo/EFO_0003751,,
MULTI-Seq,"A molecular genetic technique that combines chromatin immunoprecipitation (ChIP) with massively parallel DNA sequencing to map the binding sites of DNA-associated proteins in a sample of cells. First, crosslinked protein-DNA complexes are isolated using ChIP. Next, the crosslinks are broken, the proteins are removed and the purified DNA is modified with adaptor oligonucleotides to facilitate massively parallel DNA sequencing. Following sequencing, the DNA sequences that are obtained can be mapped to their genomic locations.",,,FALSE,,Assay,,,,"multiplexing using lipid-tagged indices for single-cell and single-nucleus RNA sequencing, MULTI-seq, Multi-seq",,https://www.nature.com/articles/s41592-019-0433-8,,
Macrophage Polarization Assay,,,,FALSE,,Assay,,,,"macrophage polarization assay, Macrophage polarization assay",,,,
Magnetic Resonance Imaging,"Imaging that uses radiofrequency waves and a strong magnetic field rather than x-rays to provide detailed pictures of internal organs and tissues. The technique is valuable for the diagnosis of many pathologic conditions, including cancer, heart and vascular disease, stroke, and joint and musculoskeletal disorders.",,,FALSE,,Assay,,,,"magnetic resonance imaging, NMRI, Magnetic Resonance, Medical Imaging, Magnetic Resonance / Nuclear Magnetic Resonance, MR Imaging, Magnetic resonance elastography, MRI Scan, MR, nuclear magnetic resonance imaging, Magnetic Resonance Imaging Scan, MRI, NMR Imaging, Nuclear Magnetic Resonance Imaging",,ps://ncithesaurus.nci.nih.gov/ncitbrowser/ConceptReport.jsp?dictionary=NCI_Thesaurus&ns=ncit&code=C16809,C16809,
Magnetic Tweezers,A technique that utilizes light waves to exert minute forces as well as transmit energy to isolate and manipulate nanoparticles.,,,FALSE,,Assay,,CHMO,,"Magnetic Tweezers, Magnetic tweezers",CHMO:0002474,http://purl.obolibrary.org/obo/CHMO_0002474,,
Magnetic Twisting Cytometry,A flow cytometry technique that utilizes mass spectrometry to detect antibodies labeled with heavy metal ion tags that are bound to antigens of interest on single cells.,,,FALSE,,Assay,,PubMed,,Magnetic twisting cytometry,PMID: 11509510,"https://pubmed.ncbi.nlm.nih.gov/11509510/#:~:text=Magnetic%20twisting%20cytometry%20(MTC)%20(,bead%20rotation%20with%20a%20magnetometer.",,
Magnetically Activated Cell Sorting,Selection and deposition of individual cells of a particular phenotype from a mixed population into a separate tube or tissue culture plate by the use of a fluorescence-activated cell sorter (FACS) and fluorescently-labeled antibodies specific for surface molecules on the cells to be sorted.,,,FALSE,,Assay,,,,"Magnetically activated cell sorting, Magnetically Activated Cell Sorting;MACS",,https://en.wikipedia.org/wiki/Magnetic-activated_cell_sorting,,
Mammosphere Formation Assay,,,,FALSE,,Assay,,PubMed,,Mammosphere formation assay,PMID: 25867607,https://pubmed.ncbi.nlm.nih.gov/25867607/,,
Mass Cytometry,A flow cytometry technique that utilizes mass spectrometry to detect antibodies labeled with heavy metal ion tags that are bound to antigens of interest on single cells.,,,FALSE,,Assay,,,,"Time-of-Flight Cytometry, CyTOF, Cytometry by Time-of-Flight, Mass cytometry, ToF Cytometry, Cytometry by time-of-flight running, MASS CYTOMETRY",,https://en.wikipedia.org/wiki/Mass_cytometry,NCIt,
Mass Spectrometry,"An analytical technique wherein ions are separated according to their ratio of charge to mass. From the mass spectrum produced, the atomic weight of the particle can be deduced.",,,FALSE,,Assay,,,,"Mass Spectrum, MASS SPECTROMETRY, MassSpec, Photometry/Spectrum Analysis, Mass, MS1, MS, Mass Spec, (SILAC)-based quantitative mass spectrometry, Mass Spectrometry",,https://ncithesaurus.nci.nih.gov/ncitbrowser/ConceptReport.jsp?dictionary=NCI_Thesaurus&ns=ncit&code=C17156,C17156,
Mathematical Modeling,"The use of statistical analysis, computer analysis, or model organisms to predict outcomes of research. (doegenomes.org)",,,FALSE,,Assay,,,,"scaling relationship, Expression based network analysis, Big-data analysis, Biophysical analysis, Math modeling, Bigdata anlysis, Multiscale modeling, Theoritical modeling, mechanical modeling of cell invasion",C16870,https://ncithesaurus.nci.nih.gov/ncitbrowser/ConceptReport.jsp?dictionary=NCI_Thesaurus&ns=ncit&code=C16870,,
MeDIP,,,,FALSE,,Assay,,OBI,,"Methylated DNA immunoprecipitation, Medip",OBI:0000693,http://purl.obolibrary.org/obo/OBI_0000693,,Added by Rancho 2/23/2022
MeRIP-Seq,"A molecular genetic technique that combines chromatin immunoprecipitation (ChIP) with massively parallel DNA sequencing to map the binding sites of DNA-associated proteins in a sample of cells. First, crosslinked protein-DNA complexes are isolated using ChIP. Next, the crosslinks are broken, the proteins are removed and the purified DNA is modified with adaptor oligonucleotides to facilitate massively parallel DNA sequencing. Following sequencing, the DNA sequences that are obtained can be mapped to their genomic locations.",,,FALSE,,Assay,,EFO,,"m6A-Methylated RNA Immunoprecipitation-Sequencing, Methylated RNA Immunoprecipitation-Sequencing, N6-Methyladenine RNA Immunoprecipitation-Sequencing, Merip-seq, m6A-seq, m6A MeRIP-Seq",EFO:0008803,http://www.ebi.ac.uk/efo/EFO_0008803,NCIt,
Methyl Binding Domain Sequencing,,,,FALSE,,Assay,,EFO,,"MBD-Cap Seq, MBD-seq, Methyl binding domain sequencing",EFO:0003750,http://www.ebi.ac.uk/efo/EFO_0003750,,
Methylation-Specific PCR,"Polymerase chain reaction that uses two sets of primers, in two sequential runs of amplification, with the second set intended to amplify a target within the first run product.",,,FALSE,,Assay,,PMID,,Methylation-specific pcr,PMID:21913069,https://pubmed.ncbi.nlm.nih.gov/21913069/,,Added by Rancho on 2/23/2022
Micro-computed Tomography,An imaging technique for examining structures within the body by scanning them with X rays and using a computer to construct a series of cross-sectional scans along a single axis.,,,FALSE,,Assay,,MMO,,Micro-computed tomography,MMO:0000570,http://purl.obolibrary.org/obo/MMO_0000570,,
MicroRNA Expression Array,"A molecular biology device that utilizes a set of defined cDNA clones attached in a specific grid arrangement to a solid support for nucleic acid hybridization assays in gene mapping studies or in determining gene sequences, sequence variations, or gene expression patterns.",,,FALSE,,Assay,,OBI,,"Microrna expression array, mirnaArray",OBI:0001335,An assay that analyses the microRNA component of the transcriptome using a microRNA array.,,
MicroRNA Sequencing,A next-generation or massively parallel high-throughput DNA sequencing-based procedure that can identify and quantify the microRNA sequences present in a biological sample.,,,FALSE,,Assay,,,,"microRNA Sequencing, miRNA-Seq, miRNA-Seq (microRNA sequencing), miRNA-seq, mirnaSeq, MicroRNA-Seq, miRNA Sequencing",,https://ncithesaurus.nci.nih.gov/ncitbrowser/ConceptReport.jsp?dictionary=NCI_Thesaurus&ns=ncit&code=C16853,C156057,
Microcontact Printing,,,,FALSE,,Assay,,CHMO,,Microcontact printing,CHMO:0001440,http://purl.obolibrary.org/obo/CHMO_0001440,,added by Brynn 04/11/2022
Microfluidics,,,,FALSE,,Assay,,,,"In vitro microfluidics, In vitro Microfluidics",,,,
Micropipette Adhesion Assay,,,,FALSE,,Assay,,PubMed,,"Micropipette adhesion assay, Micropipette Adhesion Frequency Assay",PMID:22083316,https://pubmed.ncbi.nlm.nih.gov/22083316/,,Rancho added 1/7/2022
Micropipette Aspiration,,,,FALSE,,Assay,,,,"Micropipette aspiration, micropipette aspiration",,https://www.ncbi.nlm.nih.gov/pmc/articles/PMC4476029/,,
Microscopy,The use of various technologies to resolve the structure or features of objects too small or fine to naturally be seen by eye.,,,FALSE,,Assay,,,,"Advanced Microscopy, Advanced microscopy; mechanical probing, MICROSCOPY, GM, Microscopy, Conventional Microscopy",,https://ncithesaurus.nci.nih.gov/ncitbrowser/ConceptReport.jsp?dictionary=NCI_Thesaurus&ns=ncit&code=C16853,C16853,
Migration Assay,An in vitro assay in which cultured cells are monitored and analyzed for their ability to move into an acellular area of a culture material.,,,FALSE,,Assay,,,,"Cell Migration Assay, Quantitative Analysis of Cell Migration, pore migration assays, cell migration assay, Migration Assays, pore migration assay",,https://ncithesaurus.nci.nih.gov/ncitbrowser/pages/message.jsf,C19425,
Mint-ChIP,"A molecular genetic technique that combines chromatin immunoprecipitation (ChIP) with massively parallel DNA sequencing to map the binding sites of DNA-associated proteins in a sample of cells. First, crosslinked protein-DNA complexes are isolated using ChIP. Next, the crosslinks are broken, the proteins are removed and the purified DNA is modified with adaptor oligonucleotides to facilitate massively parallel DNA sequencing. Following sequencing, the DNA sequences that are obtained can be mapped to their genomic locations.",,,FALSE,,Assay,,EFO,,Mint-chip,EFO:0008813,http://www.ebi.ac.uk/efo/EFO_0008813,,
Modeling,"The use of statistical analysis, computer analysis, or model organisms to predict outcomes of research. (doegenomes.org)",,,FALSE,,Assay,,,,,,https://ncithesaurus.nci.nih.gov/ncitbrowser/ConceptReport.jsp?dictionary=NCI_Thesaurus&ns=ncit&code=C16063,C16063,Added by Brynn 09/13/2022
Molecular Simulations,,,,FALSE,,Assay,,,,Molecular Dynamics simulations,C18097,https://ncithesaurus.nci.nih.gov/ncitbrowser/ConceptReport.jsp?dictionary=NCI_Thesaurus&ns=ncit&code=C18097,,
Monolayer Stress Microscopy,The use of various technologies to resolve the structure or features of objects too small or fine to naturally be seen by eye.,,,FALSE,,Assay,,,,"Monolayer stress microscopy, monolayer stress microscopy",,https://pubmed.ncbi.nlm.nih.gov/23468843/,,
Multi-Angle Light Scattering,,,,FALSE,,Assay,,CHMO,,Multi-angle light scattering,CHMO:0000168,http://purl.obolibrary.org/obo/CHMO_0000168,,
Multi-Isotope Mass Spectrometry,"An analytical technique wherein ions are separated according to their ratio of charge to mass. From the mass spectrum produced, the atomic weight of the particle can be deduced.",,,FALSE,,Assay,,PubMed,,Multi-isotope mass spectrometry,PMID:22246326,https://pubmed.ncbi.nlm.nih.gov/22246326/,,
Multiparametric Magnetic Resonance Imaging,"The combination of multiple magnetic resonance techniques, including diffusion weighted imaging, dynamic contrast-enhanced imaging, and spectroscopy, to achieve an image that will allow for better identification of tumor size and location, as well as possibly identifying cancer spread and aggressiveness.",,,FALSE,,Assay,,,,"Multiparametric MRI, mpMRI, Multi-parametric MRI, MP-MRI",,https://ncithesaurus.nci.nih.gov/ncitbrowser/ConceptReport.jsp?dictionary=NCI_Thesaurus&ns=ncit&code=C116458,C116458,
Multiphoton Microscopy,"An imaging technique that uses multiple photons to absorb infrared light, thereby minimizing phototoxicty and photobleaching, making it an ideal method for imaging living specimens, especially those involving deep tissue.",,,FALSE,,Assay,,,,"Multi-Photon Microscopy, Multiphoton Microscopy, Multiphoton microscopy",,https://ncithesaurus.nci.nih.gov/ncitbrowser/ConceptReport.jsp?dictionary=NCI_Thesaurus&ns=ncit&code=C94604,C116504,
Multiplexed Error-Robust Fluorescence In Situ Hybridization,"Use of a DNA or RNA probe to detect the presence of complementary sequences in chromosomes, cells, or tissues. (NCI)",,,FALSE,,Assay,,EFO,,"Multiplexed error-robust fluorescence in situ hybridization, MERFISH",EFO:0008992,http://www.ebi.ac.uk/efo/EFO_0008992,,
Multiplexed Immunofluorescence,A method that enables simultaneous detection of multiple biomarkers on a single tissue section using immunofluorescence techniques.,,,FALSE,,Assay,,,,"Multiplexed Immunofluorescence, Multiplex Immunofluorescence, MxIF",,https://ncithesaurus.nci.nih.gov/ncitbrowser/pages/concept_details.jsf?dictionary=NCI_Thesaurus&version=22.08e&code=C181928&ns=ncit&type=properties&key=621675532&b=1&n=0&vse=null,C181928,Added by Brynn 09/23/2022
Multiplexed Immunohistochemistry,A method that enables simultaneous detection of multiple biomarkers on a single tissue section using immunohistochemistry techniques.,,,FALSE,,Assay,,,,"mIHC, Multiplex Immunoassay, Multiplex Immunohistochemistry",,ttps://ncithesaurus.nci.nih.gov/ncitbrowser/ConceptReport.jsp?dictionary=NCI_Thesaurus&ns=ncit&code=C181927,C181927,Added by Brynn 09/28/2022
Multiplexed Ion Beam Imaging,A method for multiplexed immunohistochemistry that uses secondary ion mass spectrometry to image antibodies tagged with isotopically pure elemental metal reporters. Multiplexed ion beam imaging (MIBI) is capable of analyzing up to 100 targets simultaneously over a five-log dynamic range. This technique enables comprehensive phenotypic profiling and spatial analysis of the tissue microenvironment.,,,FALSE,,Assay,,,,"Multiplexed ion beam imaging, MIBI",,https://www.nature.com/articles/s41374-020-0417-4,NCIt,
Murine Model,,,,FALSE,,Assay,,,,"Mouse Modeline, Murine Models, Mouse Modeling, Mouse Model",C94604,https://ncithesaurus.nci.nih.gov/ncitbrowser/ConceptReport.jsp?dictionary=NCI_Thesaurus&ns=ncit&code=C94604,,
Nano-hmC-Seal,,,,FALSE,,Assay,,EFO,,Nano-hmc-seal,EFO:0010040,http://www.ebi.ac.uk/efo/EFO_0010040,,
NanoString Digital Spatial Profiling,,,,FALSE,,Assay,,EFO,,"NanoString GeoMx DSP RNA assays, Nanostring digital spatial profiling",EFO:0030029,http://www.ebi.ac.uk/efo/EFO_0030029,,
Nanopatterning,,,,FALSE,,Assay,,,,Nano and Micro Patterning,,,,
Nanopore Sequencing,"A proprietary next-generation DNA sequencing technology from Oxford Nanopore Technologies that can directly identify and sequence a DNA molecule as it passes through a nanopore, driven by electrophoresis.",,,FALSE,,Assay,,,,"Oxford Nanopore Sequencing Technology, Oxford Nanopore Sequencing",,https://ncithesaurus.nci.nih.gov/ncitbrowser/ConceptReport.jsp?dictionary=NCI_Thesaurus&ns=ncit&code=C146818,C146818,
Nanowire,"A nanometer-scale wire consisting of metal atoms, silicon or other materials that conduct electricity. Nanowires are one-dimensional, and exhibit unique electrical and optical properties. They are built atom by atom on a solid surface, often as part of a microfluidic device. In addition, they can be coated with molecules such as antibodies that will bind to proteins for both basic science and clinical applications.",,,FALSE,,Assay,,,,,,https://ncithesaurus.nci.nih.gov/ncitbrowser/ConceptReport.jsp?dictionary=NCI_Thesaurus&ns=ncit&code=C62376,C62376,
Nested PCR,"Polymerase chain reaction that uses two sets of primers, in two sequential runs of amplification, with the second set intended to amplify a target within the first run product.",,,FALSE,,Assay,,,,"Nested Polymerase Chain reaction, Nested Polymerase Chain Reaction, NESTED POLYMERASE CHAIN REACTION, Nested PCR",,https://ncithesaurus.nci.nih.gov/ncitbrowser/ConceptReport.jsp?dictionary=NCI_Thesaurus&ns=ncit&code=C127880,C127880,
Next Generation Sequencing,Technologies that facilitate the rapid determination of the nucleotide sequence of large numbers of strands or segments of DNA or RNA.,,,FALSE,,Assay,,,,"Massively Parallel Sequencing, NGS, NEXT GENERATION SEQUENCING, Massively Parallel DNA Sequencing, Next-Generation Sequencing, Next Generational Sequencing",,https://ncithesaurus.nci.nih.gov/ncitbrowser/ConceptReport.jsp?dictionary=NCI_Thesaurus&ns=ncit&code=C101293,C101293,
Nm-seq,"A molecular genetic technique that combines chromatin immunoprecipitation (ChIP) with massively parallel DNA sequencing to map the binding sites of DNA-associated proteins in a sample of cells. First, crosslinked protein-DNA complexes are isolated using ChIP. Next, the crosslinks are broken, the proteins are removed and the purified DNA is modified with adaptor oligonucleotides to facilitate massively parallel DNA sequencing. Following sequencing, the DNA sequences that are obtained can be mapped to their genomic locations.",,,FALSE,,Assay,,,,,,,,
Not Applicable,Determination of a value is not relevant in the current context. (NCI),,,FALSE,,Assay,,,,"N/A, {NA}, No unit of measure required, Does Not Apply, not applicable, NOT APPLICABLE, Not applicable, {Not applicable}, na, No Apparent Adverse Event, NA",,https://ncithesaurus.nci.nih.gov/ncitbrowser/ConceptReport.jsp?dictionary=NCI_Thesaurus&ns=ncit&code=C48660,C48660,
Nuclear Magnetic Resonance,A physical phenomenon involving the interaction of atomic nuclei placed in an external magnetic field with an applied electromagnetic field oscillating at a particular frequency. Magnetic conditions within the material are measured by monitoring the radiation absorbed and emitted by the atomic nuclei. It is the underlying principle of Magnetic Resonance Imaging (MRI).,,,FALSE,,Assay,,,,"Magnetic Resonance, NMR",,https://ncithesaurus.nci.nih.gov/ncitbrowser/ConceptReport.jsp?dictionary=NCI_Thesaurus&ns=ncit&code=C16921,C16921,
