image,organ_or_tissue,string,ICD-O Origin of Disease Anatomic Site,1,6161035,caDSR,"[""Craniopharyngeal duct"",""Pleura, NOS"",""Postcricoid region"",""Posterior mediastinum"",""Posterior wall of bladder"",""Posterior wall of hypopharynx"",""Overlapping lesion of bones, joints and articular cartilage"",""Overlapping lesion of bones, joints and articular cartilage of limbs"",""Overlapping lesion of brain and central nervous system"",""Overlapping lesion of eye and adnexa"",""Overlapping lesion of heart, mediastinum and pleura"",""Overlapping lesion of peripheral nerves and autonomic nervous system"",""Overlapping lesion of rectum, anus and anal canal"",""Overlapping lesion of accessory sinuses"",""Overlapping lesion of biliary tract"",""Overlapping lesion of bladder"",""Overlapping lesion of brain"",""Overlapping lesion of breast"",""Overlapping lesion of cervix uteri"",""Overlapping lesion of colon"",""Overlapping lesion of connective, subcutaneous and other soft tissues"",""Overlapping lesion of corpus uteri"",""Posterior wall of nasopharynx"",""Posterior wall of oropharynx"",""Prepuce"",""Prostate gland"",""Pylorus"",""Pyriform sinus"",""Rectosigmoid junction"",""Rectum, NOS"",""Renal pelvis"",""Reticuloendothelial system, NOS"",""Retina"",""Peripheral nerves and autonomic nervous system of abdomen"",""Peripheral nerves and autonomic nervous system of head, face, and neck"",""Peripheral nerves and autonomic nervous system of lower limb and hip"",""Peripheral nerves and autonomic nervous system of pelvis"",""Peripheral nerves and autonomic nervous system of thorax"",""Peripheral nerves and autonomic nervous system of trunk, NOS"",""Peripheral nerves and autonomic nervous system of upper limb and shoulder"",""Rib, sternum, clavicle and associated joints"",""Short bones of upper limb and associated joints"",""Upper third of esophagus"",""Upper-inner quadrant of breast"",""Upper-outer quadrant of breast"",""Urachus"",""Ureter"",""Ureteric orifice"",""Urethra"",""Urinary system, NOS"",""Uterine adnexa"",""Uterus, NOS"",""Uvula"",""Vagina, NOS"",""Vallecula"",""Vertebral column"",""Vestibule of mouth"",""Vulva, NOS"",""Waldeyer ring"",""Unknown"",""Not Reported"",""Short bones of lower limb and associated joints"",""Spermatic cord"",""Sphenoid sinus"",""Spinal cord"",""Spinal meninges"",""Spleen"",""Splenic flexure of colon"",""Stomach, NOS"",""Subglottis"",""Sublingual gland"",""Retromolar area"",""Retroperitoneum"",""Round ligament"",""Scrotum, NOS"",""Sigmoid colon"",""Skin of lip, NOS"",""Skin of lower limb and hip"",""Skin of other and unspecified parts of face"",""Skin of scalp and neck"",""Skin of trunk"",""Skin of upper limb and shoulder"",""Skin, NOS"",""Small intestine, NOS"",""Soft palate, NOS"",""Overlapping lesion of digestive system"",""Overlapping lesion of endocrine glands and related structures"",""Overlapping lesion of esophagus"",""Overlapping lesion of female genital organs"",""Overlapping lesion of floor of mouth"",""Overlapping lesion of hypopharynx"",""Overlapping lesion of ill-defined sites"",""Overlapping lesion of larynx"",""Overlapping lesion of lip"",""Overlapping lesion of lip, oral cavity and pharynx"",""Overlapping lesion of lung"",""Overlapping lesion of major salivary glands"",""Overlapping lesion of male genital organs"",""Overlapping lesion of nasopharynx"",""Ventral surface of tongue, NOS"",""Specified parts of peritoneum"",""Ventricle, NOS"",""Bone of limb, NOS"",""Peritoneum, NOS"",""Pharynx, NOS"",""Pineal gland"",""Pituitary gland"",""Placenta"",""Nasopharynx, NOS"",""Male genital organs, NOS"",""Female genital tract, NOS"",""Central portion of breast"",""Bladder, NOS"",""Lymph nodes of head, face and neck"",""Submandibular gland"",""Superior wall of nasopharynx"",""Supraglottis"",""Tail of pancreas"",""Temporal lobe"",""Testis, NOS"",""Thoracic esophagus"",""Thorax, NOS"",""Thymus"",""Thyroid gland"",""Tongue, NOS"",""Tonsil, NOS"",""Tonsillar fossa"",""Tonsillar pillar"",""Trachea"",""Transverse colon"",""Trigone of bladder"",""Undescended testis"",""Unknown primary site"",""Upper Gum"",""Upper limb, NOS"",""Upper lobe, lung"",""Upper respiratory tract, NOS"",""Overlapping lesion of other and unspecified parts of mouth"",""Overlapping lesion of palate"",""Overlapping lesion of pancreas"",""Overlapping lesion of penis"",""Overlapping lesion of respiratory system and intrathoracic organs"",""Overlapping lesion of retroperitoneum and peritoneum"",""Overlapping lesion of skin"",""Overlapping lesion of small intestine"",""Overlapping lesion of stomach"",""Overlapping lesion of tongue"",""Overlapping lesion of tonsil"",""Overlapping lesion of urinary organs"",""Overlapping lesion of vulva"",""Overlapping lesions of oropharynx"",""Laryngeal commissure"",""Other ill-defined sites"",""Other specified parts of female genital organs"",""Other specified parts of male genital organs"",""Other specified parts of pancreas"",""Lymph nodes of axilla or arm"",""Lymph nodes of inguinal region or leg"",""Lymph nodes of multiple regions"",""Jejunum"",""Kidney, NOS"",""Labium majus"",""Labium minus"",""Lacrimal gland"",""Ovary"",""Palate, NOS"",""Pancreas, NOS"",""Pancreatic duct"",""Parametrium"",""Parathyroid gland"",""Paraurethral gland"",""Parietal lobe"",""Parotid gland"",""Pelvic bones, sacrum, coccyx and associated joints"",""Pelvic lymph nodes"",""Pelvis, NOS"",""Penis, NOS"",""Nasal cavity"",""Nervous system, NOS"",""Nipple"",""Occipital lobe"",""Olfactory nerve"",""Optic nerve"",""Orbit, NOS"",""Oropharynx, NOS"",""Main bronchus"",""Major salivary gland, NOS"",""Mandible"",""Maxillary sinus"",""Meckel diverticulum"",""Mediastinum, NOS"",""Medulla of adrenal gland"",""Meninges, NOS"",""Middle ear"",""Middle lobe, lung"",""Middle third of esophagus"",""Mouth, NOS"",""Mucosa of lip, NOS"",""Mucosa of lower lip"",""Mucosa of upper lip"",""Myometrium"",""Hard palate"",""Head of pancreas"",""Head, face or neck, NOS"",""Heart"",""Hematopoietic system, NOS"",""Hepatic flexure of colon"",""Hypopharyngeal aspect of aryepiglottic fold"",""Hypopharynx, NOS"",""Ileum"",""Ill-defined sites within respiratory system"",""Intestinal tract, NOS"",""Intra-abdominal lymph nodes"",""Intrahepatic bile duct"",""Intrathoracic lymph nodes"",""Islets of Langerhans"",""Isthmus uteri"",""Gastric antrum"",""Gallbladder"",""Axillary tail of breast"",""Laryngeal cartilage"",""Larynx, NOS"",""Lateral floor of mouth"",""Lateral wall of bladder"",""Lateral wall of nasopharynx"",""Lateral wall of oropharynx"",""Lesser curvature of stomach, NOS"",""Lingual tonsil"",""Lip, NOS"",""Liver"",""Long bones of lower limb and associated joints"",""Long bones of upper limb, scapula and associated joints"",""Lower gum"",""Lower limb, NOS"",""Lower lobe, lung"",""Lower third of esophagus"",""Lower-inner quadrant of breast"",""Lower-outer quadrant of breast"",""Lung, NOS"",""Lymph node, NOS"",""Fallopian tube"",""Floor of mouth, NOS"",""Frontal lobe"",""Frontal sinus"",""Fundus of stomach"",""Fundus uteri"",""Exocervix"",""External ear"",""External lip, NOS"",""External lower lip"",""External upper lip"",""Extrahepatic bile duct"",""Eye, NOS"",""Eyelid"",""Duodenum"",""Endocervix"",""Endocrine gland, NOS"",""Endometrium"",""Epididymis"",""Esophagus, NOS"",""Ethmoid sinus"",""Border of tongue"",""Brain stem"",""Brain, NOS"",""Branchial cleft"",""Breast, NOS"",""Broad ligament"",""Cardia, NOS"",""Carotid body"",""Cauda equina"",""Bones of skull and face and associated joints"",""Connective, subcutaneous and other soft tissues of abdomen"",""Connective, subcutaneous and other soft tissues of head, face, and neck"",""Connective, subcutaneous and other soft tissues of lower limb and hip"",""Connective, subcutaneous and other soft tissues of pelvis"",""Connective, subcutaneous and other soft tissues of thorax"",""Connective, subcutaneous and other soft tissues of trunk, NOS"",""Connective, subcutaneous and other soft tissues of upper limb and shoulder"",""Connective, subcutaneous and other soft tissues, NOS"",""Cornea, NOS"",""Corpus uteri"",""Cortex of adrenal gland"",""Cranial nerve, NOS"",""Accessory sinus, NOS"",""Abdominal esophagus"",""Ascending colon"",""Appendix"",""Aortic body and other paraganglia"",""Anterior wall of nasopharynx"",""Anterior wall of bladder"",""Anterior surface of epiglottis"",""Anterior mediastinum"",""Anterior floor of mouth"",""Anterior 2/3 of tongue, NOS"",""Anal canal"",""Ampulla of Vater"",""Gum, NOS"",""Greater curvature of stomach, NOS"",""Glottis"",""Glans penis"",""Gastrointestinal tract, NOS"",""Bone, NOS"",""Bone marrow"",""Body of stomach"",""Body of penis"",""Body of pancreas"",""Blood"",""Bladder neck"",""Biliary tract, NOS"",""Base of tongue, NOS"",""Conjunctiva"",""Commissure of lip"",""Colon, NOS"",""Cloacogenic zone"",""Clitoris"",""Ciliary body"",""Choroid"",""Cheek mucosa"",""Cervix uteri"",""Cervical esophagus"",""Cerebrum"",""Cerebral meninges"",""Cerebellum, NOS"",""Cecum"",""Abdomen, NOS"",""Acoustic nerve"",""Adrenal gland, NOS"",""Anus, NOS"",""Autonomic nervous system, NOS"",""Dorsal surface of tongue, NOS"",""Dome of bladder"",""Descending colon"",""Descended testis""]",required,Site where images are associated,,FALSE,File Anatomic Site,,TRUE
image,performed_imaging_study_typeCode,string,"Imaging Reconstruction Protocol Type Code""",1,14617551,caDSR,,required,A coded value specifying the kind of algorithm used when reconstructing the image from the data acquired during the acquisition process.,,FALSE,None,,Missing but required
image,longitudinal_temporal_event_type,string,Longitudinal Study Temporal Event Type,1,14670294,caDSR,"[""Baseline"",""Enrollment""]",optional,The type of event to which Longitudinal Temporal Offset from Event is relative.,,FALSE,File Longitudinal Event Type,,FALSE
image,longitudinal_temporal_event_offset,number,Longitudinal Study Temporal Offset Number,1,14612661,caDSR,,optional,"An offset in days from a particular event of significance. May be fractional. In the context of a clinical trial, this is often the days since enrollment, or the baseline imaging Study.",,FALSE,File Longitudinal Total Time Elapsed,,FALSE
image,crdc_id,string,,,,,,optional,The crdc_id is a unique identifier that is generated by CRDC Submission Portal,,FALSE,None,,FALSE
MultiplexMicroscopy,MultiplexMicroscopy_id,string,,,,,,required,MultiplexMicroscopy identifier,,TRUE,ImagingLevel2_id,,TRUE
MultiplexMicroscopy,acquisition_method_type,string,Biospecimen Acquisition Method Type,2,6626651,caDSR,"[""Pancreaticoduodenectomy"",""Core needle biopsy"",""Forceps Biopsy"",""Not specified"",""Re-excision"",""Punch biopsy"",""Shave biopsy"",""Lymphadenectomy (regional nodes)"",""Sentinel node biopsy"",""Not reported"",""Unknown"",""Not applicable"",""Incisional Biopsy"",""Blood draw"",""Excisional Biopsy"",""Surgical Resection"",""Autopsy"",""Fine needle aspirate"",""Biopsy"",""Other""]",optional,Records the method of acquisition or source for the specimen under consideration,,FALSE,Biospecimen Acquisition Method,,FALSE
MultiplexMicroscopy,tumor_tissue_type,string,Tumor Tissue Disease Description Type,1,3288124,caDSR,"[""Premalignant - in situ"",""Tissue"",""Tumor post-therapy"",""Tumor post-neoadjuvant therapy"",""Tumor post-adjuvant therapy"",""Normal"",""Normal distant"",""Normal adjacent"",""Atypia or hyperplasia"",""Unknown"",""Not applicable"",""Not reported"",""Local recurrence"",""Premalignant"",""Xenograft"",""NOS"",""Additional Primary"",""Primary"",""Metastatic"",""Recurrent"",""Tumor specimen from de novo untreated malignancy of the bladder""]",optional,Text that describes the kind of disease present in the tumor specimen as related to a specific timepoint (add rows to select multiple values along with timepoints),,FALSE,Biospecimen Composition,,FALSE
MultiplexMicroscopy,tissue_fixative,string,Specimen Fixative Type,4,65078,caDSR,"[""95% Ethanol"",""Carbodiimide"",""Dimethylacetamide"",""TCL Lysis Buffer"",""NP40 Lysis Buffer"",""Methacarn"",""Carnoy's Solution"",""Poloxamer"",""CryoStor"",""Acetone"",""Alcohol"",""None"",""RNAlater"",""OCT media"",""Saline"",""Glutaraldehyde"",""Unknown"",""Other"",""Formalin"",""Not applicable"",""Diimidoester"",""Para-benzoquinone"",""PAXgene Tissue"",""Not recorded""]",required,A compound that preserves tissues and cells for microscopic study.,,FALSE,Biospecimen Fixative,,TRUE
MultiplexMicroscopy,embedding_medium,string,Biospecimen Collection Medium Type,1,8037927,caDSR,"[""DMEM"",""DMEM+Serum"",""RPMI+Serum"",""PBS+Serum"",""None""]",required,A material that infiltrates and supports a specimen and preserves its shape and structure for sectioning and microscopy.,,FALSE,Biospecimen Embedding Medium,,TRUE
MultiplexMicroscopy,staining_method,string,Imaging Assay Technology Type,1,7789196,caDSR,"[""CyCIF"",""MERFISH"",""ExSeq"",""Not Applicable"",""MIBI"",""CODEX"",""GeoMX-DSP"",""IMC"",""t-CyCIF"",""IHC"",""mIHC"",""MxIF"",""SABER"",""H&E""]",required,"Any of the various methods that use a dye, reagent, or other material for producing coloration in tissues or microorganisms for microscopic examination.",,FALSE,Image Assay Type,,TRUE
MultiplexMicroscopy,objective,string,Microscope Device Objective Lens Text,1,7788935,caDSR,,optional,An_objective_is an optical element that gathers light from an object being observed and_focuses_the_light rays_from it to produce a_real image_of the object.,,FALSE,Image Objective,,FALSE
MultiplexMicroscopy,nominal_magnification,string,Microscope Device Nominal Magnification Float Value,1,7788940,caDSR,,optional,The magnification of the lens as specified by the manufacturer - i.e. '60' is a 60X lens. floating point value > 1(no units),,FALSE,Image Nominal Magnification,,FALSE
MultiplexMicroscopy,immersion,string,Microscope Device Immersion Medium Type,1,8058286,caDSR,"[""Oil"",""Water"",""Air"",""Glycerol"",""Other"",""Multi""]",optional,Immersion medium,,FALSE,Image Immersion Type,,FALSE
MultiplexMicroscopy,lens_numerical_aperture,string,Microscope Device Lens Numerical Aperture Float Value,1,7788942,caDSR,,optional,The numerical aperture of the lens. Floating point value > 0.,,FALSE,Image Lense Aperture,,FALSE
MultiplexMicroscopy,working_distance,string,Microscope Device Working Distance Float Value,1,7788943,caDSR,,optional,"The working distance of the lens, expressed as a floating point number. Floating point > 0. Size needs to be specified in microns (um)",,FALSE,Image Working Distance,,FALSE
MultiplexMicroscopy,imaging_assay_type,string,Imaging Assay Technology Type,1,7789196,caDSR,"[""CyCIF"",""MERFISH"",""ExSeq"",""Not Applicable"",""MIBI"",""CODEX"",""GeoMX-DSP"",""IMC"",""t-CyCIF"",""IHC"",""mIHC"",""MxIF"",""SABER"",""H&E""]",required,Type of imaging assay,,FALSE,Image Assay Type,,TRUE
MultiplexMicroscopy,pyramid,string,Image Processing Pyramid Representation True False Indicator,1,7788945,caDSR,"[""True"",""False""]",optional,The data file contains an image pyramid,,FALSE,Image Pyramidal,,FALSE
MultiplexMicroscopy,physical_size_x,string,Pixel X-Dimension Float Value,1,7786584,caDSR,,optional,Physical size (X-dimension) of a pixel. Floating point value > 0. Size needs to be specified in microns (um),,FALSE,Image Physical Size X,,FALSE
MultiplexMicroscopy,physical_size_y,string,Pixel Y-Dimension Float Value,1,7786585,caDSR,,optional,Physical size (Y-dimension) of a pixel. Floating point value > 0. Size needs to be specified in microns (um),,FALSE,Image Physical Size Y,,FALSE
MultiplexMicroscopy,physical_size_z,string,Pixel Z-Dimension Float Value,1,7786586,caDSR,,optional,Physical size (Z-dimension) of a pixel. Floating point value > 0. Size needs to be specified in microns (um),,FALSE,Image Physical Size Z,,FALSE
MultiplexMicroscopy,size_c,string,OME TIFF Channel Count,1,7794859,caDSR,,optional,Number of channels. Integer >= 1,,FALSE,Image Channel Size,,FALSE
MultiplexMicroscopy,size_t,string,OME TIFF Timepoint Count,1,7794860,caDSR,,optional,Number of time points. Integer >= 1,,FALSE,Image Number of Timepoints,,FALSE
MultiplexMicroscopy,size_x,string,OME TIFF X-Dimension Pixel Measurement,1,7788567,caDSR,"[""m""]",optional,Size of image: X dimension (in pixels). Integer >= 1,,FALSE,Image X Pixels,,FALSE
MultiplexMicroscopy,size_y,string,OME TIFF Y-Dimension Pixel Measurement,1,7788568,caDSR,"[""m""]",optional,Size of image: Y dimension (in pixels). Integer >= 1,,FALSE,Image Y Pixels,,FALSE
MultiplexMicroscopy,size_z,string,OME TIFF Z-Dimension Pixel Measurement,1,7788569,caDSR,"[""m""]",optional,Size of image: Z dimension (in pixels). Integer >= 1,,FALSE,Image Z Pixels,,FALSE
MultiplexMicroscopy,channel_metadata_filename,string,Channel Analysis Metadata Electronic File Name Text,1,7787678,caDSR,,required,File name of uploaded companion CSV file containing channel-level metadata details,,FALSE,ImagingChannel Key,Use to select file name,TRUE
MultiplexMicroscopy,channel_metadata_file_url_in_cds,string,Electronic File Pathname Text,2,11556141,caDSR,,optional,Electronic file pathname text,,FALSE,None,,FALSE
MultiplexMicroscopy,channel_id,string,OME Tagged Image File Format Channel Identifier,1,14765171,caDSR,,required,The unique channel identifier for each channel in this image must match the corresponding field in the OME-TIFF header,,FALSE,ImagingChannel_id,,TRUE
MultiplexMicroscopy,channel_name,string,OME Tagged Image File Format Channel Name,1,14765172,caDSR,,required,Channel label for each channel in this image must match the corresponding field in the OME-TIFF header,,FALSE,Channel Name,,TRUE
MultiplexMicroscopy,cycle_number,string,Multiplex Imaging Reagent Cycle Number Integer,1,14765176,caDSR,,optional,the cycle # in which the co-listed reagent(s) was(were) used,,FALSE,Channel Cycle Number,,FALSE
MultiplexMicroscopy,sub_cycle_number,string,Multiplex Imaging Reagent Sub-Cycle Number Integer,1,14765180,caDSR,,optional,sub-cycle #,,FALSE,Channel Sub-cycle Number,,FALSE
MultiplexMicroscopy,target_name,string,Multiplex Imaging Reagent Sub-Cycle Number Integer,1,14765180,caDSR,,optional,short descriptive name (abbreviation) for this target (antigen),,FALSE,Channel Target Name,,FALSE
MultiplexMicroscopy,antibody_name,string,Tissue Slide IHC Antibody Used Type,1,14765184,caDSR,,optional,short descriptive name for this antibody,,FALSE,Channel Antibody Name,,FALSE
MultiplexMicroscopy,rrid_identifier,string,Multiplex Imaging Research Resource Identifier Text,1,14767247,caDSR,,optional,Research Resource Identifier,,FALSE,Channel Resource ID,,FALSE
MultiplexMicroscopy,fluorophore,string,Multiplex Imaging Fluorescent Dye Text,1,14767255,caDSR,,optional,Fluorescent dye label,,FALSE,Channel Fluorophore,,FALSE
MultiplexMicroscopy,clone,string,Multiplex Imaging Clone Unique Identifier,1,14767258,caDSR,,optional,Unique clone identifier,,FALSE,Channel Antibody Clone,,FALSE
MultiplexMicroscopy,lot,string,Multiplex Imaging Vendor Lot Number Text,1,14769695,caDSR,,optional,lot number from vendor,,FALSE,Channel Antibody Lot,,FALSE
MultiplexMicroscopy,catalog_number,string,Multiplex Imaging Vendor Catalog Number Text,1,14767261,caDSR,,optional,catalog number from vendor,,FALSE,Channel Antibody Catalog Number,,FALSE
MultiplexMicroscopy,excitation_wavelength,string,Multiplex Imaging Excitation Wavelength Number,1,14765187,caDSR,"[""1"",""2"",""3"",""4"",""5"",""6"",""7"",""8"",""9"",""10"",""0""]",optional,center/peak of the excitation spectrum (nm),,FALSE,Channel Excitation Wavelength,,FALSE
MultiplexMicroscopy,emission_wavelength,string,Multiplex Imaging Emission Wavelength Number,1,14767264,caDSR,"[""1"",""2"",""3"",""4"",""5"",""6"",""7"",""8"",""9"",""10"",""0""]",optional,center/peak of the emission spectrum (nm),,FALSE,Channel Emission Wavelength,,FALSE
MultiplexMicroscopy,excitation_bandwidth,string,Multiplex Imaging Excitation Bandwidth Number,1,14765190,caDSR,"[""1"",""2"",""3"",""4"",""5"",""6"",""7"",""8"",""9"",""10"",""0""]",optional,nominal width of excitation spectrum (nm),,FALSE,Channel Excitation Bandwidth,,FALSE
MultiplexMicroscopy,emission_bandwidth,string,Multiplex Imaging Emission Bandwidth Number,1,14765193,caDSR,"[""1"",""2"",""3"",""4"",""5"",""6"",""7"",""8"",""9"",""10"",""0""]",optional,nominal width of emission spectrum (nm),,FALSE,Channel Emission Bandwidth,,FALSE
MultiplexMicroscopy,metal_isotope_element_abbreviation,string,Multiplex Imaging Isotope Abbreviation Name,1,14765198,caDSR,,optional,Element abbreviation,,FALSE,Channel Metal Symbol,,FALSE
MultiplexMicroscopy,metal_isotope_element_mass,string,Multiplex Imaging Isotope Element Number Identifier,1,14765201,caDSR,,optional,Element mass number,,FALSE,Channel Metal Isotope,,FALSE
MultiplexMicroscopy,oligo_barcode_upper_strand,string,Multiplex Imaging Oligonucleotide Barcode Upper Strand Text,1,14765205,caDSR,,optional,DNA barcode used for labeling,,FALSE,Channel Oligo Barcode Upper Strand,,FALSE
MultiplexMicroscopy,oligo_barcode_lower_strand,string,Multiplex Imaging Oligonucleotide Barcode Lower Strand Text,1,14765208,caDSR,,optional,DNA barcode used for labeling,,FALSE,Channel Oligo Barcode Lower Strand,,FALSE
MultiplexMicroscopy,dilution,string,Multiplex Imaging Final Dilution Ratio Number,1,14767270,caDSR,"[""1"",""2"",""3"",""4"",""5"",""6"",""7"",""8"",""9"",""10"",""0""]",optional,Final dilution ratio used in experiment,,FALSE,Channel Probe Dilution Ratio,,FALSE
MultiplexMicroscopy,concentration,string,Multiplex Imaging Final Concentration Number,1,14768386,caDSR,"[""1"",""2"",""3"",""4"",""5"",""6"",""7"",""8"",""9"",""10"",""0""]",optional,Final concentration used in experiment,,FALSE,Channel Probe Concentration,,FALSE
MultiplexMicroscopy,crdc_id,string,,,,,,optional,The crdc_id is a unique identifier that is generated by CRDC Submission Portal,,FALSE,None,,FALSE
NonDICOMCTimages,NonDICOMCTimages_id,string,,,,,,required,NonDICOMCTimages identifier,,TRUE,None,,Missing but required
NonDICOMCTimages,CTAquisitionProtocolElement_singleCollimationWidth,string,Image Single Collimation Width 8 Byte Millimeter Number,1,2903347,caDSR,,optional,"The width of a single row of acquired data. The units are of linear distance, e.g. mm.",,FALSE,None,,FALSE
NonDICOMCTimages,CTAquisitionProtocolElement_totalCollimationWidth,string,Image Total Collimation Width 8 Byte Millimeter Number,1,2903328,caDSR,,required,"The width of the total collimation over the area of active x-ray detection. The units are of linear distance, e.g. mm.",,FALSE,None,,Missing but required
NonDICOMCTimages,CTAquisitionProtocolElement_gantryDetectorTilt,string,Image Gantry Detector Tilt 16 Character Number,1,2656117,caDSR,,required,"Nominal angle of tilt in degrees of the scanning gantry. The units are of plane angle , e.g. degrees. Zero degrees means the gantry is not tilted, negative degrees are when the top of the gantry is tilted away from where the table enters the gantry.",,FALSE,None,,Missing but required
NonDICOMCTimages,CTAquisitionProtocolElement_spiralPitchFactor,string,Computed Tomography Pitch Factor Number,1,2414556,caDSR,"[""e.g., 2:1""]",required,"Ratio of the distance that the table moves during a complete revolution of the source around the gantry orbit, to the width of the total collimation over the area of active x-ray detection. The units are of unity.",,FALSE,None,,Missing but required
NonDICOMCTimages,CTAquisitionProtocolElement_ctdiVol,string,Computed Tomography Dose Index Volume Quantity 8 Byte Number,1.1,3882991,caDSR,,required,"The average dose over the total volume scanned for the selected CT conditions of operation (calculated according to IEC 60601-2-44, Ed.2.1 (Clause 29.1.103.4)). The units are energy dose, e.g. mGy.",,FALSE,None,,Missing but required
NonDICOMCTimages,CTAquisitionProtocolElement_ctdiPhantomTypeCode,string,Imaging Technique CTDI Phantom Type Sequence of Items Text,1,14612683,caDSR,,required,The type of phantom to use for CTDI measurement according to IEC 60601-2-44,,FALSE,None,,Missing but required
NonDICOMCTimages,CTAquisitionProtocolElement_kVp,string,Image Kilovolt Peak Float 16 Number,1,2904496,caDSR,,required,Peak kilovoltage output of the x-ray generator. The units are of electrical potential.,,FALSE,None,,Missing but required
NonDICOMCTimages,CTAquisitionProtocolElement_exposureModulationType_Code,string,Imaging Technique Exposure Modulation Type,1,14617524,caDSR,"[""NONE"",""ANGULAR"",""LONGITUDINAL"",""ECG-BASED"",""ORGAN-BASED""]",optional,The manner in which tube current is varied in order to limit the dose.,,FALSE,None,,FALSE
NonDICOMCTimages,CTImageReconstructionProtocolElement_convolutionKernel,string,Image Convolution Kernel 16 Character Text,1,2656119,caDSR,,optional,A label describing the mathematical operations used to reconstruct images from the acquired data. The values for this attribute are vendor specific and not coded.,,FALSE,None,,FALSE
NonDICOMCTimages,CTImageReconstructionProtocolElement_convolutionKernelGroupCode,string,Imaging Technique Convolution Kernel Group Name,1,14617525,caDSR,,optional,A coded value specifying the family of mathematical operations to use to reconstruct images from the acquired data,,FALSE,None,,FALSE
NonDICOMCTimages,crdc_id,string,,,,,,optional,The crdc_id is a unique identifier that is generated by CRDC Submission Portal,,FALSE,None,,FALSE
NonDICOMMRimages,NonDICOMMRimages_id,string,,,,,,required,NonDICOMMRimages identifier,,TRUE,None,,Missing but required
NonDICOMMRimages,MRImageAcquisitionProtocolElement_echoPulseSequenceCategoryCode,string,Image Acquisition Spin-Echo Pulse Sequence Code Category,1,14645641,caDSR,"[""SPIN"",""GRADIENT"",""BOTH""]",optional,A coded value specifying an echo category of pulse sequences.,,FALSE,None,,FALSE
