Attribute,Description,Valid Values,DependsOn,Required,Properties,Parent,DependsOn Component,Source,Validation Rules
Tool Output Data,"Type of primary output data. Multiple values permitted, comma separated.","Accession, Alignment, Biological Model ID, Biological Model Name, Cell Line Name, Cell Migration Track Image, Cell Type Identifier, Cell Type Name, Cell Type Ontology ID, Chromosome Name, Chromosome Report, Clustered Expression Profiles, Codon Number, Comparison Matrix, Compound Identifier, Compound Name, Concentration, Count Matrix, DNA Sequence, Data Index, Data Reference, Database Search Results, Drug Identifier, Drug Name, Drug Report, Electronic Health Record, Enzyme Kinetics Data, Experimental Measurement, Expression Data, GO-Term Enrichment Data, Gene Expression Matrix, Gene Expression Profile, Gene ID, Gene ID (NCBI), Gene Identifier, Gene Name, Gene Report, Gene Symbol, Gene Tree, Genetic Map, Genotype/Phenotype Report, Heat Map, Hidden Markov Model, Hierarchy, Histogram, Identifier, Image, Image Metadata, Kinetic Model, MRI Image, Map, Map Data, Mass Spectrometry Data, Mass Spectrum, Mathematical Model, Matrix, Molecular Property, Molecular Simulation Data, Molecule Identifier, Molecule Name, Morphology Parameter, Mutation ID, Not Applicable, Nucleic Acid Identifier, Nucleic Acid Report, Nucleic Acid Sequence, Ontology, Ontology Concept Data, Ontology Data, Ontology Identifier, Ontology Mapping, Ontology Name, Ontology Term, Organism Identifier, Organism Name, Over-Represesntation Data, P-Value, Pair Sequence Alignment, Pathway Or Network, Pathway Or Network Report, Pathway Overrepresentation Data, Peptide Identification, Peptide Property, Phenotype Name, Phylogenetic Data, Phylogenetic Tree, Plain Text, Plot, Position Weight Matrix, Position-Specific Scoring Matrix, Protein Contact Map, Protein Identifier, Protein Interaction Data, Protein Name, Protein Property, Protein Report, Protein Sequence, Protein Structure Report, Quality Control Report, RNA Sequence, Raw Image, Reaction Data, RefSeq Accession, Report, Resource Metadata, Sample Annotation, Sample ID, Score, Sequence, Sequence Alignment, Sequence Attribute, Sequence Cluster, Sequence Composition Plot, Sequence Composition Report, Sequence Coordinates, Sequence Features, Sequence Image, Sequence Motif, Sequence Position, Sequence Property, Sequence Range, Sequence Record, Sequence Report, Sequence Search Results, Sequence Set, Sequence Signature Data, Sequence Similarity, Sequence Similarity Score, Sequence Variations, Simulation, Small Molecule Report, Spectrum, Statistical Estimate Score, Strain Identifier, Strain Name, Structure, Structure Report, Taxonomy, Text Data, Text Mining Report, Topology Data, Training Material, Trajectory Data, Transcription Factor Identifier, Transcription Factor Name, Vmax, dbSNP ID",,TRUE,,,,biotoolsschema,list like
Tool Input Format,"Allowed format(s) of the input data. Multiple values permitted, comma separated.","Alignment Format, Alignment Format (Pair Only), Alignment Format (Text), Annotated Text Format, Antimony, BAM, BCF, BED, BLAST Results, BNGL, Binary Format, Biological Model Format, Biological Pathway Or Network Format, CSV, Chemical Data Format, Cytoband Format, Cytoscape Input File Format, DCD, DSV, Database Hits (Sequence) Format , Docker Image Format, Document Format, Dot-Bracket Format, FASTA, FASTQ, FASTQ-Illumina, FCS, GCT/Res Format, GFF, GFF3, GIF, GML, GTF, Gene Annotation Format, Gene Cluster Format, Gene Expression Report Format, Genotype And Phenotype Annotation Format, Graph Format, H5AD, HDF, HDF5, HTML, Hidden Markov Model Format, Image Format, Individual Genetic Data Format, JPG, JSON, LSM, MAF, MAGE-ML, MAGE-TAB, MAT, MATLAB Script, MSF, Map Format, Mass Spectrometry Data Format, Matrix Format, NIFTI Format, Nexus Format, Not Applicable, NumPy Format, OME-TIFF, Ontology Format, PDF, PNG, PS, PSF, Phylip Format, Phylip Format Variant, Phylogenetic Tree Format, Phylogenetic Tree Format (Text), Protein Interaction Format, Python Script, R File Format, R Script, RDS, RNA Annotation Format, RNA Secondary Structure Format, RPKM, Raw Sequence Format, SAM, SBML, SQLite Format, SVG, Scores Format, Sequence Annotation Track Format, Sequence Cluster Format, Sequence Cluster Format (Protein), Sequence Feature Annotation Format, Sequence Feature Table Format, Sequence Feature Table Format (Text), Sequence Profile Format, Sequence Range Format, Sequence Record Format, Sequence Trace Format, Sequence Variation Annotation Format, TIFF, TSV, TXT, Tertiary Structure Format, Textual Format, Topology Format, Trajectory Format, VCF, Workflow Format, XML, YAML, bedgraph, bigWig, cel, imzML Metadata File, mzML, nii, pkl, sif, xls, xlsx, PDB, HED, MRC, Unspecified",,TRUE,,,,biotoolsschema,list like
Tool Output Format,"Allowed format(s) of the output data. Multiple values permitted, comma separated.","Alignment Format, Alignment Format (Pair Only), Alignment Format (Text), Annotated Text Format, Antimony, BAM, BCF, BED, BLAST Results, BNGL, Binary Format, Biological Model Format, Biological Pathway Or Network Format, CSV, Chemical Data Format, Cytoband Format, Cytoscape Input File Format, DCD, DSV, Database Hits (Sequence) Format , Docker Image Format, Document Format, Dot-Bracket Format, FASTA, FASTQ, FASTQ-Illumina, FCS, GCT/Res Format, GFF, GFF3, GIF, GML, GTF, Gene Annotation Format, Gene Cluster Format, Gene Expression Report Format, Genotype And Phenotype Annotation Format, Graph Format, H5AD, HDF, HDF5, HTML, Hidden Markov Model Format, Image Format, Individual Genetic Data Format, JPG, JSON, LSM, MAF, MAGE-ML, MAGE-TAB, MAT, MATLAB Script, MSF, Map Format, Mass Spectrometry Data Format, Matrix Format, NIFTI Format, Nexus Format, Not Applicable, NumPy Format, OME-TIFF, Ontology Format, PDF, PNG, PS, PSF, Phylip Format, Phylip Format Variant, Phylogenetic Tree Format, Phylogenetic Tree Format (Text), Protein Interaction Format, Python Script, R File Format, R Script, RDS, RNA Annotation Format, RNA Secondary Structure Format, RPKM, Raw Sequence Format, SAM, SBML, SQLite Format, SVG, Scores Format, Sequence Annotation Track Format, Sequence Cluster Format, Sequence Cluster Format (Protein), Sequence Feature Annotation Format, Sequence Feature Table Format, Sequence Feature Table Format (Text), Sequence Profile Format, Sequence Range Format, Sequence Record Format, Sequence Trace Format, Sequence Variation Annotation Format, TIFF, TSV, TXT, Tertiary Structure Format, Textual Format, Topology Format, Trajectory Format, VCF, Workflow Format, XML, YAML, bedgraph, bigWig, cel, imzML Metadata File, mzML, nii, pkl, sif, xls, xlsx, PDB, HED, MRC, Unspecified",,TRUE,,,,biotoolsschema,list like
Tool Function Note,"Concise comment about this function, if not apparent from the software description and EDAM annotations.",,,FALSE,,,,biotoolsschema,
Tool Cmd,"Relevant command, command-line fragment, or option for executing this function/running the tool in this mode.",,,FALSE,,,,biotoolsschema,
Tool Type,"A type of application software: a discrete software entity can have more than one type. Multiple values permitted, comma separated.","Bioinformatics Portal, Command-Line Tool, Database Portal, Desktop Application, Library, Notebook, Ontology, Other, Plug-In, SPARQL Endpoint, Script, Serialized Model, Suite, Web API, Web Application, Web Service, Workbench, Workflow",,FALSE,,,,biotoolsschema,list like
Tool Topic,"General scientific domain the software serves, or other general category. Multiple values permitted, comma separated.","Allergy Clinical Immunology and Immunotherapeutics, Biochemistry, Bioimaging, Bioinformatics, Biological Databases, Biology, Biomedical Science, Biomolecular Simulation, Biophysics, Biotechnology, Biotherapeutics, Cell Biology, Cell Culture Collection, Chemistry, Chip-Seq, Chromosome Conformation Capture, Comparative Genomics, Compound Libraries and Screening, Computational Biology, Computer Science, Cytogenetics, Cytometry, DNA, DNA Mutation, DNA Packaging, DNA Polymorphism, Data Architecture Analysis and Design, Data Identity and Mapping, Data Mining, Data Submission Annotation and Curation, Data Visualisation, Developmental Biology, Drug Development, Drug Discovery, Drug Metabolism, Electron Microscopy, Epigenetics, Evolutionary Biology, Exome Sequencing, Experimental Design and Studies, Function Analysis, Functional Genomics, Functional Regulatory and Non-Coding RNA, GWAS Study, Gene Expression, Gene Regulation, Gene Structure, Gene Transcripts, Gene and Protein Families, Genetic Engineering, Genetic Variation, Genetics, Genomics, Genotype and Phenotype, Imaging, Immunoinformatics, Immunology, Immunomics, Immunoprecipitation Experiment, Immunoproteins and Antigens, Infectious Disease, Informatics, Laboratory Techniques, Light Microscopy, Lipids, Machine Learning, Mapping, Mathematics, Medical Imaging, Medical Informatics, Medicine, Medicines Research and Development, Membrane and Lipoproteins, Metagenomics, Molecular Biology, Molecular Genetics, Molecular Interactions Pathways and Networks, Nucleic Acid Structure Analysis, Nucleic Acids, Omics, Oncology, Ontology and Terminology, Pathology, Pharmacogenomics, Pharmacology, Pharmacovigilance, Phylogenetics, Phylogenomics, Phylogeny, Preclinical and Clinical Studies, Probes and Primers, Protein Expression, Protein Modifications, Protein Properties, Proteins, Proteomics, Proteomics Experiment, RNA, RNA-Seq, Safety Sciences, Sample Collections, Sequence Analysis, Sequencing, Simulation Experiment, Software Engineering, Statistics and Probability, Structural Analysis, Structural Biology, Systems Biology, Transcription Factors and Regulatory Sites, Transcriptomics, Virology, Whole Genome Sequencing, Workflows, scRNA-Seq",,FALSE,,,,biotoolsschema,list like
Tool Operating System,"The operating system supported by a downloadable software package. Multiple values permitted, comma separated.","Linux, Mac, Windows",,FALSE,,,,biotoolsschema,list like
Tool Language,"Name of programming language the software source code was written in. Multiple values permitted, comma separated.","AWK, ActionScript, Ada, AppleScript, Assembly Language, Bash, C, C#, C++, COBOL, CSS, CWL, ColdFusion, D, Delphi, Dockerfile, Dylan, Eiffel, Elm, Forth, Fortran, Go, Groovy, HTML, Haskell, Icarus, JSP, Java, JavaScript, Julia, LabVIEW, Lisp, Lua, MATLAB, MLXTRAN, Maple, Mathematica, NMTRAN, Netlogo, Nextflow, Ocaml, OpenEdge ABL, Other, PHP, Pascal, Perl, PostScript, PowerShell, Prolog, PyMOL, Python, R, REXX, Racket, Ruby, SAS, SQL, Scala, Scheme, Shell, TeX, Turing, VHDL, Verilog, Visual Basic, WDL, XAML",,FALSE,,,,biotoolsschema,list like
Tool License,Software or data usage license.,"AAL, ADSL, AFL-1.1, AFL-1.2, AFL-2.0, AFL-2.1, AFL-3.0, AGPL-1.0, AGPL-3.0, AMDPLPA, AML, AMPAS, ANTLR-PD, APAFML, APL-1.0, APSL-1.0, APSL-1.1, APSL-1.2, APSL-2.0, Abstyles, Adobe-2006, Adobe-Glyph, Afmparse, Aladdin, Apache-1.0, Apache-1.1, Apache-2.0, Artistic-1.0, Artistic-1.0-Perl, Artistic-1.0-cl8, Artistic-2.0, BSD-2-Clause, BSD-2-Clause-FreeBSD, BSD-2-Clause-NetBSD, BSD-3-Clause, BSD-3-Clause-Attribution, BSD-3-Clause-Clear, BSD-3-Clause-LBNL, BSD-3-Clause-No-Nuclear-License, BSD-3-Clause-No-Nuclear-License-2014, BSD-3-Clause-No-Nuclear-Warranty, BSD-4-Clause, BSD-4-Clause-UC, BSD-Protection, BSD-Source-Code, BSD-style, BSL-1.0, Bahyph, Barr, Beerware, BitTorrent-1.0, BitTorrent-1.1, Borceux, CATOSL-1.1, CC-BY-1.0, CC-BY-2.0, CC-BY-2.5, CC-BY-3.0, CC-BY-4.0, CC-BY-NC-1.0, CC-BY-NC-2.0, CC-BY-NC-2.5, CC-BY-NC-3.0, CC-BY-NC-4.0, CC-BY-NC-ND-1.0, CC-BY-NC-ND-2.0, CC-BY-NC-ND-2.5, CC-BY-NC-ND-3.0, CC-BY-NC-ND-4.0, CC-BY-NC-SA-1.0, CC-BY-NC-SA-2.0, CC-BY-NC-SA-2.5, CC-BY-NC-SA-3.0, CC-BY-NC-SA-4.0, CC-BY-ND-1.0, CC-BY-ND-2.0, CC-BY-ND-2.5, CC-BY-ND-3.0, CC-BY-ND-4.0, CC-BY-SA-1.0, CC-BY-SA-2.0, CC-BY-SA-2.5, CC-BY-SA-3.0, CC-BY-SA-4.0, CC0-1.0, CDDL-1.0, CDDL-1.1, CECILL-1.0, CECILL-1.1, CECILL-2.0, CECILL-2.1, CECILL-B, CECILL-C, CNRI-Jython, CNRI-Python, CNRI-Python-GPL-Compatible, CPAL-1.0, CPL-1.0, CPOL-1.02, CUA-OPL-1.0, Caldera, ClArtistic, Condor-1.1, Crossword, CrystalStacker, Cube, D-FSL-1.0, DOC, DSDP, Dotseqn, ECL-1.0, ECL-2.0, EFL-1.0, EFL-2.0, EPL-1.0, EUDatagrid, EUPL-1.0, EUPL-1.1, Entessa, ErlPL-1.1, Eurosym, FSFAP, FSFUL, FSFULLR, FTL, Fair, Frameworx-1.0, FreeImage, Freeware, GFDL-1.1, GFDL-1.2, GFDL-1.3, GL2PS, GPL-1.0, GPL-2.0, GPL-3.0, Giftware, Glide, Glulxe, HPND, HaskellReport, IBM-pibs, ICU, IJG, IPA, IPL-1.0, ISC, ImageMagick, Imlib2, Info-ZIP, Intel, Intel-ACPI, Interbase-1.0, JSON, JasPer-2.0, LAL-1.2, LAL-1.3, LGPL-2.0, LGPL-2.1, LGPL-3.0, LGPLLR, LPL-1.0, LPL-1.02, LPPL-1.0, LPPL-1.1, LPPL-1.2, LPPL-1.3a, LPPL-1.3c, Latex2e, Leptonica, LiLiQ-P-1.1, LiLiQ-R-1.1, LiLiQ-Rplus-1.1, Libpng, MIT, MIT-CMU, MIT-advertising, MIT-enna, MIT-feh, MITNFA, MPL-1.0, MPL-1.1, MPL-2.0, MPL-2.0-no-copyleft-exception, MS-PL, MS-RL, MTLL, MakeIndex, MirOS, Motosoto, Multics, Mup, NASA-1.3, NBPL-1.0, NCSA, NGPL, NLOD-1.0, NLPL, NOSL, NPL-1.0, NPL-1.1, NPOSL-3.0, NRL, NTP, Naumen, NetCDF, Newsletr, Nokia, Not licensed, Noweb, Nunit, OCCT-PL, OCLC-2.0, ODbL-1.0, OFL-1.0, OFL-1.1, OGTSL, OLDAP-1.1, OLDAP-1.2, OLDAP-1.3, OLDAP-1.4, OLDAP-2.0, OLDAP-2.0.1, OLDAP-2.1, OLDAP-2.2, OLDAP-2.2.1, OLDAP-2.2.2, OLDAP-2.3, OLDAP-2.4, OLDAP-2.5, OLDAP-2.6, OLDAP-2.7, OLDAP-2.8, OML, OPL-1.0, OSET-PL-2.1, OSL-1.0, OSL-1.1, OSL-2.0, OSL-2.1, OSL-3.0, OpenSSL, Other, PDDL-1.0, PHP-3.0, PHP-3.01, Plexus, PostgreSQL, Proprietary, Python-2.0, QPL-1.0, Qhull, RHeCos-1.1, RPL-1.1, RPL-1.5, RPSL-1.0, RSA-MD, RSCPL, Rdisc, Ruby, SAX-PD, SCEA, SGI-B-1.0, SGI-B-1.1, SGI-B-2.0, SISSL, SISSL-1.2, SMLNJ, SMPPL, SNIA, SPL-1.0, SWL, Saxpath, Sendmail, SimPL-2.0, Sleepycat, Spencer-86, Spencer-94, Spencer-99, SugarCRM-1.1.3, TCL, TMate, TORQUE-1.1, TOSL, UPL-1.0, Unicode-TOU, Unlicense, VOSTROM, VSL-1.0, Vim, W3C, W3C-19980720, WTFPL, Watcom-1.0, Wsuipa, X11, XFree86-1.1, XSkat, Xerox, Xnet, YPL-1.0, YPL-1.1, ZPL-1.1, ZPL-2.0, ZPL-2.1, Zed, Zend-2.0, Zimbra-1.3, Zimbra-1.4, Zlib, bzip2-1.0.5, bzip2-1.0.6, curl, diffmark, dvipdfm, eGenix, gSOAP-1.3b, gnuplot, iMatix, libtiff, mpich2, psfrag, psutils, xinetd, xpp, zlib-acknowledgement",,FALSE,,,,biotoolsschema,
Tool Cost,Monetary cost of acquiring the software.,"Commercial, Free of Charge, Free of Charge (With Restrictions)",,FALSE,,,,biotoolsschema,
Tool Accessibility,Whether there are non-monetary restrictions on accessing an online service.,"Open Access, Open Access (With Restrictions), Restricted Access",,FALSE,,,,biotoolsschema,
Tool Download Url,Link to download (or repo providing a download) for the software.,,,FALSE,,,,biotoolsschema,
Tool Download Type,"The type of data, information, or system that is obtained when the link is resolved.","API Specification, Binaries, Biological Data, Command-Line Specification, Container File, Downloads Page, Icon, Other, Screenshot, Software Package, Source Code, Test Data, Test Script, Tool Wrapper (CWL), Tool Wrapper (Galaxy), Tool Wrapper (Taverna), Tool wrapper (Other), VM Image",,FALSE,,,,biotoolsschema,
Tool Download Note,Comment about the download.,,,FALSE,,,,biotoolsschema,
Tool Download Version,Version information (typically a version number) of the software applicable to this download.,,,FALSE,,,,biotoolsschema,
Tool Documentation Url,Link to documentation on the web for the tool.,,,FALSE,,,,biotoolsschema,
Tool Documentation Type,"Type of documentation that is linked to. Multiple values permitted, comma separated.","API Documentation, Citation Instructions, Code of Conduct, Command-Line Options, Contributions Policy, FAQ, General, Governance, Installation Instructions, Other, Quick Start Guide, Release Notes, Terms of Use, Training Material, User Manual",,FALSE,,,,biotoolsschema,list like
Tool Documentation Note,Comment about the documentation.,,,FALSE,,,,biotoolsschema,
Tool Link Url,A link of some relevance to the software (URL).,,,FALSE,,,,biotoolsschema,
Tool Link Type,"The type of data, information or system that is obtained when the link is resolved. Multiple values permitted, comma separated.","Discussion Forum, Galaxy Service, Helpdesk, Issue Tracker, Mailing list, Mirror, Other, Repository, Service, Social Media, Software Catalogue, Technical Monitoring",,FALSE,,,,biotoolsschema,list like
Tool Link Note,Comment about the link.,,,FALSE,,,,biotoolsschema,
Tool Grant,"Tools associated with a grant, joined by uuids from the tool table and grant table.",,"Component, Tool, Grant",FALSE,,,"Tool, Grant",,
Tool View,The denormalized manifest for tool submission.,,"Component, Tool Pubmed Id, Tool Grant Number, Tool Name, Tool Description, Tool Homepage, Tool Version, Tool Operation, Tool Input Data, Tool Output Data, Tool Input Format, Tool Output Format, Tool Function Note, Tool Cmd, Tool Type, Tool Topic, Tool Operating System, Tool Language, Tool License, Tool Cost, Tool Accessibility, Tool Download Url, Tool Download Type, Tool Download Note, Tool Download Version, Tool Documentation Url, Tool Documentation Type, Tool Documentation Note, Tool Link Url, Tool Link Type, Tool Link Note",FALSE,,,"Publication, Dataset, Grant, Tool",,
Tool Grant Number,"Grant number associated with the tool's development. Multiple values permitted, comma separated.","Affiliated/Non-Grant Associated, CA184897, CA184898, CA188388, CA193313, CA193417, CA193419, CA193461, CA193489, CA195469, CA199315, CA202123, CA202144, CA202177, CA202229, CA202241, CA209891, CA209923, CA209971, CA209975, CA209978, CA209988, CA209992, CA209997, CA210152, CA210173, CA210180, CA210181, CA210184, CA210190, CA214282, CA214292, CA214297, CA214300, CA214354, CA214369, CA214381, CA214411, CA215709, CA215794, CA215798, CA215845, CA215848, CA217297, CA217376, CA217377, CA217378, CA217450, CA217456, CA217514, CA217613, CA217617, CA217655, CA220378, CA223976, CA224012, CA224013, CA224044, CA225088, CA225566, CA227136, CA227544, CA227550, CA228608, CA228963, CA231978, CA232137, CA232161, CA232209, CA232216, CA232382, CA232517, CA234787, CA235747, CA238475, CA238720, CA238728, CA240301, CA241137, CA241927, CA243004, CA243007, CA243072, CA243073, CA243075, CA244100, CA244101, CA244107, CA244109, CA245313, CA248890, CA249799, CA250040, CA250044, CA250046, CA250481, CA251443, CA253248, CA253472, CA253540, CA253547, CA253553, CA254200, CA254886, CA256054, CA256481, CA260432, CA261694, CA261701, CA261717, CA261719, CA261822, CA261841, CA261842, CA263001, CA264583, CA264610, CA264611, CA264620, CA267170, CA268069, CA268072, CA268083, CA268084, CA271273, CA274492, CA274494, CA274499, CA274502, CA274509, CA275808",,TRUE,,,,,list like
Tool Pubmed Id,The pubMed identifer associated with the development of the tool.,,,FALSE,,,,,int
