Attribute,Description,Valid Values,DependsOn,Required,Properties,Parent,DependsOn Component,Source,Validation Rules
Individual Primary Site,Primary site in the body associated with the primary diagnosis.,"Abdomen, Abdominal Wall, Acetabulum, Adjacent Organ, Adrenal Gland, Anal/Perianal, Ankle Joint, Anterior Skull Base, Anus, Appendix, Ascitic Fluid, Axilla, Axillary Nodes, Bladder, Bladder/Prostate, Bone, Bone Face, Bone Marrow, Bone or Bone Marrow, Brain, Brain/Leptomeninges, Breast, Bronchus, Buttock, Calcaneum, Carpal Bone, Cauda Equina Spinal Cord, Celiac Nodes, Central Nervous System, Cerebellum, Cerebrospinal Fluid, Cervical Nodes, Cervical Spine, Cervical Vertebra, Cervix, Cheek, Chest, Chest Wall, Choroid, Clavicle, Coccyx, Colon, Craniospinal, Cutaneous, Deep Facial Areas, Deep Gray (e.g. Basal ganglia or Thalamus), Dermis, Distant Lymph Nodes, Dorsal Spine, Duodenum, Ear - Lateral Skull Base and Nasopharynx, Elbow Joint, Epididymis, Epitrochlear, Epitrochlear or Brachial Nodes, Esophagus, Ethmoid Bone, Eyelid, Face, Fallopian Tube, Female Reproductive System Part, Femur, Fibula, Fibula Head, Finger, Foot, Foot Bone, Foot Joint, Foot Phalanges, Forearm, Fourth Ventricle, Frontal Bone, Frontal Cortex, Frontal Lobe, Gallbladder, Gastrointestinal Tract, Hand, Hand Bone, Hand Joint, Hand Phalanges, Head, Head and Neck, Heart, Hip, Hip/Inguinal Region, Humerus, Hypodermis, Hypopharynx, Iliac Crest, Ilium, Inferior Limb, Infraclavicular Nodes, Inguinal, Inguinal or Femoral Nodes, Intra-abdominal, Intraperitoneal, Intraspinal, Intrathoracic, Ischium, Kidney, Knee Joint, Lacrimal Bone, Large Vessels, Larynx, Larynx - Trachea, Lateral Ventricle, Leg, Leptomeningeal, Liver, Liver/Biliary Tract, Lower Arm, Lower Extremity, Lower Leg, Lumbar Spinal Cord, Lumbar Spine, Lumbar Vertebra, Lung, Lymph Node, Lymphatic Basin, Mandible, Maxilla, Mediastinum, Medulla, Meninges, Mesenteric Nodes, Metacarpals, Metatarsals, Midbrain, Middle Ear, Nasal Bone, Nasal Cavity, Nasal Cavity and Paranasal Sinuses, Nasal Septum, Nasopharynx, Neck, Not Reported, Occipital Bone, Occipital Cortex, Occipital Lobe, Oculus Dexter (Right Eye), Oculus Sinister (Left Eye), Oculus Uterque (Both Eyes), Omentum, Optic Chiasm, Optic Nerve, Oral Cavity, Orbit, Oropharynx, Other, Ovary, Pancreas, Para-Aortic Lymph Nodes, Paranasal Sinus, Parapharyngeal Area, Paraspinal, Paratesticular, Parathyroid, Parietal Bone, Parietal Cortex, Parietal Lobe, Parotid, Patella, Pectoral Nodes, Pelvis, Pelvis/Sacrum, Penis, Perineum, Peritoneum, Pineal, Pleura, Pleura Thymus, Pleural Effusion, Pons Varolii, Popliteal Nodes, Pre-auricular Nodes, Prostate, Radius Bone, Rectum, Regional Lymph Nodes, Retroperitoneum, Rib, Sacrococcygeal, Sacrum, Salivary Gland, Scalp, Scapula, Scapula/Clavicle, Schlemm's Canal, Shoulder, Shoulder Girdle, Shoulder Joint, Skin, Skull, Skull and Face Bone, Small Intestine, Soft Tissue, Soft Tissue; NOS, Sphenoid Bone, Spinal Cord, Spine, Spleen, Splenic Hilar Nodes, Sternum, Sternum/Chest Wall, Stomach, Superior Limb and Shoulder, Superior Maxilla, Supraclavicular Nodes, Suprasellar Pituitary, Talus, Tarsal Bone, Temporal Bone, Temporal Cortex, Temporal Lobe, Testis, Thalamus, Thigh, Third Ventricle, Thoracic Spinal Cord, Thoracic Vertebra, Thorax, Thymus, Thyroid, Thyroid and Parathyroid, Tibia, Toe, Tonsil, Trabecular Meshwork, Trachea, Trunk, Trunk - Paraspinal, Ulna, Unknown, Upper Airway, Upper Arm, Upper Extremity, Ureter, Urogenital, Uterus, Vagina, Vasculo-Nervous, Viscera, Vulva, Waldeyer's Ring, Wrist Joint, Zygomatic Bone",,FALSE,,,,CDS Imaging v1.0/Diagnosis,
Individual Tumor Subtype,"The subtype related to the scientific determination and investigation, analysis and recognition of the presence and nature of disease, condition, or injury from expressed signs and symptoms of tissue growth resulting from uncontrolled cell proliferation.",,,FALSE,,,,MC2/STE,str
Individual Tumor Grade,"Numeric value to express the degree of abnormality of cancer cells, a measure of differentiation and aggressiveness.","G1, G2, G3, G4, GX, GB, High Grade, Intermediate Grade, Low Grade, Unknown, Not Reported, Not Applicable",,FALSE,,,,CDS Imaging v1.0,
Individual Site of Origin,"The text term used to describe the anatomic site of origin, of the patient's malignant disease.","Abdominal Aorta, Abdominal Esophagus, Abdominal Muscle, Abdominal Skin, Abdominal Wall, Abducens Nerve, Accessory Nerve, Acetabulum, Acromioclavicular Joint, Adipose Tissue, Adrenal Cortex, Adrenal Gland, Adrenal Medulla, Ampulla of Vater, Anal Canal, Anal Transitional Zone, Ankle Joint, Ankle Skin, Antecubital Region, Anterior Cranial Fossa, Anterior Mediastinum, Anterior Surface of the Epiglottis, Anterior Wall of the Bladder, Anterior Wall of the Nasopharynx, Antrum Pylori, Anus, Aorta, Aortocaval Lymph Node, Apex of the Tongue, Aponeurosis, Appendage of the Uterus, Appendix, Areola, Arm Skin, Artery, Articular Cartilage, Aryepiglottic Fold, Arytenoid Cartilage, Ascending Colon, Autonomic Nervous System, Axilla, Axillary Artery, Axillary Lymph Node, Axillary Tail of the Breast, Back, Bartholin Gland, Basal Ganglia, Base of the Tongue, Biceps, Biceps Femoris, Bile Canaliculus, Bile Duct, Biliary Tract, Bladder, Bladder Neck, Bladder Trigone, Blood, Blood Vessel, Body of Stomach, Body of the Pancreas, Body of the Penis, Bone, Bone Marrow, Bone of the Extremity, Brachial Lymph Node, Brachial Plexus, Brachialis, Brain, Brain Dura Mater, Brain Stem, Brain Ventricle, Branchial Cleft Remnant, Breast, Broad Ligament, Bronchial Lymph Node, Bronchiole, Bronchus, Buccal Mucosa, Buttock, C1 Vertebra, C2 Vertebra, Calcaneum, Calf, Cardiac Atrium, Cardiac Ventricle, Carina, Carotid Artery, Carotid Body, Carpal Bone, Carpal Region, Cartilage, Cauda Equina, Cecum, Celiac Artery, Celiac Lymph Node, Central Nervous System, Central Portion of the Breast, Cerebellopontine Angle, Cerebellum, Cerebral Cortex, Cerebral Hemisphere, Cerebral Meninges, Cerebral Peduncle, Cerebral White Matter, Ceruminous Gland, Cervical Esophagus, Cervical Gland, Cervical Lymph Node, Cervix Uteri, Cheek, Chest, Chest Wall, Choroid, Choroid Plexus, Choroid Plexus of the Fourth Ventricle, Choroid Plexus of the Lateral Ventricle, Choroid Plexus of the Third Ventricle, Ciliary Body, Clitoris, Coccyx, Cochlear Nerve, Colon, Commissure of the Lip, Common Bile Duct, Concha, Conjunctiva, Connective Tissue, Conus Medullaris, Coracobrachialis, Cornea, Corneoscleral Limbus, Corpus Callosum, Corpus Striatum, Corpus Uteri, Costal Cartilage, Costovertebral Joint, Cowper Gland, Cranial Nerve, Craniopharyngeal Duct, Cricoid Cartilage, Cul-de-sac, Cuneiform Cartilage, Cystic Duct, Descending Colon, Diaphragm, Diaphragmatic Lymph Node, Dome of the Bladder, Duct of Gartner, Ductus Santorini, Duodenum, Dura Mater, Ear, Ear Skin, Ectocervix, Elbow Joint, Elbow Skin, Endocardium, Endocervix, Endocrine Gland, Endometrial Stroma, Endometrium, Ependyma, Epicardium, Epididymis, Epidural Spinal Canal Space, Epiglottis, Epitrochlear Lymph Node, Esophagus, Ethmoid Bone, Ethmoid Sinus, Eustachian Tube, External Acoustic Meatus, External Ear, External Lip, External Lower Lip, External Nose, External Upper Lip, Extrahepatic Bile Duct, Eye, Eyebrow, Eyelid, Facial Bone, Facial Nerve, Fallopian Tube, False Vocal Cord, Falx Cerebelli, Falx Cerebri, Fascia, Female Genitalia, Femoral Artery, Femoral Lymph Node, Femoral Nerve, Femur, Fibrous Tissue, Fibula, Finger, Fingernail, Flank, Floor of Mouth, Foot, Foot Bone, Foot Phalanx, Foot Skin, Forearm, Forehead, Fourth Ventricle, Frontal Bone, Frontal Lobe, Frontal Pole, Frontal Sinus, Fundus of the Stomach, Fundus Uteri, Gallbladder, Gastric Cardia, Gastric Lymph Node, Gastrocnemius Muscle, Gastroesophageal Junction, Gastrointestinal Tract, Gingiva, Gland of Littre, Glans Penis, Globus Pallidus, Glossopharyngeal Nerve, Glottis, Gluteus Maximus, Greater Curvature of the Stomach, Hand, Hand Digit 1, Hand Phalanx, Hand Skin, Hard Palate, Head and Neck Lymph Node, Head of the Pancreas, Head Skin, Heart, Helix, Hematopoietic System, Hepatic, Hepatic Duct, Hepatic Flexure, Hepatic Lymph Node, Hip, Hip Joint, Hippocampus, Humerus, Hymen, Hyoid Bone, Hypoglossal Nerve, Hypopharynx, Hypothalamus, Ileocecal Valve, Ileum, Iliac Artery, Iliac Lymph Node, Iliac Vein, Iliopsoas Muscle, Ilium, Inferior Vena Cava, Infraclavicular Lymph Node, Infraclavicular Region, Infratentorial Brain, Inguinal Lymph Node, Inguinal Region, Inner Canthus, Inner Ear, Intercostal Lymph Node, Intercostal Muscle, Intercostal Nerve, Internal Capsule, Internal Iliac Lymph Node, Internal Mammary Artery, Internal Mammary Lymph Node, Internal Nare, Intervertebral Disc, Intestine, Intra-Abdominal Lymph Node, Intrahepatic Bile Duct, Intraocular Route of Administration, Intrathoracic Lymph Node, Iris, Ischiorectal Fossa, Ischium, Islet of Langerhans, Isthmus Uteri, Jaw Bone, Jaw Joint, Jejunum, Joint, Kidney, Knee Joint, Knee Skin, Labium, Labium Majus, Labium Minus, Lacrimal Gland, Lacrimal Sac, Large Intestine, Laryngeal Cartilage, Larynx, Lateral Ventricle, Lateral Wall of the Bladder, Lateral Wall of the Nasopharynx, Lateral Wall of the Oropharynx, Lateral Wall of the Pharynx, Leg Skin, Lens, Lesser Curvature of the Stomach, Ligament, Lingual Tonsil, Lingula of the Lung, Lip, Liver, Lobule of the Auricle, Lower Extremity, Lower Gingiva, Lower Lobe of the Lung, Lower Third of the Esophagus, Lower-Inner Quadrant of the Breast, Lower-Outer Quadrant of the Breast, Lumbar Nerve, Lumbosacral Plexus, Lung, Lymph Node, Lymph Node of Inguinal Region or Leg, Lymphatic, Main Bronchus, Male Genitalia, Male Prepuce, Mammary Gland, Mandible, Masseter Muscle, Maxilla, Maxillary Sinus, Meckel Diverticulum, Median Nerve, Mediastinal Lymph Node, Mediastinum, Medulla Oblongata, Meibomian Gland, Meninges, Meniscus Lateralis, Meniscus Medialis, Mentum, Mesencephalon, Mesenteric Artery, Mesenteric Lymph Node, Mesentery, Mesonephric Duct, Mesonephros, Mesovarium, Metacarpal Bone, Metatarsal Bone, Middle Cranial Fossa, Middle Ear, Middle Lobe of the Right Lung, Middle Third of the Esophagus, Minor Salivary Gland, Mons Pubis, Mucosa of the Lip, Mucosa of the Lower Lip, Mucosa of the Upper Lip, Muscle, Musculus Latissimus Dorsi, Myocardium, Myometrium, Nasal Bone, Nasal Cartilage, Nasal Cavity, Nasal Septum, Nasal Turbinate, Nasolacrimal Duct, Nasopharynx, Neck Skin, Nerve, Nervous System, Nipple, Nose, Nostril, Obturator Lymph Node, Obturator Nerve, Occipital Bone, Occipital Lobe, Occipital Lymph Node, Oculomotor Muscle, Oculomotor Nerve, Olfactory Nerve, Omentum, Optic Chiasm, Optic Nerve, Optic Tract, Oral Cavity, Orbit, Oropharynx, Other Specified Parts of Pancreas, Outer Canthus, Ovary, Palate, Palatine Tonsil, Palmar Fascia, Pancreas, Pancreatic Duct, Pancreatic Lymph Node, Paraaortic Lymph Node, Paraganglion, Parametrium, Paranasal Sinus, Parasympathetic Nervous System, Parathyroid Gland, Paratracheal Lymph Node, Parietal Bone, Parietal Lobe, Parietal Pleura, Parotid Duct, Parotid Gland, Parotid Gland Lymph Node, Patella, Pectoral Lymph Node, Pectoralis Major, Pelvic Lymph Node, Pelvis, Penis, Pericardium, Perineum, Peripheral Nerve, Peritoneal Cavity, Peritoneum, Pharyngeal Tonsil, Pharynx, Pia Mater, Pineal Gland, Pituitary Gland, Placenta, Plantar Fascia, Plantar Region, Pleura, Pons Varolii, Popliteal Lymph Node, Portal Lymph Node, Postcricoid Region, Posterior Cranial Fossa, Posterior Mediastinum, Posterior Wall of the Bladder, Posterior Wall of the Hypopharynx, Posterior Wall of the Nasopharynx, Posterior Wall of the Oropharynx, Posterior Wall of the Pharynx, Preauricular Lymph Node, Prostate Gland, Prostatic Utricle, Psoas Muscle, Pubic Bone, Pubic Symphysis, Pulmonary, Pulmonary Hilar Lymph Node, Putamen, Pylorus, Pyriform Sinus, Quadriceps Muscle of the Thigh, Radial Artery, Radial Nerve, Radius Bone, Rathke Pouch, Rectosigmoid Colon, Rectosigmoid Region, Rectum, Rectus Abdominis, Renal, Renal Artery, Renal Calyx, Renal Pelvis, Reticuloendothelial System, Retina, Retromolar Trigone, Retroperitoneal Lymph Node, Retroperitoneum, Retropharyngeal Lymph Node, Round Ligament of the Uterus, Sacral Bone, Sacral Lymph Node, Sacral Nerve, Sacral Plexus, Salivary Gland, Scalene Lymph Node, Scalp, Scapula, Sciatic Nerve, Sclera, Scrotum, Sella Turcica, Seminal Vesicle, Shoulder, Shoulder Girdle, Shoulder Joint, Sigmoid Colon, Skeletal Muscle Tissue, Skin, Skin Of The Axilla, Skin of the Face, Skin of the Lip, Skin of the Lower Limb and Hip, Skin of the Scalp and Neck, Skin of the Trunk, Skin of the Upper Limb and Shoulder, Skull, Skullcap, Small Intestine, Spermatic Cord, Sphenoid Bone, Sphenoid Sinus, Sphincter of Oddi, Spinal Cord, Spinal Cord Dura Mater, Spinal Meninges, Spinal Nerve, Spleen, Splenic Flexure, Splenic Hilar Lymph Node, Sternocleidomastoid Muscle, Sternocostal Joint, Stomach, Subclavian Artery, Subcutis, Subglottis, Sublingual Lymph Node, Sublingual Salivary Gland, Submandibular Duct, Submandibular Gland, Submandibular Lymph Node, Superior Vena Cava, Superior Wall of the Nasopharynx, Supraclavicular, Supraclavicular Lymph Node, Supraglottis, Suprasellar Region, Supratentorial Brain, Sympathetic Nervous System, Synovial Bursa, Synovial Fluid, Tail of the Pancreas, Tarsal Bone, Temporal Bone, Temporal Lobe, Tendon, Tendon Sheath, Tentorium Cerebelli, Testis, Thalamus, Thigh, Third Ventricle, Thoracic Duct, Thoracic Esophagus, Thoracic Lymph Node, Thorax, Thymus Gland, Thyroglossal Duct, Thyroid Cartilage, Thyroid Gland, Tibia, Toe, Toenail, Tongue, Tonsillar Fossa, Tonsillar Pillar, Tooth Socket, Trachea, Tracheobronchial Lymph Node, Tragus, Transverse Colon, Trapezius Muscle, Triceps Brachii, Trigeminal Nerve, Trochlear Nerve, True Vocal Cord, Trunk, Tunica Vaginalis, Ulna, Ulnar Artery, Ulnar Nerve, Umbilicus, Uncus, Undescended Testes, Upper Extremity, Upper Gingiva, Upper Lobe of the Lung, Upper Third of the Esophagus, Upper-Inner Quadrant of the Breast, Upper-Outer Quadrant of the Breast, Urachus, Ureter, Ureteric Orifice, Ureteropelvic Junction, Urethra, Uterine Gland, Uterine Ligament, Uterus, Uvea, Uvula, Vagina, Vaginal Fornix, Vagus Nerve, Vallecula, Vas Deferens, Vein, Vena Cava, Vermis, Vertebra, Vertebral Column, Visceral Pleura, Vocal Cord, Vulva, Waldeyer's Tonsillar Ring, Wall of the Pharynx, Wrist Joint, Wrist Skin",,FALSE,,,,CDS Imaging v1.0,
Individual Age at Diagnosis,"Age at the time the individual was diagnosed, expressed in years.",,,FALSE,,,,CDS Imaging v1.0,num
Individual Gender,"Text designations that identify gender. Gender is described as the assemblage of properties that distinguish people on the basis of their societal roles. Identification of gender is based upon self-report and may come from a form, questionnaire, interview, etc.","Female, Male, Intersex, Unknown, Unspecified, Not Reported",,TRUE,,,,CDS Imaging v1.0/participant,str
Individual dbGaP Subject Id,The identifer assigned to the participant by dbGap,,,FALSE,,,,CDS Imaging v1.0,str
Individual Days to Last Followup,Number of days between the dates used for index and last follow-up,,,FALSE,,,,CDS Imaging v1.0,int
Individual Primary Tumor Stage,Extent of the primary cancer based on evidence obtained from clinical assessment parameters determined prior to treatment.,"Not Reported, T0, T1, T1a, T1a1, T1a2, T1b, T1b1, T1b2, T1c, T1mi, T2, T2a, T2a1, T2a2, T2b, T2c, T2d, T3, T3a, T3b, T3c, T3d, T4, T4a, T4b, T4c, T4d, T4e, T5, Ta, Tis, Tis (DCIS), Tis (LCIS), Tis (Paget's), TX, Unknown",,FALSE,,,,CDS Imaging v1.0,
Individual Tumor Lymph Node Stage,Extent of the regional lymph node involvement for the cancer based on evidence obtained from clinical assessment parameters determined prior to treatment.,"N0, N0 (i+), N0 (i-), N0 (mol+), N0 (mol-), N1, N1a, N1b, N1bI, N1bII, N1bIII, N1bIV, N1c, N1mi, N2, N2a, N2b, N2c, N3, N3a, N3b, N3c, N4, NX, Unknown, Not Reported",,FALSE,,,,CDS Imaging v1.0,
Individual Days To Recurrence,Number of days between the date used for index and the date the patient's disease recurred,,,FALSE,,,,CDS Imaging v1.0,int
Individual Days to Last Known Disease Status,"Time interval from the date of last follow up to the date of initial pathologic diagnosis, represented as a calculated number of days.",,,FALSE,,,,CDS Imaging v1.0,int
Individual Treatment Type,Text term that describes the kind of treatment administered.,"3-Dimensional Conformal Radiation Therapy, Allogeneic Hematopoietic Stem Cell Transplantation, Autologous Stem Cell Transplantation, Brachytherapy, Cellular Therapy, Chemotherapy, Concurrent Chemoradiation, Conventional Radiotherapy, Electron Beam Radiation Therapy, External Beam Radiation Therapy, High-Dose Rate Brachytherapy, Hormone Therapy, Immunotherapy, Intensity-Modulated Radiation Therapy, Low-Dose Rate Brachytherapy, Not Reported, Organ Transplantation, Palliative Care, Pharmacotherapy, Photon Beam Radiation Therapy, Proton Beam Radiation Therapy, Radiation Therapy, Radiofrequency Ablation, Radiopharmaceutical, Stem Cell Transplant, Stereotactic Body Radiation Therapy, Stereotactic Radiosurgery, Surgical Procedure, Targeted Molecular Therapy, Unknown",,FALSE,,,,CDS Imaging v1.0,
Individual Days to Treatment,Number of days between the date used for index and the date the treatment started.,,,FALSE,,,,CDS Imaging v1.0,int
