Attribute,Description,Valid Values,DependsOn,Required,Properties,Parent,DependsOn Component,Source,Validation Rules
Model Site of Origin,The text term used to describe the anatomic site of origin associated with the malignant disease model.,"Abdominal Aorta, Abdominal Esophagus, Abdominal Muscle, Abdominal Skin, Abdominal Wall, Abducens Nerve, Accessory Nerve, Acetabulum, Acromioclavicular Joint, Adipose Tissue, Adrenal Cortex, Adrenal Gland, Adrenal Medulla, Ampulla of Vater, Anal Canal, Anal Transitional Zone, Ankle Joint, Ankle Skin, Antecubital Region, Anterior Cranial Fossa, Anterior Mediastinum, Anterior Surface of the Epiglottis, Anterior Wall of the Bladder, Anterior Wall of the Nasopharynx, Antrum Pylori, Anus, Aorta, Aortocaval Lymph Node, Apex of the Tongue, Aponeurosis, Appendage of the Uterus, Appendix, Areola, Arm Skin, Artery, Articular Cartilage, Aryepiglottic Fold, Arytenoid Cartilage, Ascending Colon, Autonomic Nervous System, Axilla, Axillary Artery, Axillary Lymph Node, Axillary Tail of the Breast, Back, Bartholin Gland, Basal Ganglia, Base of the Tongue, Biceps, Biceps Femoris, Bile Canaliculus, Bile Duct, Biliary Tract, Bladder, Bladder Neck, Bladder Trigone, Blood, Blood Vessel, Body of Stomach, Body of the Pancreas, Body of the Penis, Bone, Bone Marrow, Bone of the Extremity, Brachial Lymph Node, Brachial Plexus, Brachialis, Brain, Brain Dura Mater, Brain Stem, Brain Ventricle, Branchial Cleft Remnant, Breast, Broad Ligament, Bronchial Lymph Node, Bronchiole, Bronchus, Buccal Mucosa, Buttock, C1 Vertebra, C2 Vertebra, Calcaneum, Calf, Cardiac Atrium, Cardiac Ventricle, Carina, Carotid Artery, Carotid Body, Carpal Bone, Carpal Region, Cartilage, Cauda Equina, Cecum, Celiac Artery, Celiac Lymph Node, Central Nervous System, Central Portion of the Breast, Cerebellopontine Angle, Cerebellum, Cerebral Cortex, Cerebral Hemisphere, Cerebral Meninges, Cerebral Peduncle, Cerebral White Matter, Ceruminous Gland, Cervical Esophagus, Cervical Gland, Cervical Lymph Node, Cervix Uteri, Cheek, Chest, Chest Wall, Choroid, Choroid Plexus, Choroid Plexus of the Fourth Ventricle, Choroid Plexus of the Lateral Ventricle, Choroid Plexus of the Third Ventricle, Ciliary Body, Clitoris, Coccyx, Cochlear Nerve, Colon, Commissure of the Lip, Common Bile Duct, Concha, Conjunctiva, Connective Tissue, Conus Medullaris, Coracobrachialis, Cornea, Corneoscleral Limbus, Corpus Callosum, Corpus Striatum, Corpus Uteri, Costal Cartilage, Costovertebral Joint, Cowper Gland, Cranial Nerve, Craniopharyngeal Duct, Cricoid Cartilage, Cul-de-sac, Cuneiform Cartilage, Cystic Duct, Descending Colon, Diaphragm, Diaphragmatic Lymph Node, Dome of the Bladder, Duct of Gartner, Ductus Santorini, Duodenum, Dura Mater, Ear, Ear Skin, Ectocervix, Elbow Joint, Elbow Skin, Endocardium, Endocervix, Endocrine Gland, Endometrial Stroma, Endometrium, Ependyma, Epicardium, Epididymis, Epidural Spinal Canal Space, Epiglottis, Epitrochlear Lymph Node, Esophagus, Ethmoid Bone, Ethmoid Sinus, Eustachian Tube, External Acoustic Meatus, External Ear, External Lip, External Lower Lip, External Nose, External Upper Lip, Extrahepatic Bile Duct, Eye, Eyebrow, Eyelid, Facial Bone, Facial Nerve, Fallopian Tube, False Vocal Cord, Falx Cerebelli, Falx Cerebri, Fascia, Female Genitalia, Femoral Artery, Femoral Lymph Node, Femoral Nerve, Femur, Fibrous Tissue, Fibula, Finger, Fingernail, Flank, Floor of Mouth, Foot, Foot Bone, Foot Phalanx, Foot Skin, Forearm, Forehead, Fourth Ventricle, Frontal Bone, Frontal Lobe, Frontal Pole, Frontal Sinus, Fundus of the Stomach, Fundus Uteri, Gallbladder, Gastric Cardia, Gastric Lymph Node, Gastrocnemius Muscle, Gastroesophageal Junction, Gastrointestinal Tract, Gingiva, Gland of Littre, Glans Penis, Globus Pallidus, Glossopharyngeal Nerve, Glottis, Gluteus Maximus, Greater Curvature of the Stomach, Hand, Hand Digit 1, Hand Phalanx, Hand Skin, Hard Palate, Head and Neck Lymph Node, Head of the Pancreas, Head Skin, Heart, Helix, Hematopoietic System, Hepatic, Hepatic Duct, Hepatic Flexure, Hepatic Lymph Node, Hip, Hip Joint, Hippocampus, Humerus, Hymen, Hyoid Bone, Hypoglossal Nerve, Hypopharynx, Hypothalamus, Ileocecal Valve, Ileum, Iliac Artery, Iliac Lymph Node, Iliac Vein, Iliopsoas Muscle, Ilium, Inferior Vena Cava, Infraclavicular Lymph Node, Infraclavicular Region, Infratentorial Brain, Inguinal Lymph Node, Inguinal Region, Inner Canthus, Inner Ear, Intercostal Lymph Node, Intercostal Muscle, Intercostal Nerve, Internal Capsule, Internal Iliac Lymph Node, Internal Mammary Artery, Internal Mammary Lymph Node, Internal Nare, Intervertebral Disc, Intestine, Intra-Abdominal Lymph Node, Intrahepatic Bile Duct, Intraocular Route of Administration, Intrathoracic Lymph Node, Iris, Ischiorectal Fossa, Ischium, Islet of Langerhans, Isthmus Uteri, Jaw Bone, Jaw Joint, Jejunum, Joint, Kidney, Knee Joint, Knee Skin, Labium, Labium Majus, Labium Minus, Lacrimal Gland, Lacrimal Sac, Large Intestine, Laryngeal Cartilage, Larynx, Lateral Ventricle, Lateral Wall of the Bladder, Lateral Wall of the Nasopharynx, Lateral Wall of the Oropharynx, Lateral Wall of the Pharynx, Leg Skin, Lens, Lesser Curvature of the Stomach, Ligament, Lingual Tonsil, Lingula of the Lung, Lip, Liver, Lobule of the Auricle, Lower Extremity, Lower Gingiva, Lower Lobe of the Lung, Lower Third of the Esophagus, Lower-Inner Quadrant of the Breast, Lower-Outer Quadrant of the Breast, Lumbar Nerve, Lumbosacral Plexus, Lung, Lymph Node, Lymph Node of Inguinal Region or Leg, Lymphatic, Main Bronchus, Male Genitalia, Male Prepuce, Mammary Gland, Mandible, Masseter Muscle, Maxilla, Maxillary Sinus, Meckel Diverticulum, Median Nerve, Mediastinal Lymph Node, Mediastinum, Medulla Oblongata, Meibomian Gland, Meninges, Meniscus Lateralis, Meniscus Medialis, Mentum, Mesencephalon, Mesenteric Artery, Mesenteric Lymph Node, Mesentery, Mesonephric Duct, Mesonephros, Mesovarium, Metacarpal Bone, Metatarsal Bone, Middle Cranial Fossa, Middle Ear, Middle Lobe of the Right Lung, Middle Third of the Esophagus, Minor Salivary Gland, Mons Pubis, Mucosa of the Lip, Mucosa of the Lower Lip, Mucosa of the Upper Lip, Muscle, Musculus Latissimus Dorsi, Myocardium, Myometrium, Nasal Bone, Nasal Cartilage, Nasal Cavity, Nasal Septum, Nasal Turbinate, Nasolacrimal Duct, Nasopharynx, Neck Skin, Nerve, Nervous System, Nipple, Nose, Nostril, Obturator Lymph Node, Obturator Nerve, Occipital Bone, Occipital Lobe, Occipital Lymph Node, Oculomotor Muscle, Oculomotor Nerve, Olfactory Nerve, Omentum, Optic Chiasm, Optic Nerve, Optic Tract, Oral Cavity, Orbit, Oropharynx, Other Specified Parts of Pancreas, Outer Canthus, Ovary, Palate, Palatine Tonsil, Palmar Fascia, Pancreas, Pancreatic Duct, Pancreatic Lymph Node, Paraaortic Lymph Node, Paraganglion, Parametrium, Paranasal Sinus, Parasympathetic Nervous System, Parathyroid Gland, Paratracheal Lymph Node, Parietal Bone, Parietal Lobe, Parietal Pleura, Parotid Duct, Parotid Gland, Parotid Gland Lymph Node, Patella, Pectoral Lymph Node, Pectoralis Major, Pelvic Lymph Node, Pelvis, Penis, Pericardium, Perineum, Peripheral Nerve, Peritoneal Cavity, Peritoneum, Pharyngeal Tonsil, Pharynx, Pia Mater, Pineal Gland, Pituitary Gland, Placenta, Plantar Fascia, Plantar Region, Pleura, Pons Varolii, Popliteal Lymph Node, Portal Lymph Node, Postcricoid Region, Posterior Cranial Fossa, Posterior Mediastinum, Posterior Wall of the Bladder, Posterior Wall of the Hypopharynx, Posterior Wall of the Nasopharynx, Posterior Wall of the Oropharynx, Posterior Wall of the Pharynx, Preauricular Lymph Node, Prostate Gland, Prostatic Utricle, Psoas Muscle, Pubic Bone, Pubic Symphysis, Pulmonary, Pulmonary Hilar Lymph Node, Putamen, Pylorus, Pyriform Sinus, Quadriceps Muscle of the Thigh, Radial Artery, Radial Nerve, Radius Bone, Rathke Pouch, Rectosigmoid Colon, Rectosigmoid Region, Rectum, Rectus Abdominis, Renal, Renal Artery, Renal Calyx, Renal Pelvis, Reticuloendothelial System, Retina, Retromolar Trigone, Retroperitoneal Lymph Node, Retroperitoneum, Retropharyngeal Lymph Node, Round Ligament of the Uterus, Sacral Bone, Sacral Lymph Node, Sacral Nerve, Sacral Plexus, Salivary Gland, Scalene Lymph Node, Scalp, Scapula, Sciatic Nerve, Sclera, Scrotum, Sella Turcica, Seminal Vesicle, Shoulder, Shoulder Girdle, Shoulder Joint, Sigmoid Colon, Skeletal Muscle Tissue, Skin, Skin Of The Axilla, Skin of the Face, Skin of the Lip, Skin of the Lower Limb and Hip, Skin of the Scalp and Neck, Skin of the Trunk, Skin of the Upper Limb and Shoulder, Skull, Skullcap, Small Intestine, Spermatic Cord, Sphenoid Bone, Sphenoid Sinus, Sphincter of Oddi, Spinal Cord, Spinal Cord Dura Mater, Spinal Meninges, Spinal Nerve, Spleen, Splenic Flexure, Splenic Hilar Lymph Node, Sternocleidomastoid Muscle, Sternocostal Joint, Stomach, Subclavian Artery, Subcutis, Subglottis, Sublingual Lymph Node, Sublingual Salivary Gland, Submandibular Duct, Submandibular Gland, Submandibular Lymph Node, Superior Vena Cava, Superior Wall of the Nasopharynx, Supraclavicular, Supraclavicular Lymph Node, Supraglottis, Suprasellar Region, Supratentorial Brain, Sympathetic Nervous System, Synovial Bursa, Synovial Fluid, Tail of the Pancreas, Tarsal Bone, Temporal Bone, Temporal Lobe, Tendon, Tendon Sheath, Tentorium Cerebelli, Testis, Thalamus, Thigh, Third Ventricle, Thoracic Duct, Thoracic Esophagus, Thoracic Lymph Node, Thorax, Thymus Gland, Thyroglossal Duct, Thyroid Cartilage, Thyroid Gland, Tibia, Toe, Toenail, Tongue, Tonsillar Fossa, Tonsillar Pillar, Tooth Socket, Trachea, Tracheobronchial Lymph Node, Tragus, Transverse Colon, Trapezius Muscle, Triceps Brachii, Trigeminal Nerve, Trochlear Nerve, True Vocal Cord, Trunk, Tunica Vaginalis, Ulna, Ulnar Artery, Ulnar Nerve, Umbilicus, Uncus, Undescended Testes, Upper Extremity, Upper Gingiva, Upper Lobe of the Lung, Upper Third of the Esophagus, Upper-Inner Quadrant of the Breast, Upper-Outer Quadrant of the Breast, Urachus, Ureter, Ureteric Orifice, Ureteropelvic Junction, Urethra, Uterine Gland, Uterine Ligament, Uterus, Uvea, Uvula, Vagina, Vaginal Fornix, Vagus Nerve, Vallecula, Vas Deferens, Vein, Vena Cava, Vermis, Vertebra, Vertebral Column, Visceral Pleura, Vocal Cord, Vulva, Waldeyer's Tonsillar Ring, Wall of the Pharynx, Wrist Joint, Wrist Skin",,TRUE,,,,CDS Imaging v1.0/File information,
Model Primary Site,Primary site in the body associated with the primary diagnosis.,"Abdomen, Abdominal Wall, Acetabulum, Adjacent Organ, Adrenal Gland, Anal/Perianal, Ankle Joint, Anterior Skull Base, Anus, Appendix, Ascitic Fluid, Axilla, Axillary Nodes, Bladder, Bladder/Prostate, Bone, Bone Face, Bone Marrow, Bone or Bone Marrow, Brain, Brain/Leptomeninges, Breast, Bronchus, Buttock, Calcaneum, Carpal Bone, Cauda Equina Spinal Cord, Celiac Nodes, Central Nervous System, Cerebellum, Cerebrospinal Fluid, Cervical Nodes, Cervical Spine, Cervical Vertebra, Cervix, Cheek, Chest, Chest Wall, Choroid, Clavicle, Coccyx, Colon, Craniospinal, Cutaneous, Deep Facial Areas, Deep Gray (e.g. Basal ganglia or Thalamus), Dermis, Distant Lymph Nodes, Dorsal Spine, Duodenum, Ear - Lateral Skull Base and Nasopharynx, Elbow Joint, Epididymis, Epitrochlear, Epitrochlear or Brachial Nodes, Esophagus, Ethmoid Bone, Eyelid, Face, Fallopian Tube, Female Reproductive System Part, Femur, Fibula, Fibula Head, Finger, Foot, Foot Bone, Foot Joint, Foot Phalanges, Forearm, Fourth Ventricle, Frontal Bone, Frontal Cortex, Frontal Lobe, Gallbladder, Gastrointestinal Tract, Hand, Hand Bone, Hand Joint, Hand Phalanges, Head, Head and Neck, Heart, Hip, Hip/Inguinal Region, Humerus, Hypodermis, Hypopharynx, Iliac Crest, Ilium, Inferior Limb, Infraclavicular Nodes, Inguinal, Inguinal or Femoral Nodes, Intra-abdominal, Intraperitoneal, Intraspinal, Intrathoracic, Ischium, Kidney, Knee Joint, Lacrimal Bone, Large Vessels, Larynx, Larynx - Trachea, Lateral Ventricle, Leg, Leptomeningeal, Liver, Liver/Biliary Tract, Lower Arm, Lower Extremity, Lower Leg, Lumbar Spinal Cord, Lumbar Spine, Lumbar Vertebra, Lung, Lymph Node, Lymphatic Basin, Mandible, Maxilla, Mediastinum, Medulla, Meninges, Mesenteric Nodes, Metacarpals, Metatarsals, Midbrain, Middle Ear, Nasal Bone, Nasal Cavity, Nasal Cavity and Paranasal Sinuses, Nasal Septum, Nasopharynx, Neck, Not Reported, Occipital Bone, Occipital Cortex, Occipital Lobe, Oculus Dexter (Right Eye), Oculus Sinister (Left Eye), Oculus Uterque (Both Eyes), Omentum, Optic Chiasm, Optic Nerve, Oral Cavity, Orbit, Oropharynx, Other, Ovary, Pancreas, Para-Aortic Lymph Nodes, Paranasal Sinus, Parapharyngeal Area, Paraspinal, Paratesticular, Parathyroid, Parietal Bone, Parietal Cortex, Parietal Lobe, Parotid, Patella, Pectoral Nodes, Pelvis, Pelvis/Sacrum, Penis, Perineum, Peritoneum, Pineal, Pleura, Pleura Thymus, Pleural Effusion, Pons Varolii, Popliteal Nodes, Pre-auricular Nodes, Prostate, Radius Bone, Rectum, Regional Lymph Nodes, Retroperitoneum, Rib, Sacrococcygeal, Sacrum, Salivary Gland, Scalp, Scapula, Scapula/Clavicle, Schlemm's Canal, Shoulder, Shoulder Girdle, Shoulder Joint, Skin, Skull, Skull and Face Bone, Small Intestine, Soft Tissue, Soft Tissue; NOS, Sphenoid Bone, Spinal Cord, Spine, Spleen, Splenic Hilar Nodes, Sternum, Sternum/Chest Wall, Stomach, Superior Limb and Shoulder, Superior Maxilla, Supraclavicular Nodes, Suprasellar Pituitary, Talus, Tarsal Bone, Temporal Bone, Temporal Cortex, Temporal Lobe, Testis, Thalamus, Thigh, Third Ventricle, Thoracic Spinal Cord, Thoracic Vertebra, Thorax, Thymus, Thyroid, Thyroid and Parathyroid, Tibia, Toe, Tonsil, Trabecular Meshwork, Trachea, Trunk, Trunk - Paraspinal, Ulna, Unknown, Upper Airway, Upper Arm, Upper Extremity, Ureter, Urogenital, Uterus, Vagina, Vasculo-Nervous, Viscera, Vulva, Waldeyer's Ring, Wrist Joint, Zygomatic Bone",,FALSE,,,,CDS v5.0.4/Diagnosis,
Model Days to Treatment,Number of days between the date used for index and the date the treatment started.,,,FALSE,,,,CDS v5.0.4/Treatment,
Model Treatment Response,Text term that describes the model's response after the treatment was administered.,"Complete Response, No Evidence of Disease, No Response, Not Applicable, Not Evaluable, Not Reported, Partial Response, Persistent Disease, Progressive Disease, Stable Disease, Unknown",,FALSE,,,,CDS v5.0.4/Treatment,
Name,Name of the individual,,,TRUE,,,,,
Alternative Names,"Other ways the individual's name is displayed. Multiple values permitted, comma separated.",,,FALSE,,,,,list like
Email,Email address of the individual,,,FALSE,,,,,
Url,"URL, e.g., individual's home page address",,,FALSE,,,,,
Orcid Id,Unique identifier (ORCID ID) of the individual,,,FALSE,,,,,regex search \d{4}\-\d{4}\-\d{4}\-\d{3}(\d|X)
Synapse Profile Id,Unique identifier (Synapse Profile ID) of the individual. See identifer in the url of the synapse profile page. ,,,FALSE,,,,,unique
Last Known Institution,Last known institutional affiliation of the individual.,,,TRUE,,,,,
Working Group Participation,"CSBC/PSON working group(s) of which the individual is a member (current and former). Multiple values permitted, comma separated.","Cancer Metabolism, Cell and Tissue Mechanics, Education and Outreach, Image Analysis, Navigating Cancer with Science and Art, None, Patient Advocacy Working Group, Protein-Protein Interactions, Resource and Data Sharing",,TRUE,,,,,list like
Chair Roles,"Committee or working group chair role(s) the individual fulfilled (current and former). Multiple values permitted, comma separated.","Annual Meeting, None, Steering Committee, Working Group",,TRUE,,,,,list like
Consent For Portal Display,Consent from individual to display Person information in the CCKP,"No, Yes",,TRUE,,,,,
Portal Display,Display content in CCKP,"FALSE, TRUE",,TRUE,,,,,
Person View,The denormalized manifest for person submission.,,"Component, PersonView_id, GrantView Key, Person Consortium Name, Name, Alternative Names, Email, Url, Orcid Id, Synapse Profile Id, Last Known Institution, Working Group Participation, Chair Roles, Consent For Portal Display, Portal Display, Person Publications, Person Datasets, Person Tools, Person Educational Resources",FALSE,,,Grant View,,
Person Grant Number,"Grant number(s) associated with the person. Multiple values permitted, comma separated.","Affiliated/Non-Grant Associated, CA184897, CA184898, CA188388, CA193313, CA193417, CA193419, CA193461, CA193489, CA195469, CA199315, CA202123, CA202144, CA202177, CA202229, CA202241, CA209891, CA209923, CA209971, CA209975, CA209978, CA209988, CA209992, CA209997, CA210152, CA210173, CA210180, CA210181, CA210184, CA210190, CA214282, CA214292, CA214297, CA214300, CA214354, CA214369, CA214381, CA214411, CA215709, CA215794, CA215798, CA215845, CA215848, CA217297, CA217376, CA217377, CA217378, CA217450, CA217456, CA217514, CA217613, CA217617, CA217655, CA220378, CA223976, CA224012, CA224013, CA224044, CA225088, CA225566, CA227136, CA227544, CA227550, CA228608, CA228963, CA231978, CA232137, CA232161, CA232209, CA232216, CA232382, CA232517, CA234787, CA235747, CA238475, CA238720, CA238728, CA240301, CA241137, CA241927, CA243004, CA243007, CA243072, CA243073, CA243075, CA244100, CA244101, CA244107, CA244109, CA245313, CA248890, CA249799, CA250040, CA250044, CA250046, CA250481, CA251443, CA253248, CA253472, CA253540, CA253547, CA253553, CA254200, CA254886, CA256054, CA256481, CA260432, CA261694, CA261701, CA261717, CA261719, CA261822, CA261841, CA261842, CA263001, CA264583, CA264610, CA264611, CA264620, CA267170, CA268069, CA268072, CA268083, CA268084, CA271273, CA274492, CA274494, CA274499, CA274502, CA274509, CA275808, CA279408, CA279560, CA280984, CA280849, CA280829, CA284090, CA284086, CA274504, CA283114, CA274507, CA274506, CA274511, CA282451, CA284085, CA283749, CA289564, CA293470, CA279722, CA290115, CA279948, CA281216, CA292382, CA290442, CA293853",,TRUE,,,,,list like
Person Consortium Name,"Consortium(s) associated with the person. Multiple values permitted, comma separated.","CCBIR, CSBC, HTAN, ICBP, MetNet, NCI, NCI Clinical and Translational Exploratory/Developmental Studies, PDMC, PS-ON, Sage Bionetworks, TEC",,TRUE,,,,,list like
Person Publications,"A list of the pubmed Ids associated with the person. Multiple values permitted, comma separated.",,,FALSE,,,,,list like
Person Datasets,"A list of the dataset aliases (An alias of the dataset must be unique. Can be the GEO identifier such as GSE12345, or a DOI. No Greek Letters) associated with the person. Multiple values permitted, comma separated.",,,FALSE,,,,,list like
Person Tools,"A list of the tool names associated with the person. Multiple values permitted, comma separated.",,,FALSE,,,,,list like
Person Educational Resources,"A list of educational resource identifiers associated with the person. Multiple values permitted, comma separated.",,,FALSE,,,,,list like
PersonView_id,A unique primary key that enables record updates using schematic.,,,TRUE,,,,,unique
Project Name,Name of the project,,,TRUE,,,,,
Project Type,Type of project,"Core, Project",,TRUE,,,,,
Project Description,Description of the project,,,TRUE,,,,,
Project Investigator,Investigator(s) associated witht the project.,,,TRUE,,,,,list like
Project View,The denormalized manifest for project submission.,,"Component, ProjectView_id, GrantView Key, Project Name, Project Type, Project Description, Project Investigator",FALSE,,,Grant View,,
Project Grant Number,Grant number(s) associated with the project,"Affiliated/Non-Grant Associated, CA184897, CA184898, CA188388, CA193313, CA193417, CA193419, CA193461, CA193489, CA195469, CA199315, CA202123, CA202144, CA202177, CA202229, CA202241, CA209891, CA209923, CA209971, CA209975, CA209978, CA209988, CA209992, CA209997, CA210152, CA210173, CA210180, CA210181, CA210184, CA210190, CA214282, CA214292, CA214297, CA214300, CA214354, CA214369, CA214381, CA214411, CA215709, CA215794, CA215798, CA215845, CA215848, CA217297, CA217376, CA217377, CA217378, CA217450, CA217456, CA217514, CA217613, CA217617, CA217655, CA220378, CA223976, CA224012, CA224013, CA224044, CA225088, CA225566, CA227136, CA227544, CA227550, CA228608, CA228963, CA231978, CA232137, CA232161, CA232209, CA232216, CA232382, CA232517, CA234787, CA235747, CA238475, CA238720, CA238728, CA240301, CA241137, CA241927, CA243004, CA243007, CA243072, CA243073, CA243075, CA244100, CA244101, CA244107, CA244109, CA245313, CA248890, CA249799, CA250040, CA250044, CA250046, CA250481, CA251443, CA253248, CA253472, CA253540, CA253547, CA253553, CA254200, CA254886, CA256054, CA256481, CA260432, CA261694, CA261701, CA261717, CA261719, CA261822, CA261841, CA261842, CA263001, CA264583, CA264610, CA264611, CA264620, CA267170, CA268069, CA268072, CA268083, CA268084, CA271273, CA274492, CA274494, CA274499, CA274502, CA274509, CA275808, CA279408, CA279560, CA280984, CA280849, CA280829, CA284090, CA284086, CA274504, CA283114, CA274507, CA274506, CA274511, CA282451, CA284085, CA283749, CA289564, CA293470, CA279722, CA290115, CA279948, CA281216, CA292382, CA290442, CA293853",,TRUE,,,,,list like
Project Consortium Name,Consortia associated with the project.,"CCBIR, CSBC, HTAN, ICBP, MetNet, NCI, NCI Clinical and Translational Exploratory/Developmental Studies, PDMC, PS-ON, Sage Bionetworks, TEC",,TRUE,,,,,
ProjectView_id,A unique primary key that enables record updates using schematic.,,,TRUE,,,,,unique
Publication Doi,The digital object identifier associated with the publication in the form of https://www.doi.org/{doi} to comply with CrossRef DOI display guidelines.,,,FALSE,,,,,unique
Publication Journal,The name of the periodical publication in which the publication was published.,,,TRUE,,,,,
Pubmed Id,The PubMed identifier associated with the publication.,,,TRUE,,,,,unique
Pubmed Url,Pubmed URL for the publication,,,TRUE,,,,,url
Publication Title,Title of the publication,,,TRUE,,,,,
Publication Year,Year of the publication,,,TRUE,,,,,
Publication Keywords,"Keywords associated with the publication. Multiple values permitted, comma separated.",,,FALSE,,,,,list like
Publication Authors,"Authors of the publication. Multiple values permitted, comma separated.",,,TRUE,,,,,list like
Publication Abstract,The abstract of the publication.,,,TRUE,,,,,
