Attribute,Description,Valid Values,DependsOn,Required,Properties,Parent,DependsOn Component,Source,Validation Rules
Biospecimen,Metadata attributes for describing a tissue or tumor sample,,"Component, Biospecimen_id, Study Key, Individual Key, Model Key, Parent Biospecimen Key, Biospecimen Type Category, Biospecimen Type, Biospecimen Tumor Status, Biospecimen Acquisition Method, Biospecimen Incidence Type, Biospecimen Stain, Biospecimen Species, Biospecimen Sex, Biospecimen Age at Collection, Biospecimen Age at Collection Unit, Biospecimen Disease Type, Biospecimen Primary Site, Biospecimen Primary Diagnosis, Biospecimen Site of Origin, Biospecimen Tumor Subtype, Biospecimen Tumor Grade, Biospecimen Known Metastasis Sites, Biospecimen Tumor Morphology, Biospecimen Composition, Biospecimen Preservation Method, Biospecimen Fixative, Biospecimen Embedding Medium, Biospecimen Anatomic Site, Biospecimen Site of Resection or Biopsy, Biospecimen Timepoint Type, Biospecimen Timepoint Offset, Biospecimen Collection Site, Biospecimen Treatment Type, Biospecimen Therapeutic Agent, Biospecimen Treatment Response, Biospecimen Last Known Disease Status, Biospecimen BioSample Identifier, Biospecimen Description",FALSE,,,"Individual, Model",,
Biospecimen_id,"Unique ID associated with a biosample, used as a key for record linking and updates",,,TRUE,,,,MC2,unique
Biospecimen Type Category,The general category of this biospecimen.,"Analyte, Ascites, Blood, Bone Marrow, Cells, Fluids, Mouth Rinse, Sputum, Stool, Tissue, Urine",,TRUE,,,,HTAN,
Biospecimen Type,The type of biospecimen,"Additional - New Primary, Additional Metastatic, Analyte, Benign Neoplasms, Blood Buffy Coat, Blood Clot, Blood Derived Cancer - Bone Marrow, Blood Derived Cancer - Bone Marrow; Post-treatment, Blood Derived Cancer - Peripheral Blood, Blood Derived Cancer - Peripheral Blood; Post-treatment, Blood Derived Liquid Biopsy, Blood Derived Normal, Body Fluid, Bone Marrow Normal, Buccal Cell Normal, Cell, Cell Line Derived Xenograft Tissue, Cell Lines, Control Analyte, DNA, EBV Immortalized Normal, Expanded Next Generation Cancer Model, FFPE Recurrent, FFPE Scrolls, Fibroblasts from Bone Marrow Normal, GenomePlex (Rubicon) Amplified DNA, Granulocytes, Human Tumor Original Cells, In Situ Neoplasms, Lymphoid Normal, Metastatic, Mixed Adherent Suspension, Mononuclear Cells from Bone Marrow Normal, Neoplasms of Uncertain and Unknown Behavior, Next Generation Cancer Model, Next Generation Cancer Model Expanded Under Non-conforming Conditions, Not Allowed To Collect, Pleural Effusion, Post neo-adjuvant therapy, Primary Blood Derived Cancer - Bone Marrow, Primary Blood Derived Cancer - Peripheral Blood, Primary Tumor, Primary Xenograft Tissue, Recurrent Blood Derived Cancer - Bone Marrow, Recurrent Blood Derived Cancer - Peripheral Blood, Recurrent Tumor, Repli-G (Qiagen) DNA, Repli-G X (Qiagen) DNA, RNA, Saliva, Slides, Solid Tissue Normal, Tissue, Total RNA, Tumor, Tumor Adjacent Normal - Post Neo-adjuvant Therapy, Whole Animal, Whole Blood, Xenograft Tissue, Unknown, Not Reported",,FALSE,,,,HTAN,
Biospecimen Species,The species from which the biospecimen originates,"African Bush Elephant, Armadillo, Asian Elephant, Boar, Cat, Chicken, Cow, Dog, Escherichia coli, Guinea Pig, Horse, Human, Human Patient, Human Cell Line, Mouse, Multispecies, Not Applicable, Opossum, Rabbit, Rat, Rhesus monkey, Sheep, Trichoplax adhaerens, Unknown, Unspecified, Worm, Yeast, Fruit Fly, Zebrafish",,TRUE,,,,MC2,list like
Biospecimen Sex,Biological sex associated with the specimen donor,"Decline to answer, Don't know, Female, Intersex, Male, None of these describe me, Prefer not to answer, Unknown, X",,FALSE,,,,CDS Imaging v1.0,
Biospecimen Age at Collection,Age at the time the biospecimen was collected. Please provide the unit in field Biospecimen Age at Collection Unit.,,,FALSE,,,,HTAN,num
Biospecimen Age at Collection Unit,Unit associated with age at the time the biospecimen was collected.,,,FALSE,,,,HTAN,str
Biospecimen Disease Type,"The type of tumor associated with the specimen. Multiple values permitted, comma separated.","Acinar Cell Neoplasms, Adenomas and Adenocarcinomas, Adnexal and Skin Appendage Neoplasms, Basal Cell Neoplasms, Blood Vessel Tumors, Complex Mixed and Stromal Neoplasms, Cystic; Mucinous and Serous Neoplasms, Ductal and Lobular Neoplasms, Epithelial Neoplasms; NOS, Fibroepithelial Neoplasms, Fibromatous Neoplasms, Germ Cell Neoplasms, Giant Cell Tumors, Gliomas, Granular Cell Tumors and Alveolar Soft Part Sarcomas, Immunoproliferative Diseases, Leukemias, Lipomatous Neoplasms, Lymphatic Vessel Tumors, Mast Cell Neoplasm, Meningiomas, Mesothelial Neoplasms, Miscellaneous Bone Tumors, Miscellaneous Tumors, Mucoepidermoid Neoplasms, Myelodysplastic Syndromes, Myomatous Neoplasms, Myxomatous Neoplasms, Neoplasms; NOS, Nerve Sheath Tumors, Neuroepitheliomatous Neoplasms, Nevi and Melanomas, Not Applicable, Not Otherwise Specified, Not Reported, Odontogenic Tumors, Osseous and Chondromatous Neoplasms, Paragangliomas and Glomus Tumors, Plasma Cell Neoplasm, Soft Tissue Tumors and Sarcomas; NOS, Squamous Cell Neoplasms, Synovial-like Neoplasms, Thymic Epithelial Neoplasms, Transitional Cell Papillomas and Carcinomas, Trophoblastic neoplasms, Unknown",,FALSE,,,,MC2,
Biospecimen Tumor Subtype,"The subtype related to the scientific determination and investigation, analysis and recognition of the presence and nature of disease, condition, or injury from expressed signs and symptoms of tissue growth resulting from uncontrolled cell proliferation.",,,FALSE,,,,MC2/STE,str
Biospecimen Tumor Grade,"Numeric value to express the degree of abnormality of cancer cells, a measure of differentiation and aggressiveness.","G1, G2, G3, G4, GX, GB, High Grade, Intermediate Grade, Low Grade, Unknown, Not Reported, Not Applicable",,FALSE,,,,CDS Imaging v1.0,
Biospecimen Composition,"The text term used to describe the type(s) of tissue contained in the biospecimen. Multiple values permitted, comma separated.","Additional Primary, Atypia or hyperplasia, Local recurrence, Metastatic, Normal, Normal adjacent, Normal distant, NOS, Not applicable, Not reported, Premalignant, Premalignant - in situ, Primary, Recurrent, Tissue, Tumor post-adjuvant therapy, Tumor post-neoadjuvant therapy, Tumor post-therapy, Tumor specimen from de novo untreated malignancy of the bladder, Unknown, Xenograft",,FALSE,,,,CDS Imaging v1.0,list like
Biospecimen Tumor Status,Normal or Tumor Sample Pathology Indicator,"Tumor, Normal, Not Reported, Peritumoral, Unknown",,TRUE,,,,CDS Imaging v1.0/multiplex microscopy,
Biospecimen Preservation Method,Text term that represents the method used to preserve the sample.,"Cryopreserved, Cryopreservation in liquid nitrogen - dead tissue, Cryopreservation in dry ice - dead tissue, Cryopreservation in liquid nitrogen - live cells, Formalin fixed paraffin embedded - FFPE, Formalin fixed-unbuffered, Formalin fixed-buffered, Fresh, Fresh dissociated and single cell sorted into plates in NP40 buffer, OCT, Snap Frozen, Frozen, Negative 80 Deg C, Liquid Nitrogen, Fresh dissociated, Fresh dissociated and single cell sorted, Fresh dissociated and single cell sorted into plates, Methacarn fixed paraffin embedded - MFPE, unknown, Not Reported",,FALSE,,,,CDS Imaging v1.0,
Biospecimen Anatomic Site,Text term that represents the name of the primary disease site of the submitted tumor sample.,"4th ventricle, Abdomen, Abdominal mass, Abdominal Wall, Acetabulum, Adenoid, Adipose, Adrenal, Adrenal mass, Alveolar Ridge, Amniotic Fluid, Ampulla Of Vater, Anal Sphincter, Ankle, Anorectum, Antecubital Fossa, Antrum, Anus, Aorta, Aortic Body, Appendix, Aqueous Fluid, Arm, Artery, Ascending Colon, Ascending Colon Hepatic Flexure, Auditory Canal, Autonomic Nervous System, Axilla, Back, Bilateral, Bile Duct, Bladder, Blood, Blood Vessel, Bone, Bone marrow, Bone Marrow, Bone Marrow metastasis, Bowel, Brain, Brain stem, Brain Stem, Breast, Broad Ligament, Bronchiole, Bronchus, Brow, Buccal Cavity, Buccal Mucosa, Buttock, Calf, Capillary, Cardia, Carina, Carotid Artery, Carotid Body, Cartilage, Cecum, Cell-Line, Central Nervous System, Cerebellum, Cerebral Cortex, Cerebrospinal Fluid, Cerebrum, Cervical node, Cervical Spine, Cervix, Chest, Chest Wall, Chin, Clavicle, Clitoris, Colon, Colon - Mucosa Only, Common Duct, Conjunctiva, Connective Tissue, Dermal, Descending Colon, Diaphragm, Distal femur, Duodenum, Ear, Ear, Ear Canal, Effusion, Elbow, Endocrine Gland, Epididymis, Epidural Space, Esophageal; Distal, Esophageal; Mid, Esophageal; Proximal, Esophagogastric Junction, Esophagus, Esophagus - Mucosa Only, Eye, Fallopian Tube, Femoral Artery, Femoral Vein, Femur, Fibroblasts, Fibula, Finger, Floor Of Mouth, Fluid, Foot, Forearm, Forehead, Foreskin, Frontal Cortex, Frontal Lobe, Fundus Of Stomach, Gallbladder, Ganglia, Gastroesophageal Junction, Gastrointestinal Tract, Glottis, Groin, Gum, Hand, Hard Palate, Head & Neck, Head - Face Or Neck, Heart, Hepatic, Hepatic Duct, Hepatic Flexure, Hepatic Vein, Hip, Hippocampus, Humerus, Hypopharynx, Ileum, Ilium, Index Finger, Ischium, Islet Cells, Jaw, Jejunum, Joint, Kidney, Knee, L. Distal Femur, L. Femur, L. Kidney, L. Occipital mass, L. Proximal Tibia, Lacrimal Gland, Large Bowel, Laryngopharynx, Larynx, Left Bone marrow, Left thigh, Leg, Leptomeninges, Ligament, Lip, Liver, Liver metastasis, Lumbar Spine, Lung, Lung mass, Lung met, Lung metastasis, Lung/pleura, Lymph Node, Lymph Node met, Lymph Node(s) Axilla, Lymph Node(s) Cervical, Lymph Node(s) Distant, Lymph Node(s) Epitrochlear, Lymph Node(s) Femoral, Lymph Node(s) Hilar, Lymph Node(s) Iliac-Common, Lymph Node(s) Iliac-External, Lymph Node(s) Inguinal, Lymph Node(s) Internal Mammary, Lymph Node(s) Mammary, Lymph Node(s) Mesenteric, Lymph Node(s) Occipital, Lymph Node(s) Paraaortic, Lymph Node(s) Parotid, Lymph Node(s) Pelvic, Lymph Node(s) Popliteal, Lymph Node(s) Regional, Lymph Node(s) Retroperitoneal, Lymph Node(s) Scalene, Lymph Node(s) Splenic, Lymph Node(s) Subclavicular, Lymph Node(s) Submandibular, Lymph Node(s) Supraclavicular, Lymph Nodes(s) Mediastinal, Mandible, Maxilla, Mediastinal Soft Tissue, Mediastinum, Mesentery, Mesothelium, Middle Finger, Mitochondria, Muscle, Nails, Nasal Cavity, Nasal Soft Tissue, Nasopharynx, Neck, Nerve, Nerve(s) Cranial, Not Allowed To Collect, not reported, Not Reported, Not specified in data, Occipital Cortex, Ocular Orbits, Omentum, Oral Cavity, Oral Cavity - Mucosa Only, Orbit, Oropharynx, Os frontalis, Other, Ovary, Palate, Pancreas, Paracaval Lymph Node metastasis, Paranasal Sinuses, Paraspinal Ganglion, Paraspinal mass, Paratesticular, Parathyroid, Parotid Gland, Patella, Pelvis, Penis, Pericardium, Perineum, Periorbital Soft Tissue, Peripheral blood, Peritoneal Cavity, Peritoneum, Pharynx, Pineal, Pineal Gland, Pituitary Gland, Placenta, Pleura, Pleural effusion met, Popliteal Fossa, post mortem blood, post mortem liver, post mortem liver tumor, Posterior mediastil mass (mediastinum), Prostate, Pylorus, R. Breast metastasis, R. Buttock, R. Distal Femur, R. femur/rib/verebra, R. Humerus, R. Kidney, R. Neck mass, R. Parietal Lobe, R. Proximal Ulna, R. Sylvian Fissure, Rectosigmoid Junction, Rectum, Retina, Retro-Orbital Region, Retroperitoneal mass, Retroperitoneum, Rib, Right Bone marrow, Ring Finger, Round Ligament, Sacrum, Salivary Gland, Scalp, Scapula, Sciatic Nerve, Scrotum, Seminal Vesicle, Shoulder, Sigmoid Colon, Sinus, Sinus(es), Skeletal Muscle, Skin, Skull, Small Bowel, Small Bowel - Mucosa Only, Small Finger, Soft Tissue, Spinal Column, Spinal Cord, Spleen, Splenic Flexure, Sternum, Stomach, Stomach - Mucosa Only, Subcutaneous Tissue, Subglottis, Sublingual Gland, Submandibular Gland, Supraglottis, Synovium, Temporal Cortex, Tendon, Testis, Thigh, Thoracic Spine, Thorax, Throat, Thumb, Thymus, Thyroid, Tibia, Tongue, Tonsil, Tonsil (Pharyngeal), Trachea / Major Bronchi, Transverse Colon, Trunk, tumor, Umbilical Cord, Unknowm, Unknown, Ureter, Urethra, Urinary Tract, Uterus, Uvula, Vagina, Vas Deferens, Vein, Venous, Ventricular mass, Vertebra, Vulva, White Blood Cells, Wrist",,FALSE,,,,CDS Imaging v1.0/non-DICOM pathology,
Biospecimen Site of Resection or Biopsy,The text term used to describe the anatomic site of the resection or biopsy of the patient's malignant disease.,"Abdominal Aorta, Abdominal Esophagus, Abdominal Muscle, Abdominal Skin, Abdominal Wall, Abducens Nerve, Accessory Nerve, Acetabulum, Acromioclavicular Joint, Adipose Tissue, Adrenal Cortex, Adrenal Gland, Adrenal Medulla, Ampulla of Vater, Anal Canal, Anal Transitional Zone, Ankle Joint, Ankle Skin, Antecubital Region, Anterior Cranial Fossa, Anterior Mediastinum, Anterior Surface of the Epiglottis, Anterior Wall of the Bladder, Anterior Wall of the Nasopharynx, Antrum Pylori, Anus, Aorta, Aortocaval Lymph Node, Apex of the Tongue, Aponeurosis, Appendage of the Uterus, Appendix, Areola, Arm Skin, Artery, Articular Cartilage, Aryepiglottic Fold, Arytenoid Cartilage, Ascending Colon, Autonomic Nervous System, Axilla, Axillary Artery, Axillary Lymph Node, Axillary Tail of the Breast, Back, Bartholin Gland, Basal Ganglia, Base of the Tongue, Biceps, Biceps Femoris, Bile Canaliculus, Bile Duct, Biliary Tract, Bladder, Bladder Neck, Bladder Trigone, Blood, Blood Vessel, Body of Stomach, Body of the Pancreas, Body of the Penis, Bone, Bone Marrow, Bone of the Extremity, Brachial Lymph Node, Brachial Plexus, Brachialis, Brain, Brain Dura Mater, Brain Stem, Brain Ventricle, Branchial Cleft Remnant, Breast, Broad Ligament, Bronchial Lymph Node, Bronchiole, Bronchus, Buccal Mucosa, Buttock, C1 Vertebra, C2 Vertebra, Calcaneum, Calf, Cardiac Atrium, Cardiac Ventricle, Carina, Carotid Artery, Carotid Body, Carpal Bone, Carpal Region, Cartilage, Cauda Equina, Cecum, Celiac Artery, Celiac Lymph Node, Central Nervous System, Central Portion of the Breast, Cerebellopontine Angle, Cerebellum, Cerebral Cortex, Cerebral Hemisphere, Cerebral Meninges, Cerebral Peduncle, Cerebral White Matter, Ceruminous Gland, Cervical Esophagus, Cervical Gland, Cervical Lymph Node, Cervix Uteri, Cheek, Chest, Chest Wall, Choroid, Choroid Plexus, Choroid Plexus of the Fourth Ventricle, Choroid Plexus of the Lateral Ventricle, Choroid Plexus of the Third Ventricle, Ciliary Body, Clitoris, Coccyx, Cochlear Nerve, Colon, Commissure of the Lip, Common Bile Duct, Concha, Conjunctiva, Connective Tissue, Conus Medullaris, Coracobrachialis, Cornea, Corneoscleral Limbus, Corpus Callosum, Corpus Striatum, Corpus Uteri, Costal Cartilage, Costovertebral Joint, Cowper Gland, Cranial Nerve, Craniopharyngeal Duct, Cricoid Cartilage, Cul-de-sac, Cuneiform Cartilage, Cystic Duct, Descending Colon, Diaphragm, Diaphragmatic Lymph Node, Dome of the Bladder, Duct of Gartner, Ductus Santorini, Duodenum, Dura Mater, Ear, Ear Skin, Ectocervix, Elbow Joint, Elbow Skin, Endocardium, Endocervix, Endocrine Gland, Endometrial Stroma, Endometrium, Ependyma, Epicardium, Epididymis, Epidural Spinal Canal Space, Epiglottis, Epitrochlear Lymph Node, Esophagus, Ethmoid Bone, Ethmoid Sinus, Eustachian Tube, External Acoustic Meatus, External Ear, External Lip, External Lower Lip, External Nose, External Upper Lip, Extrahepatic Bile Duct, Eye, Eyebrow, Eyelid, Facial Bone, Facial Nerve, Fallopian Tube, False Vocal Cord, Falx Cerebelli, Falx Cerebri, Fascia, Female Genitalia, Femoral Artery, Femoral Lymph Node, Femoral Nerve, Femur, Fibrous Tissue, Fibula, Finger, Fingernail, Flank, Floor of Mouth, Foot, Foot Bone, Foot Phalanx, Foot Skin, Forearm, Forehead, Fourth Ventricle, Frontal Bone, Frontal Lobe, Frontal Pole, Frontal Sinus, Fundus of the Stomach, Fundus Uteri, Gallbladder, Gastric Cardia, Gastric Lymph Node, Gastrocnemius Muscle, Gastroesophageal Junction, Gastrointestinal Tract, Gingiva, Gland of Littre, Glans Penis, Globus Pallidus, Glossopharyngeal Nerve, Glottis, Gluteus Maximus, Greater Curvature of the Stomach, Hand, Hand Digit 1, Hand Phalanx, Hand Skin, Hard Palate, Head and Neck Lymph Node, Head of the Pancreas, Head Skin, Heart, Helix, Hematopoietic System, Hepatic, Hepatic Duct, Hepatic Flexure, Hepatic Lymph Node, Hip, Hip Joint, Hippocampus, Humerus, Hymen, Hyoid Bone, Hypoglossal Nerve, Hypopharynx, Hypothalamus, Ileocecal Valve, Ileum, Iliac Artery, Iliac Lymph Node, Iliac Vein, Iliopsoas Muscle, Ilium, Inferior Vena Cava, Infraclavicular Lymph Node, Infraclavicular Region, Infratentorial Brain, Inguinal Lymph Node, Inguinal Region, Inner Canthus, Inner Ear, Intercostal Lymph Node, Intercostal Muscle, Intercostal Nerve, Internal Capsule, Internal Iliac Lymph Node, Internal Mammary Artery, Internal Mammary Lymph Node, Internal Nare, Intervertebral Disc, Intestine, Intra-Abdominal Lymph Node, Intrahepatic Bile Duct, Intraocular Route of Administration, Intrathoracic Lymph Node, Iris, Ischiorectal Fossa, Ischium, Islet of Langerhans, Isthmus Uteri, Jaw Bone, Jaw Joint, Jejunum, Joint, Kidney, Knee Joint, Knee Skin, Labium, Labium Majus, Labium Minus, Lacrimal Gland, Lacrimal Sac, Large Intestine, Laryngeal Cartilage, Larynx, Lateral Ventricle, Lateral Wall of the Bladder, Lateral Wall of the Nasopharynx, Lateral Wall of the Oropharynx, Lateral Wall of the Pharynx, Leg Skin, Lens, Lesser Curvature of the Stomach, Ligament, Lingual Tonsil, Lingula of the Lung, Lip, Liver, Lobule of the Auricle, Lower Extremity, Lower Gingiva, Lower Lobe of the Lung, Lower Third of the Esophagus, Lower-Inner Quadrant of the Breast, Lower-Outer Quadrant of the Breast, Lumbar Nerve, Lumbosacral Plexus, Lung, Lymph Node, Lymph Node of Inguinal Region or Leg, Lymphatic, Main Bronchus, Male Genitalia, Male Prepuce, Mammary Gland, Mandible, Masseter Muscle, Maxilla, Maxillary Sinus, Meckel Diverticulum, Median Nerve, Mediastinal Lymph Node, Mediastinum, Medulla Oblongata, Meibomian Gland, Meninges, Meniscus Lateralis, Meniscus Medialis, Mentum, Mesencephalon, Mesenteric Artery, Mesenteric Lymph Node, Mesentery, Mesonephric Duct, Mesonephros, Mesovarium, Metacarpal Bone, Metatarsal Bone, Middle Cranial Fossa, Middle Ear, Middle Lobe of the Right Lung, Middle Third of the Esophagus, Minor Salivary Gland, Mons Pubis, Mucosa of the Lip, Mucosa of the Lower Lip, Mucosa of the Upper Lip, Muscle, Musculus Latissimus Dorsi, Myocardium, Myometrium, Nasal Bone, Nasal Cartilage, Nasal Cavity, Nasal Septum, Nasal Turbinate, Nasolacrimal Duct, Nasopharynx, Neck Skin, Nerve, Nervous System, Nipple, Nose, Nostril, Obturator Lymph Node, Obturator Nerve, Occipital Bone, Occipital Lobe, Occipital Lymph Node, Oculomotor Muscle, Oculomotor Nerve, Olfactory Nerve, Omentum, Optic Chiasm, Optic Nerve, Optic Tract, Oral Cavity, Orbit, Oropharynx, Other Specified Parts of Pancreas, Outer Canthus, Ovary, Palate, Palatine Tonsil, Palmar Fascia, Pancreas, Pancreatic Duct, Pancreatic Lymph Node, Paraaortic Lymph Node, Paraganglion, Parametrium, Paranasal Sinus, Parasympathetic Nervous System, Parathyroid Gland, Paratracheal Lymph Node, Parietal Bone, Parietal Lobe, Parietal Pleura, Parotid Duct, Parotid Gland, Parotid Gland Lymph Node, Patella, Pectoral Lymph Node, Pectoralis Major, Pelvic Lymph Node, Pelvis, Penis, Pericardium, Perineum, Peripheral Nerve, Peritoneal Cavity, Peritoneum, Pharyngeal Tonsil, Pharynx, Pia Mater, Pineal Gland, Pituitary Gland, Placenta, Plantar Fascia, Plantar Region, Pleura, Pons Varolii, Popliteal Lymph Node, Portal Lymph Node, Postcricoid Region, Posterior Cranial Fossa, Posterior Mediastinum, Posterior Wall of the Bladder, Posterior Wall of the Hypopharynx, Posterior Wall of the Nasopharynx, Posterior Wall of the Oropharynx, Posterior Wall of the Pharynx, Preauricular Lymph Node, Prostate Gland, Prostatic Utricle, Psoas Muscle, Pubic Bone, Pubic Symphysis, Pulmonary, Pulmonary Hilar Lymph Node, Putamen, Pylorus, Pyriform Sinus, Quadriceps Muscle of the Thigh, Radial Artery, Radial Nerve, Radius Bone, Rathke Pouch, Rectosigmoid Colon, Rectosigmoid Region, Rectum, Rectus Abdominis, Renal, Renal Artery, Renal Calyx, Renal Pelvis, Reticuloendothelial System, Retina, Retromolar Trigone, Retroperitoneal Lymph Node, Retroperitoneum, Retropharyngeal Lymph Node, Round Ligament of the Uterus, Sacral Bone, Sacral Lymph Node, Sacral Nerve, Sacral Plexus, Salivary Gland, Scalene Lymph Node, Scalp, Scapula, Sciatic Nerve, Sclera, Scrotum, Sella Turcica, Seminal Vesicle, Shoulder, Shoulder Girdle, Shoulder Joint, Sigmoid Colon, Skeletal Muscle Tissue, Skin, Skin Of The Axilla, Skin of the Face, Skin of the Lip, Skin of the Lower Limb and Hip, Skin of the Scalp and Neck, Skin of the Trunk, Skin of the Upper Limb and Shoulder, Skull, Skullcap, Small Intestine, Spermatic Cord, Sphenoid Bone, Sphenoid Sinus, Sphincter of Oddi, Spinal Cord, Spinal Cord Dura Mater, Spinal Meninges, Spinal Nerve, Spleen, Splenic Flexure, Splenic Hilar Lymph Node, Sternocleidomastoid Muscle, Sternocostal Joint, Stomach, Subclavian Artery, Subcutis, Subglottis, Sublingual Lymph Node, Sublingual Salivary Gland, Submandibular Duct, Submandibular Gland, Submandibular Lymph Node, Superior Vena Cava, Superior Wall of the Nasopharynx, Supraclavicular, Supraclavicular Lymph Node, Supraglottis, Suprasellar Region, Supratentorial Brain, Sympathetic Nervous System, Synovial Bursa, Synovial Fluid, Tail of the Pancreas, Tarsal Bone, Temporal Bone, Temporal Lobe, Tendon, Tendon Sheath, Tentorium Cerebelli, Testis, Thalamus, Thigh, Third Ventricle, Thoracic Duct, Thoracic Esophagus, Thoracic Lymph Node, Thorax, Thymus Gland, Thyroglossal Duct, Thyroid Cartilage, Thyroid Gland, Tibia, Toe, Toenail, Tongue, Tonsillar Fossa, Tonsillar Pillar, Tooth Socket, Trachea, Tracheobronchial Lymph Node, Tragus, Transverse Colon, Trapezius Muscle, Triceps Brachii, Trigeminal Nerve, Trochlear Nerve, True Vocal Cord, Trunk, Tunica Vaginalis, Ulna, Ulnar Artery, Ulnar Nerve, Umbilicus, Uncus, Undescended Testes, Upper Extremity, Upper Gingiva, Upper Lobe of the Lung, Upper Third of the Esophagus, Upper-Inner Quadrant of the Breast, Upper-Outer Quadrant of the Breast, Urachus, Ureter, Ureteric Orifice, Ureteropelvic Junction, Urethra, Uterine Gland, Uterine Ligament, Uterus, Uvea, Uvula, Vagina, Vaginal Fornix, Vagus Nerve, Vallecula, Vas Deferens, Vein, Vena Cava, Vermis, Vertebra, Vertebral Column, Visceral Pleura, Vocal Cord, Vulva, Waldeyer's Tonsillar Ring, Wall of the Pharynx, Wrist Joint, Wrist Skin",,FALSE,,,,HTAN,
