Attribute,Description,Valid Values,DependsOn,Required,Properties,Parent,DependsOn Component,Source,Validation Rules
community,The Sage Bionetworks project or initiative with which the dataset is associated.,,,FALSE,,,,Synapse Data Catalog,str
description,A text description of the dataset. Can be identifical to Dataset Description.,,,FALSE,,,,Synapse Data Catalog,str
contributor,"Organization(s), insitution(s), or person(s) that generated and/or deposited the data in Synapse. Can be identical to Grant Institution Name.",,,FALSE,,,,Synapse Data Catalog,list like
keywords,Keywords associated with the dataset. Can be identical to Publication Keywords.,,,TRUE,,,,Synapse Data Catalog,list like
individuals,"The number of participants or samples associated with the files in the dataset. Can be identical to Study Number of Participants, DSP Number of Participants, or DSP Number of Samples",,,FALSE,,,,Synapse Data Catalog,int
link,"The url where the dataset is displayed, typically on a public-facing data portal. Can be identical to Dataset Url.",,,FALSE,,,,Synapse Data Catalog,url
croissant,A Synapse url where the croissant file associated with this dataset is stored.,,,FALSE,,,,Synapse Data Catalog,url
DataCatalog,The manifest used to describe datasets for the Synapse Data Catalog.,,"Component, DataCatalog_id, community, description, contributors, keywords, individuals, link, croissant",FALSE,,,Study,Synapse Data Catalog,
DataCatalog_id,A unique primary key that enables record updates using schematic.,,,TRUE,,,,MC2,unique
accessType,Access type for the dataset.,"Anonymous, Open, Controlled, Private",,FALSE,,,,schema.org/dataset,str
alternateName,An altername name that can be used for search and discovery improvement.,,,FALSE,,,,schema.org/dataset,str
conditionsOfAccess,"Additional requirements a user may need outside of Data Use Modifiers. This could include additional registration, updating profile information, joining a Synapse Team, or using specific authentication methods like 2FA or RAS. Omit property if not applicable/unknown.",,,FALSE,,,,schema.org/dataset,str
countryOfOrigin,Origin of individuals from which data were generated. Omit if not applicable/unknown.,"AD, AE, AF, AG, AI, AL, AM, AO, AQ, AR, AS, AT, AU, AW, AX, AZ, BA, BB, BD, BE, BF, BG, BH, BI, BJ, BL, BM, BN, BO, BQ, BR, BS, BT, BV, BW, BY, BZ, CA, CC, CD, CF, CG, CH, CI, CK, CL, CM, CN, CO, CR, CU, CV, CW, CX, CY, CZ, DE, DJ, DK, DM, DO, DZ, EC, EE, EG, EH, ER, ES, ET, FI, FJ, FK, FM, FO, FR, GA, GB, GD, GE, GF, GG, GH, GI, GL, GM, GN, GP, GQ, GR, GS, GT, GU, GW, GY, HK, HM, HN, HR, HT, HU, ID, IE, IL, IM, IN, IO, IQ, IR, IS, IT, JE, JM, JO, JP, KE, KG, KH, KI, KM, KN, KP, KR, KW, KY, KZ, LA, LB, LC, LI, LK, LR, LS, LT, LU, LV, LY, MA, MC, MD, ME, MF, MG, MH, MK, ML, MM, MN, MO, MP, MQ, MR, MS, MT, MU, MV, MW, MX, MY, MZ, NA, NC, NE, NF, NG, NI, NL, NO, NP, NR, NU, NZ, OM, PA, PE, PF, PG, PH, PK, PL, PM, PN, PR, PS, PT, PW, PY, QA, RE, RO, RS, RU, RW, SA, SB, SC, SD, SE, SG, SH, SI, SJ, SK, SL, SM, SN, SO, SR, SS, ST, SV, SX, SY, SZ, TC, TD, TF, TG, TH, TJ, TK, TL, TM, TN, TO, TR, TT, TV, TW, TZ, UA, UG, UM, US, UY, UZ, VA, VC, VE, VG, VI, VN, VU, WF, WS, YE, YT, ZA, ZM, ZW",,FALSE,,,,schema.org/dataset,list like
creator,Organization or person that is creator of the dataset. Default is the PI of the project and/or the user who created all files in the dataset.,,,TRUE,,,,schema.org/dataset,str
dataUseModifiers,"List of data use ontology (DUO) terms that are true for dataset, which describes the allowable scope and terms for data use. Omit property if not applicable/unknown.","IRB, HMB, PUB, US, NPOA, COL, NCU, NPUNCU, RS, TS, NRES, NPU, DUM, POA, MOR, GSO, RTN, CC, NMDS, IS, GS, DS, GRU, PS",,FALSE,,,,schema.org/dataset,list like
datePublished,Date data were published/available on Synapse.,,,FALSE,,,,schema.org/dataset,int
funder,The entity(ies) responsible for funding the data contributors.,NIH,,FALSE,,,,schema.org/dataset,list like
includedInDataCatalog,Link(s) to known data catalog(s) the dataset is included in.,,,FALSE,,,,schema.org/dataset,str
license,"The terms and conditions underwhich the data are allowed to be accessed and used. Unless information for license is clear, this should default to UNKNOWN.","CC BY 3.0, CC BY 4.0, CC BY-NC 4.0, CC BY-NC 3.0, CC BY-SA 4.0, CC BY-NC-SA 4.0",,FALSE,,,,schema.org/dataset,str
measurementTechnique,Assay used to generate original data. Omit if not applicable (e.g. for curated dataset such as a list compounds from a database or text extracted from Wikipedia).,"10-cell RNA Sequencing, 16S Ribosomal Gene Sequencing Assay, 3' RNA-seq, 3C, 3C-qPCR, 3D ATAC-PALM, 3D Bioprinting, 3D Cell Culture, 4C, 5C, ATAC-Seq, ATP Bioluminescence Assay, Affinity Purification Mass Spectrometry, Allograft, Amplicon Sequencing, Angiogenesis Assay, Apoptosis Assay, Atomic Absorption Spectrophotometry, Atomic Absorption Spectroscopy, Atomic Force Microscopy, Autoradiography, Barcode-Seq, Bicinchoninic Acid Assay, Binding Assay, Bio-Layer Interferometry, Bioluminescence Imaging, Bisulfite Sequencing, Brightfield Microscopy, Brillouin Microscopy, CASFISH, CITE-seq, CLIP-qPCR, CRISPR, CUT&RUN, CUT&Tag-Sequencing, Cell Adhesion Assay, Cell Proliferation Assay, Cell Viability Assay, Cell-spreading Assay, CellTiter-Glo Luminescent Cell Viability Assay, Cerenkov Luminescence Imaging, ChIA-PET, ChIP-PCR, ChIP-Seq, ChIP-qPCR assay, Chemiluminescent Assay, Chemotaxis Assay, Circular Dichroism Spectroscopy, Co-Immunoprecipitation, Co-culture Assay, Collision-Induced Dissociation, Colorimetric Cell Viability Assay, Computational Modeling, Computational Tool, Computed Tomography, Confocal Microscopy, Confocal Reflectance Quantitative Phase Microscopy, Cross-Linking Immunoprecipitation High-throughput Sequencing, Cross-Linking Mass Spectrometry, Cyclic Immunofluorescence, Cytochemical Stain, Cytokine Expression Profile, Cytometric Bead Array Assay, Cytotoxicity Assay, DBiT-Seq, DNA Gene-Expression Microarray, DNA Methylation Array, DNA Sequencing, DNase-Seq, DRIP-seq, Dark Field Microscopy, Deep Mutational Scanning, Desorption Electrospray Ionization, Dideoxy Chain Termination DNA Sequencing, Differential Interference Contrast Microscopy, Differential Scanning Fluorimetry, Diffusion Weighted Imaging, Direct Long-Read RNA Sequencing, Drop-Seq, Droplet Digital PCR, Dual-Luciferase Reporter Assay, Dye Endocytosis Assay, Dynamic Contrast-Enhanced Magnetic Resonance Imaging, Dynamic Force Spectroscopy, Dynamic Light Scattering, Dynamic Susceptibility Contrast-Enhanced Magnetic Resonance Imaging, ELISA, Efferocytosis Assay, Electron Diffraction, Electron Microscopy, Electron Paramagnetic Resonance Spectroscopy, Electrophoretic Mobility Shift Assay, Electrospray Ionization Time-of-Flight Mass Spectrometry, Endotoxin Assay, Energy-Dispersive X-Ray Spectroscopy, Enzyme Activity Assay, Enzyme-Linked Immunospot Assay, Epidemiological Method, FAIRE-Seq, FISH, Flow Cytometry, Fluorescence Activated Cell Sorting, Fluorescence Correlation Spectroscopy, Fluorescence Imaging, Fluorescence Lifetime Imaging Microscopy, Fluorescence Microscopy, Fluorescence Recovery After Photo-Bleaching, Fluorescent Antibody Procedure, Fluorescent Cell Barcoding, Fluorescent In Situ Sequencing , Focused Ion Beam Scanning Electron Microscopy, Forster Resonance Energy Transfer, Fourier Transform Ion Cyclotron Resonance Mass Spectrometry, Fourier-Transform Infrared Spectroscopy, Gas Chromatography Mass Spectrometry, Gelatin Zymography, Genotyping, Global Chromatin Profiling, Global Run-On Sequencing, Graphite Furnace Atomic Absorption Spectrometry, HL-Chip, HPLC-MSMS, Hematoxylin and Eosin Staining Method, Hi-C, HiChIP, High Throughput Screening, High-Content Screen, Hydrogels, Hydrophilic Interaction Chromatography, Image Cytometry, Imaging, Immobilized Metal Affinity Chromatography, ImmunoFISH, Immunoassay, Immunocytochemistry, Immunohistochemistry Staining Method, Immunoprecipitation, In Situ Hybridization, In Vitro Cell Killing Assay, In Vitro Model, In Vitro Selection, In Vitro Translation, In Vivo Bioluminescence, In-Cell Western Assay, Inductively-Coupled Plasma Mass Spectrometry, Interference Reflection Microscopy, Intravital Microscopy, Invasion Assay, Karyotyping, Knife-Edge Scanning Microscopy, L1000 mRNA Profiling Assay, Lattice Light Sheet Microscopy, Liquid Chromatography Mass Spectrometry, Liquid Chromatography/Tandem Mass Spectrometry, Low-Vacuum Scanning Electron Microscopy, Luciferase Reporter Assay, Luminescent Cell Viability Assay, MALDI-TOF Mass Spectrometry, MEMA Cell Growth Assay, MNase-Seq, MULTI-Seq, Macrophage Polarization Assay, Magnetic Resonance Imaging, Magnetic Tweezers, Magnetic Twisting Cytometry, Magnetically Activated Cell Sorting, Mammosphere Formation Assay, Mass Cytometry, Mass Spectrometry, Mathematical Modeling, MeDIP, MeRIP-Seq, Methyl Binding Domain Sequencing, Methylation-Specific PCR, Micro-computed Tomography, MicroRNA Expression Array, MicroRNA Sequencing, Microcontact Printing, Microfluidics, Micropipette Adhesion Assay, Micropipette Aspiration, Microscopy, Migration Assay, Mint-ChIP, Modeling, Molecular Simulations, Monolayer Stress Microscopy, Multi-Angle Light Scattering, Multi-Isotope Mass Spectrometry, Multiparametric Magnetic Resonance Imaging, Multiphoton Microscopy, Multiplexed Error-Robust Fluorescence In Situ Hybridization, Multiplexed Immunofluorescence, Multiplexed Immunohistochemistry, Multiplexed Ion Beam Imaging, Murine Model, Nano-hmC-Seal, NanoString Digital Spatial Profiling, Nanopatterning, Nanopore Sequencing, Nanowire, Nested PCR, Next Generation Sequencing, Nm-seq, Not Applicable, Nuclear Magnetic Resonance, Optical Coherence Tomography, Optical Emission Spectroscopy, Optical Mapping, Optical Stretcher, Optical Tweezers, Optogenetic Assay, Organoid, PCR, PET-CT, Paraquat Survival Assay, Partial Wave Spectroscopy, Patient Derived Xenograft, Pending Annotation, Permeability Assay, Phagocytosis Assay, Photoacoustic Imaging, Photolithography, Plasmid Construction, PlateSeq, Point Accumulation for Imaging in Nanoscale Topography, Positron Emission Tomography, Precision Run-On Sequencing, Proteomics Assay, Proximity Ligation Assay, Pull-Down Assay, QFISH, Quantitative Multiplex Immunofluorescence, Quantitative Point Accumulation for Imaging in Nanoscale Topography, Questionnaire, RAS Protein Family Activation Assay, RIP, RIP-Seq, RNA Sequencing, RNAi Screen, RT-PCR, RT-qPCR, Raman Spectroscopy, Reduced Representation Bisulfite Sequencing, Reverse Phase Protein Array, Reverse-Phase High-Performance liquid Chromatography, Rheometry, Ribo-Seq, Ribosomal P Protein Antibody Measurement, Scanning Angle Interference Microscopy, Scanning Electron Microscopy, Second-Harmonic Imaging Microscopy, Shotgun Mass Spectrometry, Single Cell ATAC-Seq, Single Cell Cytokine Detection Chip Assay, Single Cell DNA Sequencing, Single Cell Gel Electrophoresis, Single Cell RNA-Sequencing, Single Molecule Forster Resonance Energy Transfer, Single Nucleotide Polymorphism Array, Single Nucleus RNA-Sequencing, Single-Cell BCR Sequencing, Single-Cell Barcode Chip, Single-Cell TCR Sequencing, Single-Molecule Tracking, Sirius Red Staining, Size Exclusion Chromatography, Small-Angle X-ray Scattering, Soft Agar Assay, Southern Blotting, Spectroscopy, Statistical Modeling, Stimulated Emission Depletion Microscopy, Stimulated Raman Scattering, Stochastic Optical Reconstruction Microscopy, Super-Resolution Microscopy, Surface Plasmon Resonance, Surveyor Nuclease Assay, Synaptophysin Staining Method, Synthetic Genetic Array, TAB-Seq, TCR Sequencing, TIRF Microscopy, TRAP Staining, TUNEL assay, Tandem Mass Spectrometry, Tandem Mass Tagging, Target Engagement Assay, Targeted Genome Sequencing, Targeted Transcriptome Sequencing, Thermal Shift Assay, Thin-Layer Chromatography, Tiling Array, Time Lapse Microscopy, Time-Correlated Single Photon Counting, Tissue Engineering, Tissue Microarray, Total Internal Reflection Fluorescence Microscopy, Traction Force Microscopy, Transmission Electron Microscopy, Transwell Assay, UPLC-MSMS, UV Photocrosslinking, Unspecified, Vibrational Spectroscopy, Virus Plaque Assay, Von Kossa Staining, Western Blotting, Whole Exome Sequencing, Whole Genome Bisulfite Sequencing, Whole Genome Sequencing, Widefield Fluorescence Microscopy, Wound-Healing Assay, X-Ray Crystallography, X-Ray Diffraction, X-Ray Micro-Computed Tomography, Xenograft, cDNA Array, eCLIP-Seq, mRNA Sequencing, qPCR, scCGI-seq, scNT-Seq, scSLAM-seq, seqFISH, shRNA, siRNA, smFISH, smRNA-seq, snRNA-seq, Isothermal Titration Calorimetry, Suspended Microchannel Resonator, 10x Multiome, Visium Spatial Gene Expression, Antitumor Drug Screening Assay, Bioelectrochemical Analysis, Chimeric Antigen Receptor T-Cell Therapy, Cell Cycle Assay, Clonality Analysis, Comparative Genomic Hybridization, Cryo-Electron Microscopy, Cryo-Electron Tomography, Data Integration, Field-Emission Scanning Electron Microscopy, Label-free Protein Quantification by LC/MS, Metabolite Profiling Assay, Reporter Gene Assay, Single-Molecule Localization Microscopy, Synthesis, Targeted Therapy Agent, Trichrome Staining Method, Ultrasound Imaging, Transcription profiling by NanoString, Alcian Blue Staining Method, Artificial Intelligence, Cell Culture, Clinical Study, Cell-free Circulating Tumor DNA Assay, Co-Immunoprecipitation Mass Spectrometry, Deep Learning, Fluorescent In Situ Sequencing, Gene Ontology Enrichment Analysis, Gene Set Enrichment Analysis, Gene Silencing , Human Induced Pluripotent Stem Cell-derived Cardiomyocytes Culture, Imaging Mass Cytometry, Immunofluorescent Staining Method, Immunotherapy, Viral Transduction, Metastatic Colonization Assay, Phylogenetic Analysis, Picrosirius Staining, Scratch Assay, Structural Variant Analysis, Survival Analysis, Targeted Error Correction Sequencing, Tuba-Seq, SDS-PAGE, Cell Fractionation, Multiscale Light Sheet Microscopy, Light Sheet Microscopy",,FALSE,,,,schema.org/dataset,list like
species,"Species of the organism(s) from which the data were generated. Omit property if not applicable, such as for data like compounds or other non-biological data.","African Bush Elephant, Armadillo, Asian Elephant, Boar, Cat, Chicken, Cow, Dog, Escherichia coli, Guinea Pig, Horse, Human, Human Patient, Human Cell Line, Mouse, Multispecies, Not Applicable, Opossum, Rabbit, Rat, Rhesus monkey, Sheep, Trichoplax adhaerens, Unknown, Unspecified, Worm, Yeast, Fruit Fly, Zebrafish",,FALSE,,,,schema.org/dataset,list like
subject,Applicable subject term(s) for dataset cataloging; use the Library of Congress Subject Headings (LCSH) scheme.,,,FALSE,,,,schema.org/dataset,list like
title,The name of the dataset.,,,TRUE,,,,schema.org/dataset,str
